2020-09-04 09:53:52 | INFO |  ============================================================ 
2020-09-04 09:53:52 | INFO | DYNAWO VERSION  :     1.3.0
2020-09-04 09:53:52 | INFO | DYNAWO REVISION :  1089_running_propagation-e5c34199
2020-09-04 09:53:52 | INFO |  ============================================================ 
2020-09-04 09:53:52 | INFO | 
2020-09-04 09:53:52 | INFO | -----------------------------------------------------------------------
2020-09-04 09:53:52 | INFO | building model from input files
2020-09-04 09:53:52 | INFO | -----------------------------------------------------------------------
2020-09-04 09:56:49 | INFO | model was built successfully
2020-09-04 09:56:49 | INFO | -----------------------------------------------------------------------
2020-09-04 09:56:49 | INFO | 
2020-09-04 09:56:49 | INFO | -----------------------------------------------------------------------
2020-09-04 09:56:49 | INFO | starting local initialization
2020-09-04 09:56:49 | INFO | -----------------------------------------------------------------------
2020-09-04 09:56:49 | DEBUG | ------------------------------
2020-09-04 09:56:49 | DEBUG | starting local initialization of model SM
2020-09-04 09:56:49 | DEBUG | local initialization of model SM ended successfully
2020-09-04 09:56:49 | INFO | end of local initialization
2020-09-04 09:56:49 | INFO | -----------------------------------------------------------------------
2020-09-04 09:56:49 | INFO | 
2020-09-04 09:56:49 | INFO | -----------------------------------------------------------------------
2020-09-04 09:56:49 | INFO | starting global initialization
2020-09-04 09:56:49 | INFO | -----------------------------------------------------------------------
2020-09-04 09:56:49 | DEBUG | initialization of IDA solver : ok
2020-09-04 09:56:49 | INFO | Algebraic mode change for model SM
2020-09-04 09:56:49 | DEBUG | call of SolverReInit ie a new symbolic and numerical factorization will be performed
2020-09-04 09:56:49 | DEBUG | call of SolverReInit ie a new symbolic and numerical factorization will be performed
2020-09-04 09:56:49 | DEBUG | call of SolverReInit ie a new symbolic and numerical factorization will be performed
2020-09-04 09:56:49 | INFO | end of global initialization
2020-09-04 09:56:49 | INFO | -----------------------------------------------------------------------
2020-09-04 09:56:49 | INFO | 
2020-09-04 09:56:49 | INFO | -----------------------------------------------------------------------
2020-09-04 09:56:49 | INFO | starting curve initialization
2020-09-04 09:56:49 | INFO | -----------------------------------------------------------------------
2020-09-04 09:56:49 | DEBUG | adding curve : Id: SM; curve: gen_cePu found. (exact name)
2020-09-04 09:56:49 | DEBUG | adding curve : Id: SM; curve: gen_PePu found. (exact name)
2020-09-04 09:56:49 | DEBUG | adding curve : Id: SM; curve: gen_cmPu found. (exact name)
2020-09-04 09:56:49 | DEBUG | adding curve : Id: SM; output: gen_PmPu found.( gen_PmPu_value )
2020-09-04 09:56:49 | DEBUG | adding curve : Id: SM; curve: gen_ufPu found. (exact name)
2020-09-04 09:56:49 | DEBUG | adding curve : Id: SM; output: gen_efdPu found.( gen_efdPu_value )
2020-09-04 09:56:49 | DEBUG | adding curve : Id: SM; output: gen_omegaPu found.( gen_omegaPu_value )
2020-09-04 09:56:49 | DEBUG | adding curve : Id: SM; curve: gen_theta found. (exact name)
2020-09-04 09:56:49 | DEBUG | adding curve : Id: SM; curve: gen_PGenPu found. (exact name)
2020-09-04 09:56:49 | DEBUG | adding curve : Id: SM; curve: gen_QGenPu found. (exact name)
2020-09-04 09:56:49 | DEBUG | adding curve : Id: SM; curve: gen_PGen found. (exact name)
2020-09-04 09:56:49 | DEBUG | adding curve : Id: SM; curve: gen_QGen found. (exact name)
2020-09-04 09:56:49 | DEBUG | adding curve : Id: SM; curve: gen_UPu found. (exact name)
2020-09-04 09:56:49 | DEBUG | adding curve : Id: SM; output: gen_IStatorPu found.( gen_IStatorPu_value )
2020-09-04 09:56:49 | DEBUG | adding curve : Id: SM; output: gen_IRotorPu found.( gen_IRotorPu_value )
2020-09-04 09:56:49 | DEBUG | adding curve : Id: SM; output: gen_UStatorPu found.( gen_UStatorPu_value )
2020-09-04 09:56:49 | DEBUG | adding curve : Id: SM; output: gen_QStatorPu found.( gen_QStatorPu_value )
2020-09-04 09:56:49 | DEBUG | adding curve : Id: SM; output: gen_thetaInternal found.( gen_thetaInternal_value )
2020-09-04 09:56:49 | INFO | end of curve initialization, added 18 curves
2020-09-04 09:56:49 | INFO | -----------------------------------------------------------------------
2020-09-04 09:56:49 | INFO | 
2020-09-04 09:56:49 | INFO | -----------------------------------------------------------------------
2020-09-04 09:56:49 | INFO | starting simulation with solver IDASolver
2020-09-04 09:56:49 | INFO | -----------------------------------------------------------------------
2020-09-04 09:56:49 | INFO | -----------------------------------------------------------------------
2020-09-04 09:56:49 | INFO | number of continuous variables : 64
2020-09-04 09:56:49 | INFO | number of discrete variables : 17
2020-09-04 09:56:49 | INFO | -----------------------------------------------------------------------
2020-09-04 09:56:49 | INFO |         time | iter num   order (k)      time step (h)
2020-09-04 09:56:49 | INFO | -----------------------------------------------------------------------
2020-09-04 09:56:49 | INFO |        0.000 |        0           0              0.010 
2020-09-04 09:56:49 | DEBUG | call of SolverReInit ie a new symbolic and numerical factorization will be performed
2020-09-04 09:56:49 | INFO |        0.000 |        1           1              0.000 
2020-09-04 09:56:49 | DEBUG | largest derivative values (truncated to the first 10) at the current iteration
2020-09-04 09:56:49 | DEBUG | YP[17]=-0.00984015 (variable=Network_tfo_terminal2_i_re)
2020-09-04 09:56:49 | DEBUG | YP[3]=-0.00984015 (variable=Network_busInf_terminal_i_re)
2020-09-04 09:56:49 | DEBUG | YP[15]=0.00984015 (variable=Network_tfo_terminal1_i_re)
2020-09-04 09:56:49 | DEBUG | YP[53]=0.00984015 (variable=SM_gen_terminal_i_re)
2020-09-04 09:56:49 | DEBUG | YP[5]=0.00639949 (variable=Network_line1_terminal1_i_re)
2020-09-04 09:56:49 | DEBUG | YP[9]=-0.00639949 (variable=Network_line1_terminal2_i_re)
2020-09-04 09:56:49 | DEBUG | YP[2]=0.00579458 (variable=Network_busInf_terminal_i_im)
2020-09-04 09:56:49 | DEBUG | YP[16]=0.00579458 (variable=Network_tfo_terminal2_i_im)
2020-09-04 09:56:49 | DEBUG | YP[52]=-0.00579458 (variable=SM_gen_terminal_i_im)
2020-09-04 09:56:49 | DEBUG | YP[14]=-0.00579458 (variable=Network_tfo_terminal1_i_im)
2020-09-04 09:56:49 | INFO |        0.000 |        2           1              0.000 
2020-09-04 09:56:49 | INFO |        0.000 |        3           2              0.000 
2020-09-04 09:56:49 | DEBUG | call of SolverReInit ie a new symbolic and numerical factorization will be performed
2020-09-04 09:56:49 | INFO |        0.000 |        4           2              0.000 
2020-09-04 09:56:49 | DEBUG | call of SolverReInit ie a new symbolic and numerical factorization will be performed
2020-09-04 09:56:49 | INFO |        0.000 |        5           2              0.000 
2020-09-04 09:56:49 | DEBUG | call of SolverReInit ie a new symbolic and numerical factorization will be performed
2020-09-04 09:56:49 | INFO |        0.000 |        6           2              0.000 
2020-09-04 09:56:49 | DEBUG | call of SolverReInit ie a new symbolic and numerical factorization will be performed
2020-09-04 09:56:49 | INFO |        0.000 |        7           2              0.000 
2020-09-04 09:56:49 | DEBUG | call of SolverReInit ie a new symbolic and numerical factorization will be performed
2020-09-04 09:56:49 | INFO |        0.000 |        8           2              0.000 
2020-09-04 09:56:49 | DEBUG | call of SolverReInit ie a new symbolic and numerical factorization will be performed
2020-09-04 09:56:49 | INFO |        0.000 |        9           2              0.000 
2020-09-04 09:56:49 | DEBUG | call of SolverReInit ie a new symbolic and numerical factorization will be performed
2020-09-04 09:56:49 | INFO |        0.001 |       10           2              0.000 
2020-09-04 09:56:49 | DEBUG | call of SolverReInit ie a new symbolic and numerical factorization will be performed
2020-09-04 09:56:49 | INFO |        0.001 |       11           2              0.001 
2020-09-04 09:56:49 | DEBUG | call of SolverReInit ie a new symbolic and numerical factorization will be performed
2020-09-04 09:56:49 | INFO |        0.002 |       12           2              0.001 
2020-09-04 09:56:49 | DEBUG | call of SolverReInit ie a new symbolic and numerical factorization will be performed
2020-09-04 09:56:49 | INFO |        0.004 |       13           2              0.002 
2020-09-04 09:56:49 | DEBUG | call of SolverReInit ie a new symbolic and numerical factorization will be performed
2020-09-04 09:56:49 | INFO |        0.008 |       14           2              0.004 
2020-09-04 09:56:49 | DEBUG | call of SolverReInit ie a new symbolic and numerical factorization will be performed
2020-09-04 09:56:49 | INFO |        0.016 |       15           2              0.008 
2020-09-04 09:56:49 | DEBUG | call of SolverReInit ie a new symbolic and numerical factorization will be performed
2020-09-04 09:56:49 | INFO |        0.033 |       16           2              0.016 
2020-09-04 09:56:49 | DEBUG | call of SolverReInit ie a new symbolic and numerical factorization will be performed
2020-09-04 09:56:49 | INFO |        0.066 |       17           2              0.033 
2020-09-04 09:56:49 | INFO |        0.098 |       18           2              0.033 
2020-09-04 09:56:49 | DEBUG | call of SolverReInit ie a new symbolic and numerical factorization will be performed
2020-09-04 09:56:49 | INFO |        0.164 |       19           2              0.066 
2020-09-04 09:56:49 | INFO |        0.229 |       20           1              0.066 
2020-09-04 09:56:49 | DEBUG | call of SolverReInit ie a new symbolic and numerical factorization will be performed
2020-09-04 09:56:49 | INFO |        0.360 |       21           1              0.131 
2020-09-04 09:56:49 | INFO |        0.492 |       22           1              0.131 
2020-09-04 09:56:49 | INFO |        0.623 |       23           1              0.131 
2020-09-04 09:56:49 | INFO |        0.754 |       24           2              0.131 
2020-09-04 09:56:49 | INFO |        0.885 |       25           2              0.131 
2020-09-04 09:56:49 | INFO | Algebraic mode change for model SM
2020-09-04 09:56:49 | INFO |        1.000 |       26           2              0.262 
2020-09-04 09:56:49 | INFO | calculation of the new starting point of the simulation.
2020-09-04 09:56:49 | DEBUG | call of SolverReInit ie a new symbolic and numerical factorization will be performed
2020-09-04 09:56:49 | DEBUG | call of SolverReInit ie a new symbolic and numerical factorization will be performed
2020-09-04 09:56:49 | INFO |        1.000 |        0           0              0.000 
2020-09-04 09:56:49 | DEBUG | largest derivative values (truncated to the first 10) at the current iteration
2020-09-04 09:56:49 | DEBUG | YP[21]=-0.274843 (variable=SM_gen_lambdafPu)
2020-09-04 09:56:49 | DEBUG | YP[25]=-4.17188e-05 (variable=SM_gen_theta)
2020-09-04 09:56:49 | DEBUG | YP[20]=5.74053e-06 (variable=SM_gen_lambdaQ2Pu)
2020-09-04 09:56:49 | DEBUG | YP[19]=-3.08985e-06 (variable=SM_gen_lambdaQ1Pu)
2020-09-04 09:56:49 | DEBUG | YP[18]=1.23732e-06 (variable=SM_gen_lambdaDPu)
2020-09-04 09:56:49 | DEBUG | YP[22]=9.36353e-07 (variable=SM_gen_omegaPu_value)
2020-09-04 09:56:49 | DEBUG | YP[44]=0 (variable=SM_gen_lambdaAQPu)
2020-09-04 09:56:49 | DEBUG | YP[46]=0 (variable=SM_gen_lambdadPu)
2020-09-04 09:56:49 | DEBUG | YP[45]=0 (variable=SM_gen_lambdaAirGapPu)
2020-09-04 09:56:49 | DEBUG | YP[47]=0 (variable=SM_gen_lambdaqPu)
2020-09-04 09:56:49 | DEBUG | call of SolverReInit ie a new symbolic and numerical factorization will be performed
2020-09-04 09:56:49 | INFO |        1.000 |        1           1              0.000 
2020-09-04 09:56:49 | INFO |        1.000 |        2           1              0.000 
2020-09-04 09:56:49 | INFO |        1.000 |        3           2              0.000 
2020-09-04 09:56:49 | DEBUG | call of SolverReInit ie a new symbolic and numerical factorization will be performed
2020-09-04 09:56:49 | INFO |        1.000 |        4           2              0.000 
2020-09-04 09:56:49 | DEBUG | call of SolverReInit ie a new symbolic and numerical factorization will be performed
2020-09-04 09:56:49 | INFO |        1.000 |        5           2              0.000 
2020-09-04 09:56:49 | DEBUG | call of SolverReInit ie a new symbolic and numerical factorization will be performed
2020-09-04 09:56:49 | INFO |        1.000 |        6           2              0.000 
2020-09-04 09:56:49 | DEBUG | call of SolverReInit ie a new symbolic and numerical factorization will be performed
2020-09-04 09:56:49 | INFO |        1.000 |        7           2              0.000 
2020-09-04 09:56:49 | DEBUG | call of SolverReInit ie a new symbolic and numerical factorization will be performed
2020-09-04 09:56:49 | INFO |        1.000 |        8           2              0.000 
2020-09-04 09:56:49 | DEBUG | call of SolverReInit ie a new symbolic and numerical factorization will be performed
2020-09-04 09:56:49 | INFO |        1.000 |        9           2              0.000 
2020-09-04 09:56:49 | DEBUG | call of SolverReInit ie a new symbolic and numerical factorization will be performed
2020-09-04 09:56:49 | INFO |        1.001 |       10           2              0.000 
2020-09-04 09:56:49 | DEBUG | call of SolverReInit ie a new symbolic and numerical factorization will be performed
2020-09-04 09:56:49 | INFO |        1.001 |       11           2              0.001 
2020-09-04 09:56:49 | DEBUG | call of SolverReInit ie a new symbolic and numerical factorization will be performed
2020-09-04 09:56:49 | INFO |        1.002 |       12           2              0.001 
2020-09-04 09:56:49 | DEBUG | call of SolverReInit ie a new symbolic and numerical factorization will be performed
2020-09-04 09:56:49 | INFO |        1.004 |       13           2              0.002 
2020-09-04 09:56:49 | DEBUG | call of SolverReInit ie a new symbolic and numerical factorization will be performed
2020-09-04 09:56:49 | INFO |        1.008 |       14           2              0.004 
2020-09-04 09:56:49 | INFO |        1.012 |       15           2              0.004 
2020-09-04 09:56:49 | INFO |        1.016 |       16           2              0.004 
2020-09-04 09:56:49 | INFO |        1.020 |       17           2              0.004 
2020-09-04 09:56:49 | INFO |        1.025 |       18           2              0.004 
2020-09-04 09:56:49 | INFO |        1.029 |       19           2              0.004 
2020-09-04 09:56:49 | INFO |        1.033 |       20           2              0.004 
2020-09-04 09:56:49 | INFO |        1.037 |       21           2              0.004 
2020-09-04 09:56:49 | INFO |        1.041 |       22           2              0.004 
2020-09-04 09:56:49 | INFO |        1.045 |       23           2              0.004 
2020-09-04 09:56:49 | INFO |        1.049 |       24           2              0.004 
2020-09-04 09:56:49 | INFO |        1.053 |       25           2              0.004 
2020-09-04 09:56:49 | INFO |        1.057 |       26           2              0.004 
2020-09-04 09:56:49 | DEBUG | call of SolverReInit ie a new symbolic and numerical factorization will be performed
2020-09-04 09:56:49 | INFO |        1.066 |       27           2              0.008 
2020-09-04 09:56:49 | INFO |        1.073 |       28           2              0.007 
2020-09-04 09:56:49 | INFO |        1.080 |       29           2              0.007 
2020-09-04 09:56:49 | INFO |        1.088 |       30           2              0.007 
2020-09-04 09:56:49 | INFO |        1.095 |       31           2              0.007 
2020-09-04 09:56:49 | INFO |        1.102 |       32           2              0.007 
2020-09-04 09:56:49 | INFO |        1.110 |       33           2              0.007 
2020-09-04 09:56:49 | INFO |        1.117 |       34           2              0.007 
2020-09-04 09:56:49 | INFO |        1.125 |       35           2              0.007 
2020-09-04 09:56:49 | DEBUG | call of SolverReInit ie a new symbolic and numerical factorization will be performed
2020-09-04 09:56:49 | INFO |        1.139 |       36           2              0.015 
2020-09-04 09:56:49 | INFO |        1.153 |       37           2              0.013 
2020-09-04 09:56:49 | INFO |        1.166 |       38           2              0.013 
2020-09-04 09:56:49 | INFO |        1.179 |       39           2              0.013 
2020-09-04 09:56:49 | INFO |        1.192 |       40           2              0.013 
2020-09-04 09:56:49 | INFO |        1.206 |       41           2              0.013 
2020-09-04 09:56:49 | INFO |        1.219 |       42           2              0.013 
2020-09-04 09:56:49 | INFO |        1.232 |       43           2              0.013 
2020-09-04 09:56:49 | DEBUG | call of SolverReInit ie a new symbolic and numerical factorization will be performed
2020-09-04 09:56:49 | INFO |        1.259 |       44           2              0.027 
2020-09-04 09:56:49 | INFO |        1.282 |       45           2              0.024 
2020-09-04 09:56:49 | INFO |        1.304 |       46           2              0.021 
2020-09-04 09:56:49 | INFO |        1.323 |       47           2              0.019 
2020-09-04 09:56:49 | DEBUG | call of SolverReInit ie a new symbolic and numerical factorization will be performed
2020-09-04 09:56:49 | INFO |        1.340 |       48           2              0.017 
2020-09-04 09:56:49 | INFO |        1.356 |       49           2              0.016 
2020-09-04 09:56:49 | INFO |        1.372 |       50           2              0.016 
2020-09-04 09:56:49 | INFO |        1.386 |       51           2              0.014 
2020-09-04 09:56:49 | INFO |        1.400 |       52           2              0.014 
2020-09-04 09:56:49 | INFO |        1.414 |       53           2              0.014 
2020-09-04 09:56:49 | INFO |        1.428 |       54           2              0.014 
2020-09-04 09:56:49 | INFO |        1.442 |       55           2              0.014 
2020-09-04 09:56:49 | INFO |        1.456 |       56           2              0.014 
2020-09-04 09:56:49 | INFO |        1.470 |       57           2              0.014 
2020-09-04 09:56:49 | INFO |        1.484 |       58           2              0.014 
2020-09-04 09:56:49 | INFO |        1.498 |       59           2              0.014 
2020-09-04 09:56:49 | INFO |        1.512 |       60           2              0.014 
2020-09-04 09:56:49 | INFO |        1.526 |       61           2              0.014 
2020-09-04 09:56:49 | INFO |        1.540 |       62           2              0.014 
2020-09-04 09:56:49 | INFO |        1.554 |       63           2              0.014 
2020-09-04 09:56:49 | INFO |        1.568 |       64           2              0.014 
2020-09-04 09:56:49 | INFO |        1.582 |       65           2              0.014 
2020-09-04 09:56:49 | INFO |        1.596 |       66           2              0.014 
2020-09-04 09:56:49 | INFO |        1.610 |       67           2              0.014 
2020-09-04 09:56:49 | INFO |        1.624 |       68           2              0.014 
2020-09-04 09:56:49 | INFO |        1.638 |       69           2              0.014 
2020-09-04 09:56:49 | INFO |        1.652 |       70           2              0.014 
2020-09-04 09:56:49 | INFO |        1.666 |       71           2              0.014 
2020-09-04 09:56:49 | INFO |        1.680 |       72           2              0.014 
2020-09-04 09:56:49 | INFO |        1.694 |       73           2              0.014 
2020-09-04 09:56:49 | INFO |        1.708 |       74           2              0.014 
2020-09-04 09:56:49 | DEBUG | call of SolverReInit ie a new symbolic and numerical factorization will be performed
2020-09-04 09:56:49 | INFO |        1.737 |       75           2              0.028 
2020-09-04 09:56:49 | INFO |        1.765 |       76           2              0.028 
2020-09-04 09:56:49 | INFO |        1.790 |       77           2              0.025 
2020-09-04 09:56:49 | INFO |        1.813 |       78           2              0.023 
2020-09-04 09:56:49 | INFO |        1.833 |       79           2              0.020 
2020-09-04 09:56:49 | INFO |        1.851 |       80           2              0.018 
2020-09-04 09:56:49 | DEBUG | call of SolverReInit ie a new symbolic and numerical factorization will be performed
2020-09-04 09:56:49 | INFO |        1.868 |       81           2              0.017 
2020-09-04 09:56:49 | INFO |        1.885 |       82           2              0.017 
2020-09-04 09:56:49 | INFO |        1.901 |       83           2              0.017 
2020-09-04 09:56:49 | INFO |        1.918 |       84           2              0.017 
2020-09-04 09:56:49 | INFO |        1.933 |       85           2              0.015 
2020-09-04 09:56:49 | INFO |        1.948 |       86           2              0.015 
2020-09-04 09:56:49 | INFO |        1.963 |       87           2              0.015 
2020-09-04 09:56:49 | INFO |        1.977 |       88           2              0.015 
2020-09-04 09:56:49 | INFO |        1.992 |       89           2              0.015 
2020-09-04 09:56:49 | INFO |        2.007 |       90           2              0.015 
2020-09-04 09:56:49 | INFO |        2.022 |       91           2              0.015 
2020-09-04 09:56:49 | INFO |        2.037 |       92           2              0.015 
2020-09-04 09:56:49 | INFO |        2.052 |       93           2              0.015 
2020-09-04 09:56:49 | INFO |        2.067 |       94           2              0.015 
2020-09-04 09:56:49 | INFO |        2.082 |       95           2              0.015 
2020-09-04 09:56:49 | INFO |        2.097 |       96           2              0.015 
2020-09-04 09:56:49 | INFO |        2.112 |       97           2              0.015 
2020-09-04 09:56:49 | INFO |        2.127 |       98           2              0.015 
2020-09-04 09:56:49 | INFO |        2.142 |       99           2              0.015 
2020-09-04 09:56:49 | INFO |        2.156 |      100           2              0.015 
2020-09-04 09:56:49 | INFO |        2.171 |      101           2              0.015 
2020-09-04 09:56:49 | INFO |        2.186 |      102           2              0.015 
2020-09-04 09:56:49 | INFO |        2.201 |      103           2              0.015 
2020-09-04 09:56:49 | INFO |        2.216 |      104           2              0.015 
2020-09-04 09:56:49 | INFO |        2.231 |      105           2              0.015 
2020-09-04 09:56:49 | DEBUG | call of SolverReInit ie a new symbolic and numerical factorization will be performed
2020-09-04 09:56:49 | INFO |        2.261 |      106           2              0.030 
2020-09-04 09:56:49 | INFO |        2.291 |      107           2              0.030 
2020-09-04 09:56:49 | INFO |        2.318 |      108           2              0.027 
2020-09-04 09:56:49 | INFO |        2.342 |      109           2              0.024 
2020-09-04 09:56:49 | INFO |        2.363 |      110           2              0.022 
2020-09-04 09:56:49 | INFO |        2.383 |      111           2              0.020 
2020-09-04 09:56:49 | DEBUG | call of SolverReInit ie a new symbolic and numerical factorization will be performed
2020-09-04 09:56:49 | INFO |        2.401 |      112           2              0.018 
2020-09-04 09:56:49 | INFO |        2.418 |      113           2              0.018 
2020-09-04 09:56:49 | INFO |        2.436 |      114           2              0.018 
2020-09-04 09:56:49 | INFO |        2.454 |      115           2              0.018 
2020-09-04 09:56:49 | INFO |        2.469 |      116           2              0.016 
2020-09-04 09:56:49 | INFO |        2.485 |      117           2              0.016 
2020-09-04 09:56:49 | INFO |        2.501 |      118           2              0.016 
2020-09-04 09:56:49 | INFO |        2.517 |      119           2              0.016 
2020-09-04 09:56:49 | INFO |        2.533 |      120           2              0.016 
2020-09-04 09:56:49 | INFO |        2.549 |      121           2              0.016 
2020-09-04 09:56:49 | INFO |        2.564 |      122           2              0.016 
2020-09-04 09:56:49 | INFO |        2.580 |      123           2              0.016 
2020-09-04 09:56:49 | INFO |        2.596 |      124           2              0.016 
2020-09-04 09:56:49 | INFO |        2.612 |      125           2              0.016 
2020-09-04 09:56:49 | INFO |        2.628 |      126           2              0.016 
2020-09-04 09:56:49 | INFO |        2.644 |      127           2              0.016 
2020-09-04 09:56:49 | INFO |        2.660 |      128           2              0.016 
2020-09-04 09:56:49 | INFO |        2.675 |      129           2              0.016 
2020-09-04 09:56:49 | INFO |        2.691 |      130           2              0.016 
2020-09-04 09:56:49 | INFO |        2.707 |      131           2              0.016 
2020-09-04 09:56:49 | INFO |        2.723 |      132           2              0.016 
2020-09-04 09:56:49 | INFO |        2.739 |      133           2              0.016 
2020-09-04 09:56:49 | DEBUG | call of SolverReInit ie a new symbolic and numerical factorization will be performed
2020-09-04 09:56:49 | INFO |        2.771 |      134           2              0.032 
2020-09-04 09:56:49 | INFO |        2.802 |      135           2              0.032 
2020-09-04 09:56:49 | INFO |        2.831 |      136           2              0.029 
2020-09-04 09:56:49 | INFO |        2.857 |      137           2              0.026 
2020-09-04 09:56:49 | INFO |        2.880 |      138           2              0.023 
2020-09-04 09:56:49 | INFO |        2.900 |      139           2              0.021 
2020-09-04 09:56:49 | DEBUG | call of SolverReInit ie a new symbolic and numerical factorization will be performed
2020-09-04 09:56:49 | INFO |        2.919 |      140           2              0.019 
2020-09-04 09:56:49 | INFO |        2.938 |      141           2              0.019 
2020-09-04 09:56:49 | INFO |        2.957 |      142           2              0.019 
2020-09-04 09:56:49 | INFO |        2.975 |      143           2              0.019 
2020-09-04 09:56:49 | INFO |        2.994 |      144           2              0.019 
2020-09-04 09:56:49 | INFO |        3.011 |      145           2              0.017 
2020-09-04 09:56:49 | INFO |        3.028 |      146           2              0.017 
2020-09-04 09:56:49 | INFO |        3.045 |      147           2              0.017 
2020-09-04 09:56:49 | INFO |        3.061 |      148           2              0.017 
2020-09-04 09:56:49 | INFO |        3.078 |      149           2              0.017 
2020-09-04 09:56:49 | INFO |        3.095 |      150           2              0.017 
2020-09-04 09:56:49 | INFO |        3.112 |      151           2              0.017 
2020-09-04 09:56:49 | INFO |        3.129 |      152           2              0.017 
2020-09-04 09:56:49 | INFO |        3.146 |      153           2              0.017 
2020-09-04 09:56:49 | INFO |        3.163 |      154           2              0.017 
2020-09-04 09:56:49 | INFO |        3.179 |      155           2              0.017 
2020-09-04 09:56:49 | INFO |        3.196 |      156           2              0.017 
2020-09-04 09:56:49 | INFO |        3.213 |      157           2              0.017 
2020-09-04 09:56:49 | INFO |        3.230 |      158           2              0.017 
2020-09-04 09:56:49 | INFO |        3.247 |      159           2              0.017 
2020-09-04 09:56:49 | INFO |        3.264 |      160           2              0.017 
2020-09-04 09:56:49 | DEBUG | call of SolverReInit ie a new symbolic and numerical factorization will be performed
2020-09-04 09:56:49 | INFO |        3.297 |      161           2              0.034 
2020-09-04 09:56:49 | INFO |        3.331 |      162           2              0.034 
2020-09-04 09:56:49 | INFO |        3.361 |      163           2              0.030 
2020-09-04 09:56:49 | INFO |        3.389 |      164           2              0.027 
2020-09-04 09:56:49 | INFO |        3.413 |      165           2              0.025 
2020-09-04 09:56:49 | INFO |        3.435 |      166           2              0.022 
2020-09-04 09:56:49 | DEBUG | call of SolverReInit ie a new symbolic and numerical factorization will be performed
2020-09-04 09:56:49 | INFO |        3.455 |      167           2              0.020 
2020-09-04 09:56:49 | INFO |        3.475 |      168           2              0.020 
2020-09-04 09:56:49 | INFO |        3.495 |      169           2              0.020 
2020-09-04 09:56:49 | INFO |        3.515 |      170           2              0.020 
2020-09-04 09:56:49 | INFO |        3.535 |      171           2              0.020 
2020-09-04 09:56:49 | INFO |        3.555 |      172           2              0.020 
2020-09-04 09:56:49 | INFO |        3.575 |      173           2              0.020 
2020-09-04 09:56:49 | INFO |        3.595 |      174           2              0.020 
2020-09-04 09:56:49 | INFO |        3.615 |      175           2              0.020 
2020-09-04 09:56:49 | INFO |        3.634 |      176           2              0.020 
2020-09-04 09:56:49 | INFO |        3.654 |      177           2              0.020 
2020-09-04 09:56:49 | INFO |        3.674 |      178           2              0.020 
2020-09-04 09:56:49 | INFO |        3.694 |      179           2              0.020 
2020-09-04 09:56:49 | INFO |        3.714 |      180           2              0.020 
2020-09-04 09:56:49 | INFO |        3.734 |      181           2              0.020 
2020-09-04 09:56:49 | INFO |        3.754 |      182           2              0.020 
2020-09-04 09:56:49 | INFO |        3.774 |      183           2              0.020 
2020-09-04 09:56:49 | INFO |        3.794 |      184           2              0.020 
2020-09-04 09:56:49 | DEBUG | call of SolverReInit ie a new symbolic and numerical factorization will be performed
2020-09-04 09:56:49 | INFO |        3.833 |      185           2              0.040 
2020-09-04 09:56:49 | INFO |        3.868 |      186           2              0.034 
2020-09-04 09:56:49 | INFO |        3.898 |      187           2              0.031 
2020-09-04 09:56:49 | INFO |        3.926 |      188           2              0.028 
2020-09-04 09:56:49 | INFO |        3.951 |      189           2              0.025 
2020-09-04 09:56:49 | DEBUG | call of SolverReInit ie a new symbolic and numerical factorization will be performed
2020-09-04 09:56:49 | INFO |        3.974 |      190           2              0.022 
2020-09-04 09:56:50 | INFO |        3.996 |      191           2              0.022 
2020-09-04 09:56:50 | INFO |        4.016 |      192           2              0.020 
2020-09-04 09:56:50 | INFO |        4.036 |      193           2              0.020 
2020-09-04 09:56:50 | INFO |        4.057 |      194           2              0.020 
2020-09-04 09:56:50 | INFO |        4.077 |      195           2              0.020 
2020-09-04 09:56:50 | INFO |        4.097 |      196           2              0.020 
2020-09-04 09:56:50 | INFO |        4.117 |      197           2              0.020 
2020-09-04 09:56:50 | INFO |        4.137 |      198           2              0.020 
2020-09-04 09:56:50 | INFO |        4.158 |      199           2              0.020 
2020-09-04 09:56:50 | INFO |        4.178 |      200           2              0.020 
2020-09-04 09:56:50 | INFO |        4.198 |      201           2              0.020 
2020-09-04 09:56:50 | INFO |        4.218 |      202           2              0.020 
2020-09-04 09:56:50 | INFO |        4.238 |      203           2              0.020 
2020-09-04 09:56:50 | INFO |        4.259 |      204           2              0.020 
2020-09-04 09:56:50 | INFO |        4.279 |      205           2              0.020 
2020-09-04 09:56:50 | INFO |        4.299 |      206           2              0.020 
2020-09-04 09:56:50 | INFO |        4.319 |      207           2              0.020 
2020-09-04 09:56:50 | DEBUG | call of SolverReInit ie a new symbolic and numerical factorization will be performed
2020-09-04 09:56:50 | INFO |        4.360 |      208           2              0.040 
2020-09-04 09:56:50 | INFO |        4.395 |      209           2              0.035 
2020-09-04 09:56:50 | INFO |        4.427 |      210           2              0.032 
2020-09-04 09:56:50 | INFO |        4.456 |      211           2              0.029 
2020-09-04 09:56:50 | INFO |        4.481 |      212           2              0.026 
2020-09-04 09:56:50 | DEBUG | call of SolverReInit ie a new symbolic and numerical factorization will be performed
2020-09-04 09:56:50 | INFO |        4.505 |      213           2              0.023 
2020-09-04 09:56:50 | INFO |        4.528 |      214           2              0.023 
2020-09-04 09:56:50 | INFO |        4.549 |      215           2              0.021 
2020-09-04 09:56:50 | INFO |        4.570 |      216           2              0.021 
2020-09-04 09:56:50 | INFO |        4.591 |      217           2              0.021 
2020-09-04 09:56:50 | INFO |        4.612 |      218           2              0.021 
2020-09-04 09:56:50 | INFO |        4.633 |      219           2              0.021 
2020-09-04 09:56:50 | INFO |        4.654 |      220           2              0.021 
2020-09-04 09:56:50 | INFO |        4.675 |      221           2              0.021 
2020-09-04 09:56:50 | INFO |        4.695 |      222           2              0.021 
2020-09-04 09:56:50 | INFO |        4.716 |      223           2              0.021 
2020-09-04 09:56:50 | INFO |        4.737 |      224           2              0.021 
2020-09-04 09:56:50 | INFO |        4.758 |      225           2              0.021 
2020-09-04 09:56:50 | INFO |        4.779 |      226           2              0.021 
2020-09-04 09:56:50 | INFO |        4.800 |      227           2              0.021 
2020-09-04 09:56:50 | INFO |        4.821 |      228           2              0.021 
2020-09-04 09:56:50 | INFO |        4.842 |      229           2              0.021 
2020-09-04 09:56:50 | DEBUG | call of SolverReInit ie a new symbolic and numerical factorization will be performed
2020-09-04 09:56:50 | INFO |        4.884 |      230           2              0.042 
2020-09-04 09:56:50 | INFO |        4.922 |      231           2              0.038 
2020-09-04 09:56:50 | INFO |        4.955 |      232           2              0.034 
2020-09-04 09:56:50 | INFO |        4.986 |      233           2              0.031 
2020-09-04 09:56:50 | INFO |        5.013 |      234           2              0.027 
2020-09-04 09:56:50 | DEBUG | call of SolverReInit ie a new symbolic and numerical factorization will be performed
2020-09-04 09:56:50 | INFO |        5.038 |      235           2              0.025 
2020-09-04 09:56:50 | INFO |        5.063 |      236           2              0.025 
2020-09-04 09:56:50 | INFO |        5.085 |      237           2              0.022 
2020-09-04 09:56:50 | INFO |        5.107 |      238           2              0.022 
2020-09-04 09:56:50 | INFO |        5.130 |      239           2              0.022 
2020-09-04 09:56:50 | INFO |        5.152 |      240           2              0.022 
2020-09-04 09:56:50 | INFO |        5.174 |      241           2              0.022 
2020-09-04 09:56:50 | INFO |        5.196 |      242           2              0.022 
2020-09-04 09:56:50 | INFO |        5.219 |      243           2              0.022 
2020-09-04 09:56:50 | INFO |        5.241 |      244           2              0.022 
2020-09-04 09:56:50 | INFO |        5.263 |      245           2              0.022 
2020-09-04 09:56:50 | INFO |        5.285 |      246           2              0.022 
2020-09-04 09:56:50 | INFO |        5.308 |      247           2              0.022 
2020-09-04 09:56:50 | INFO |        5.330 |      248           2              0.022 
2020-09-04 09:56:50 | INFO |        5.352 |      249           2              0.022 
2020-09-04 09:56:50 | DEBUG | call of SolverReInit ie a new symbolic and numerical factorization will be performed
2020-09-04 09:56:50 | INFO |        5.397 |      250           2              0.044 
2020-09-04 09:56:50 | INFO |        5.441 |      251           2              0.044 
2020-09-04 09:56:50 | INFO |        5.480 |      252           2              0.039 
2020-09-04 09:56:50 | INFO |        5.514 |      253           2              0.034 
2020-09-04 09:56:50 | INFO |        5.543 |      254           2              0.030 
2020-09-04 09:56:50 | INFO |        5.570 |      255           2              0.027 
2020-09-04 09:56:50 | DEBUG | call of SolverReInit ie a new symbolic and numerical factorization will be performed
2020-09-04 09:56:50 | INFO |        5.595 |      256           2              0.024 
2020-09-04 09:56:50 | INFO |        5.619 |      257           2              0.024 
2020-09-04 09:56:50 | INFO |        5.643 |      258           2              0.024 
2020-09-04 09:56:50 | INFO |        5.668 |      259           2              0.024 
2020-09-04 09:56:50 | INFO |        5.692 |      260           2              0.024 
2020-09-04 09:56:50 | INFO |        5.716 |      261           2              0.024 
2020-09-04 09:56:50 | INFO |        5.740 |      262           2              0.024 
2020-09-04 09:56:50 | INFO |        5.765 |      263           2              0.024 
2020-09-04 09:56:50 | INFO |        5.789 |      264           2              0.024 
2020-09-04 09:56:50 | INFO |        5.813 |      265           2              0.024 
2020-09-04 09:56:50 | INFO |        5.838 |      266           2              0.024 
2020-09-04 09:56:50 | INFO |        5.862 |      267           2              0.024 
2020-09-04 09:56:50 | INFO |        5.886 |      268           2              0.024 
2020-09-04 09:56:50 | DEBUG | call of SolverReInit ie a new symbolic and numerical factorization will be performed
2020-09-04 09:56:50 | INFO |        5.935 |      269           2              0.049 
2020-09-04 09:56:50 | INFO |        5.978 |      270           2              0.044 
2020-09-04 09:56:50 | INFO |        6.017 |      271           2              0.039 
2020-09-04 09:56:50 | INFO |        6.052 |      272           2              0.034 
2020-09-04 09:56:50 | INFO |        6.083 |      273           2              0.031 
2020-09-04 09:56:50 | DEBUG | call of SolverReInit ie a new symbolic and numerical factorization will be performed
2020-09-04 09:56:50 | INFO |        6.111 |      274           2              0.028 
2020-09-04 09:56:50 | INFO |        6.139 |      275           2              0.028 
2020-09-04 09:56:50 | INFO |        6.164 |      276           2              0.025 
2020-09-04 09:56:50 | INFO |        6.189 |      277           2              0.025 
2020-09-04 09:56:50 | INFO |        6.214 |      278           2              0.025 
2020-09-04 09:56:50 | INFO |        6.239 |      279           2              0.025 
2020-09-04 09:56:50 | INFO |        6.264 |      280           2              0.025 
2020-09-04 09:56:50 | INFO |        6.289 |      281           2              0.025 
2020-09-04 09:56:50 | INFO |        6.315 |      282           2              0.025 
2020-09-04 09:56:50 | INFO |        6.340 |      283           2              0.025 
2020-09-04 09:56:50 | INFO |        6.365 |      284           2              0.025 
2020-09-04 09:56:50 | INFO |        6.390 |      285           2              0.025 
2020-09-04 09:56:50 | INFO |        6.415 |      286           2              0.025 
2020-09-04 09:56:50 | DEBUG | call of SolverReInit ie a new symbolic and numerical factorization will be performed
2020-09-04 09:56:50 | INFO |        6.465 |      287           2              0.050 
2020-09-04 09:56:50 | INFO |        6.510 |      288           2              0.045 
2020-09-04 09:56:50 | INFO |        6.551 |      289           2              0.040 
2020-09-04 09:56:50 | INFO |        6.587 |      290           2              0.036 
2020-09-04 09:56:50 | INFO |        6.619 |      291           2              0.032 
2020-09-04 09:56:50 | DEBUG | call of SolverReInit ie a new symbolic and numerical factorization will be performed
2020-09-04 09:56:50 | INFO |        6.648 |      292           2              0.029 
2020-09-04 09:56:50 | INFO |        6.677 |      293           2              0.029 
2020-09-04 09:56:50 | INFO |        6.703 |      294           2              0.026 
2020-09-04 09:56:50 | INFO |        6.730 |      295           2              0.026 
2020-09-04 09:56:50 | INFO |        6.756 |      296           2              0.026 
2020-09-04 09:56:50 | INFO |        6.782 |      297           2              0.026 
2020-09-04 09:56:50 | INFO |        6.808 |      298           2              0.026 
2020-09-04 09:56:50 | INFO |        6.834 |      299           2              0.026 
2020-09-04 09:56:50 | INFO |        6.860 |      300           2              0.026 
2020-09-04 09:56:50 | INFO |        6.887 |      301           2              0.026 
2020-09-04 09:56:50 | INFO |        6.913 |      302           2              0.026 
2020-09-04 09:56:50 | INFO |        6.939 |      303           2              0.026 
2020-09-04 09:56:50 | DEBUG | call of SolverReInit ie a new symbolic and numerical factorization will be performed
2020-09-04 09:56:50 | INFO |        6.991 |      304           2              0.052 
2020-09-04 09:56:50 | INFO |        7.038 |      305           2              0.047 
2020-09-04 09:56:50 | INFO |        7.081 |      306           2              0.042 
2020-09-04 09:56:50 | INFO |        7.119 |      307           2              0.038 
2020-09-04 09:56:50 | INFO |        7.153 |      308           2              0.034 
2020-09-04 09:56:50 | DEBUG | call of SolverReInit ie a new symbolic and numerical factorization will be performed
2020-09-04 09:56:50 | INFO |        7.184 |      309           2              0.031 
2020-09-04 09:56:50 | INFO |        7.215 |      310           2              0.031 
2020-09-04 09:56:50 | DEBUG | call of SolverReInit ie a new symbolic and numerical factorization will be performed
2020-09-04 09:56:50 | DEBUG | call of SolverReInit ie a new symbolic and numerical factorization will be performed
2020-09-04 09:56:50 | INFO |        7.232 |      311           1              0.017 
2020-09-04 09:56:50 | INFO |        7.250 |      312           1              0.017 
2020-09-04 09:56:50 | INFO |        7.267 |      313           1              0.017 
2020-09-04 09:56:50 | INFO |        7.284 |      314           2              0.017 
2020-09-04 09:56:50 | INFO |        7.301 |      315           2              0.017 
2020-09-04 09:56:50 | INFO |        7.319 |      316           2              0.017 
2020-09-04 09:56:50 | INFO |        7.336 |      317           2              0.017 
2020-09-04 09:56:50 | INFO |        7.353 |      318           2              0.017 
2020-09-04 09:56:50 | INFO |        7.388 |      319           2              0.035 
2020-09-04 09:56:50 | INFO |        7.422 |      320           2              0.035 
2020-09-04 09:56:50 | INFO |        7.457 |      321           2              0.035 
2020-09-04 09:56:50 | INFO |        7.491 |      322           2              0.035 
2020-09-04 09:56:50 | INFO |        7.526 |      323           2              0.035 
2020-09-04 09:56:50 | INFO |        7.560 |      324           2              0.035 
2020-09-04 09:56:50 | INFO |        7.595 |      325           2              0.035 
2020-09-04 09:56:50 | INFO |        7.629 |      326           2              0.035 
2020-09-04 09:56:50 | INFO |        7.664 |      327           2              0.035 
2020-09-04 09:56:50 | INFO |        7.698 |      328           2              0.035 
2020-09-04 09:56:50 | INFO |        7.729 |      329           2              0.031 
2020-09-04 09:56:50 | INFO |        7.760 |      330           2              0.031 
2020-09-04 09:56:50 | INFO |        7.791 |      331           2              0.031 
2020-09-04 09:56:50 | INFO |        7.822 |      332           2              0.031 
2020-09-04 09:56:50 | INFO |        7.853 |      333           2              0.031 
2020-09-04 09:56:50 | INFO |        7.885 |      334           2              0.031 
2020-09-04 09:56:50 | INFO |        7.916 |      335           2              0.031 
2020-09-04 09:56:50 | INFO |        7.947 |      336           2              0.031 
2020-09-04 09:56:50 | INFO |        7.978 |      337           2              0.031 
2020-09-04 09:56:50 | INFO |        8.009 |      338           2              0.031 
2020-09-04 09:56:50 | DEBUG | call of SolverReInit ie a new symbolic and numerical factorization will be performed
2020-09-04 09:56:50 | INFO |        8.051 |      339           2              0.042 
2020-09-04 09:56:50 | INFO |        8.092 |      340           2              0.042 
2020-09-04 09:56:50 | INFO |        8.134 |      341           2              0.042 
2020-09-04 09:56:50 | INFO |        8.172 |      342           2              0.038 
2020-09-04 09:56:50 | INFO |        8.210 |      343           2              0.038 
2020-09-04 09:56:50 | DEBUG | call of SolverReInit ie a new symbolic and numerical factorization will be performed
2020-09-04 09:56:50 | INFO |        8.244 |      344           2              0.034 
2020-09-04 09:56:50 | INFO |        8.277 |      345           2              0.034 
2020-09-04 09:56:50 | DEBUG | call of SolverReInit ie a new symbolic and numerical factorization will be performed
2020-09-04 09:56:50 | DEBUG | call of SolverReInit ie a new symbolic and numerical factorization will be performed
2020-09-04 09:56:50 | INFO |        8.296 |      346           1              0.018 
2020-09-04 09:56:50 | INFO |        8.314 |      347           1              0.018 
2020-09-04 09:56:50 | INFO |        8.332 |      348           1              0.018 
2020-09-04 09:56:50 | INFO |        8.369 |      349           2              0.036 
2020-09-04 09:56:50 | INFO |        8.405 |      350           2              0.036 
2020-09-04 09:56:50 | INFO |        8.438 |      351           2              0.033 
2020-09-04 09:56:50 | INFO |        8.471 |      352           2              0.033 
2020-09-04 09:56:50 | INFO |        8.504 |      353           2              0.033 
2020-09-04 09:56:50 | INFO |        8.537 |      354           2              0.033 
2020-09-04 09:56:50 | DEBUG | call of SolverReInit ie a new symbolic and numerical factorization will be performed
2020-09-04 09:56:50 | INFO |        8.581 |      355           2              0.044 
2020-09-04 09:56:50 | INFO |        8.625 |      356           2              0.044 
2020-09-04 09:56:50 | INFO |        8.669 |      357           2              0.044 
2020-09-04 09:56:50 | INFO |        8.709 |      358           2              0.040 
2020-09-04 09:56:50 | INFO |        8.749 |      359           2              0.040 
2020-09-04 09:56:50 | DEBUG | call of SolverReInit ie a new symbolic and numerical factorization will be performed
2020-09-04 09:56:50 | INFO |        8.785 |      360           2              0.036 
2020-09-04 09:56:50 | INFO |        8.821 |      361           2              0.036 
2020-09-04 09:56:50 | INFO |        8.857 |      362           2              0.036 
2020-09-04 09:56:50 | INFO |        8.893 |      363           2              0.036 
2020-09-04 09:56:50 | INFO |        8.929 |      364           2              0.036 
2020-09-04 09:56:50 | INFO |        8.965 |      365           2              0.036 
2020-09-04 09:56:50 | INFO |        9.000 |      366           2              0.036 
2020-09-04 09:56:50 | INFO |        9.036 |      367           2              0.036 
2020-09-04 09:56:50 | INFO |        9.072 |      368           2              0.036 
2020-09-04 09:56:50 | DEBUG | call of SolverReInit ie a new symbolic and numerical factorization will be performed
2020-09-04 09:56:50 | INFO |        9.118 |      369           2              0.046 
2020-09-04 09:56:50 | INFO |        9.165 |      370           2              0.046 
2020-09-04 09:56:50 | INFO |        9.211 |      371           2              0.046 
2020-09-04 09:56:50 | DEBUG | call of SolverReInit ie a new symbolic and numerical factorization will be performed
2020-09-04 09:56:50 | INFO |        9.252 |      372           2              0.042 
2020-09-04 09:56:50 | INFO |        9.294 |      373           2              0.042 
2020-09-04 09:56:50 | INFO |        9.332 |      374           2              0.037 
2020-09-04 09:56:50 | INFO |        9.354 |      375           1              0.022 
2020-09-04 09:56:50 | INFO |        9.376 |      376           1              0.022 
2020-09-04 09:56:50 | INFO |        9.399 |      377           1              0.022 
2020-09-04 09:56:50 | DEBUG | call of SolverReInit ie a new symbolic and numerical factorization will be performed
2020-09-04 09:56:50 | INFO |        9.421 |      378           2              0.022 
2020-09-04 09:56:50 | INFO |        9.443 |      379           2              0.022 
2020-09-04 09:56:50 | INFO |        9.466 |      380           2              0.022 
2020-09-04 09:56:50 | INFO |        9.488 |      381           2              0.022 
2020-09-04 09:56:50 | DEBUG | call of SolverReInit ie a new symbolic and numerical factorization will be performed
2020-09-04 09:56:50 | INFO |        9.533 |      382           2              0.045 
2020-09-04 09:56:50 | INFO |        9.577 |      383           2              0.045 
2020-09-04 09:56:50 | DEBUG | call of SolverReInit ie a new symbolic and numerical factorization will be performed
2020-09-04 09:56:50 | INFO |        9.633 |      384           2              0.056 
2020-09-04 09:56:50 | INFO |        9.689 |      385           2              0.056 
2020-09-04 09:56:50 | INFO |        9.744 |      386           2              0.056 
2020-09-04 09:56:50 | DEBUG | call of SolverReInit ie a new symbolic and numerical factorization will be performed
2020-09-04 09:56:50 | INFO |        9.795 |      387           2              0.050 
2020-09-04 09:56:50 | INFO |        9.840 |      388           2              0.045 
2020-09-04 09:56:50 | INFO |        9.880 |      389           2              0.041 
2020-09-04 09:56:50 | INFO |        9.902 |      390           1              0.022 
2020-09-04 09:56:50 | INFO |        9.924 |      391           1              0.022 
2020-09-04 09:56:50 | INFO |        9.945 |      392           1              0.022 
2020-09-04 09:56:50 | INFO |        9.988 |      393           2              0.043 
2020-09-04 09:56:50 | INFO |       10.032 |      394           2              0.043 
2020-09-04 09:56:50 | INFO |       10.075 |      395           2              0.043 
2020-09-04 09:56:50 | INFO |       10.118 |      396           2              0.043 
2020-09-04 09:56:50 | INFO |       10.161 |      397           2              0.043 
2020-09-04 09:56:50 | DEBUG | call of SolverReInit ie a new symbolic and numerical factorization will be performed
2020-09-04 09:56:50 | DEBUG | call of SolverReInit ie a new symbolic and numerical factorization will be performed
2020-09-04 09:56:50 | INFO |       10.210 |      398           2              0.049 
2020-09-04 09:56:50 | INFO |       10.259 |      399           2              0.049 
2020-09-04 09:56:50 | INFO |       10.307 |      400           2              0.049 
2020-09-04 09:56:50 | INFO |       10.356 |      401           2              0.049 
2020-09-04 09:56:50 | INFO |       10.400 |      402           2              0.044 
2020-09-04 09:56:50 | INFO |       10.426 |      403           1              0.026 
2020-09-04 09:56:50 | INFO |       10.452 |      404           1              0.026 
2020-09-04 09:56:50 | INFO |       10.478 |      405           1              0.026 
2020-09-04 09:56:50 | INFO |       10.530 |      406           2              0.052 
2020-09-04 09:56:50 | INFO |       10.582 |      407           2              0.052 
2020-09-04 09:56:50 | INFO |       10.633 |      408           2              0.052 
2020-09-04 09:56:50 | INFO |       10.685 |      409           2              0.052 
2020-09-04 09:56:50 | DEBUG | call of SolverReInit ie a new symbolic and numerical factorization will be performed
2020-09-04 09:56:50 | DEBUG | call of SolverReInit ie a new symbolic and numerical factorization will be performed
2020-09-04 09:56:50 | INFO |       10.739 |      410           2              0.053 
2020-09-04 09:56:50 | INFO |       10.792 |      411           2              0.053 
2020-09-04 09:56:50 | INFO |       10.845 |      412           2              0.053 
2020-09-04 09:56:50 | INFO |       10.898 |      413           2              0.053 
2020-09-04 09:56:50 | INFO |       10.946 |      414           2              0.048 
2020-09-04 09:56:50 | INFO |       10.972 |      415           1              0.027 
2020-09-04 09:56:50 | INFO |       10.999 |      416           1              0.027 
2020-09-04 09:56:50 | INFO |       11.026 |      417           1              0.027 
2020-09-04 09:56:50 | INFO |       11.079 |      418           2              0.053 
2020-09-04 09:56:50 | INFO |       11.132 |      419           2              0.053 
2020-09-04 09:56:50 | INFO |       11.185 |      420           2              0.053 
2020-09-04 09:56:50 | INFO |       11.239 |      421           2              0.053 
2020-09-04 09:56:50 | INFO |       11.292 |      422           2              0.053 
2020-09-04 09:56:50 | INFO |       11.345 |      423           2              0.053 
2020-09-04 09:56:51 | INFO |       11.398 |      424           2              0.053 
2020-09-04 09:56:51 | INFO |       11.452 |      425           2              0.053 
2020-09-04 09:56:51 | DEBUG | call of SolverReInit ie a new symbolic and numerical factorization will be performed
2020-09-04 09:56:51 | INFO |       11.505 |      426           1              0.053 
2020-09-04 09:56:51 | INFO |       11.545 |      427           1              0.040 
2020-09-04 09:56:51 | INFO |       11.581 |      428           1              0.035 
2020-09-04 09:56:51 | DEBUG | call of SolverReInit ie a new symbolic and numerical factorization will be performed
2020-09-04 09:56:51 | INFO |       11.612 |      429           1              0.031 
2020-09-04 09:56:51 | INFO |       11.640 |      430           1              0.028 
2020-09-04 09:56:51 | INFO |       11.669 |      431           1              0.028 
2020-09-04 09:56:51 | INFO |       11.697 |      432           1              0.028 
2020-09-04 09:56:51 | INFO |       11.754 |      433           2              0.057 
2020-09-04 09:56:51 | INFO |       11.805 |      434           2              0.051 
2020-09-04 09:56:51 | INFO |       11.856 |      435           2              0.051 
2020-09-04 09:56:51 | INFO |       11.907 |      436           2              0.051 
2020-09-04 09:56:51 | INFO |       11.958 |      437           2              0.051 
2020-09-04 09:56:51 | INFO |       12.009 |      438           2              0.051 
2020-09-04 09:56:51 | DEBUG | call of SolverReInit ie a new symbolic and numerical factorization will be performed
2020-09-04 09:56:51 | DEBUG | call of SolverReInit ie a new symbolic and numerical factorization will be performed
2020-09-04 09:56:51 | INFO |       12.038 |      439           1              0.030 
2020-09-04 09:56:51 | INFO |       12.068 |      440           1              0.030 
2020-09-04 09:56:51 | INFO |       12.097 |      441           1              0.030 
2020-09-04 09:56:51 | INFO |       12.156 |      442           2              0.059 
2020-09-04 09:56:51 | INFO |       12.215 |      443           2              0.059 
2020-09-04 09:56:51 | INFO |       12.275 |      444           2              0.059 
2020-09-04 09:56:51 | DEBUG | call of SolverReInit ie a new symbolic and numerical factorization will be performed
2020-09-04 09:56:51 | INFO |       12.348 |      445           2              0.074 
2020-09-04 09:56:51 | INFO |       12.422 |      446           2              0.074 
2020-09-04 09:56:51 | INFO |       12.496 |      447           2              0.074 
2020-09-04 09:56:51 | DEBUG | call of SolverReInit ie a new symbolic and numerical factorization will be performed
2020-09-04 09:56:51 | INFO |       12.562 |      448           2              0.066 
2020-09-04 09:56:51 | INFO |       12.601 |      449           1              0.039 
2020-09-04 09:56:51 | INFO |       12.639 |      450           1              0.039 
2020-09-04 09:56:51 | INFO |       12.678 |      451           1              0.039 
2020-09-04 09:56:51 | INFO |       12.755 |      452           2              0.077 
2020-09-04 09:56:51 | INFO |       12.832 |      453           2              0.077 
2020-09-04 09:56:51 | INFO |       12.909 |      454           2              0.077 
2020-09-04 09:56:51 | INFO |       12.987 |      455           2              0.077 
2020-09-04 09:56:51 | INFO |       13.064 |      456           2              0.077 
2020-09-04 09:56:51 | INFO |       13.141 |      457           2              0.077 
2020-09-04 09:56:51 | DEBUG | call of SolverReInit ie a new symbolic and numerical factorization will be performed
2020-09-04 09:56:51 | DEBUG | call of SolverReInit ie a new symbolic and numerical factorization will be performed
2020-09-04 09:56:51 | INFO |       13.179 |      458           1              0.038 
2020-09-04 09:56:51 | INFO |       13.217 |      459           1              0.038 
2020-09-04 09:56:51 | INFO |       13.256 |      460           1              0.038 
2020-09-04 09:56:51 | INFO |       13.332 |      461           2              0.076 
2020-09-04 09:56:51 | INFO |       13.408 |      462           2              0.076 
2020-09-04 09:56:51 | INFO |       13.485 |      463           2              0.076 
2020-09-04 09:56:51 | INFO |       13.561 |      464           2              0.076 
2020-09-04 09:56:51 | INFO |       13.638 |      465           2              0.076 
2020-09-04 09:56:51 | DEBUG | call of SolverReInit ie a new symbolic and numerical factorization will be performed
2020-09-04 09:56:51 | DEBUG | call of SolverReInit ie a new symbolic and numerical factorization will be performed
2020-09-04 09:56:51 | INFO |       13.684 |      466           1              0.046 
2020-09-04 09:56:51 | INFO |       13.729 |      467           1              0.046 
2020-09-04 09:56:51 | INFO |       13.775 |      468           1              0.046 
2020-09-04 09:56:51 | INFO |       13.867 |      469           2              0.092 
2020-09-04 09:56:51 | INFO |       13.959 |      470           2              0.092 
2020-09-04 09:56:51 | INFO |       14.050 |      471           2              0.092 
2020-09-04 09:56:51 | INFO |       14.142 |      472           2              0.092 
2020-09-04 09:56:51 | INFO |       14.234 |      473           2              0.092 
2020-09-04 09:56:51 | DEBUG | call of SolverReInit ie a new symbolic and numerical factorization will be performed
2020-09-04 09:56:51 | INFO |       14.289 |      474           1              0.055 
2020-09-04 09:56:51 | INFO |       14.344 |      475           1              0.055 
2020-09-04 09:56:51 | INFO |       14.399 |      476           1              0.055 
2020-09-04 09:56:51 | INFO |       14.510 |      477           2              0.110 
2020-09-04 09:56:51 | INFO |       14.609 |      478           2              0.099 
2020-09-04 09:56:51 | DEBUG | call of SolverReInit ie a new symbolic and numerical factorization will be performed
2020-09-04 09:56:51 | INFO |       14.788 |      479           1              0.179 
2020-09-04 09:56:51 | DEBUG | call of SolverReInit ie a new symbolic and numerical factorization will be performed
2020-09-04 09:56:51 | INFO |       14.881 |      480           1              0.093 
2020-09-04 09:56:51 | INFO |       14.975 |      481           1              0.093 
2020-09-04 09:56:51 | INFO |       15.068 |      482           1              0.093 
2020-09-04 09:56:51 | INFO |       15.255 |      483           2              0.187 
2020-09-04 09:56:51 | DEBUG | call of SolverReInit ie a new symbolic and numerical factorization will be performed
2020-09-04 09:56:51 | INFO |       15.423 |      484           1              0.168 
2020-09-04 09:56:51 | DEBUG | call of SolverReInit ie a new symbolic and numerical factorization will be performed
2020-09-04 09:56:51 | DEBUG | call of SolverReInit ie a new symbolic and numerical factorization will be performed
2020-09-04 09:56:51 | INFO |       15.580 |      485           1              0.157 
2020-09-04 09:56:51 | INFO |       15.737 |      486           1              0.157 
2020-09-04 09:56:51 | INFO |       15.894 |      487           1              0.157 
2020-09-04 09:56:51 | DEBUG | call of SolverReInit ie a new symbolic and numerical factorization will be performed
2020-09-04 09:56:51 | INFO |       16.209 |      488           1              0.314 
2020-09-04 09:56:51 | INFO |       16.523 |      489           1              0.314 
2020-09-04 09:56:51 | INFO |       16.837 |      490           1              0.314 
2020-09-04 09:56:51 | DEBUG | call of SolverReInit ie a new symbolic and numerical factorization will be performed
2020-09-04 09:56:51 | INFO |       17.466 |      491           1              0.629 
2020-09-04 09:56:51 | DEBUG | call of SolverReInit ie a new symbolic and numerical factorization will be performed
2020-09-04 09:56:51 | INFO |       18.723 |      492           1              1.257 
2020-09-04 09:56:51 | DEBUG | call of SolverReInit ie a new symbolic and numerical factorization will be performed
2020-09-04 09:56:51 | INFO |       21.238 |      493           1              2.514 
2020-09-04 09:56:51 | DEBUG | call of SolverReInit ie a new symbolic and numerical factorization will be performed
2020-09-04 09:56:51 | INFO |       26.267 |      494           1              5.029 
2020-09-04 09:56:51 | INFO |       30.000 |      495           1              3.733 
2020-09-04 09:56:51 | INFO | 
2020-09-04 09:56:51 | INFO | execution statistics :
2020-09-04 09:56:51 | INFO | 
2020-09-04 09:56:51 | INFO | number of time iterations                  = 521
2020-09-04 09:56:51 | INFO | number of residual evaluations             = 1098
2020-09-04 09:56:51 | INFO | number of Jacobian evaluations             = 98
2020-09-04 09:56:51 | INFO | number of nonlinear iterations             = 1094
2020-09-04 09:56:51 | INFO | number of error test failures              = 21
2020-09-04 09:56:51 | INFO | number of nonlinear convergence failures   = 0
2020-09-04 09:56:51 | INFO | number of root functions evaluations       = 570
2020-09-04 09:56:51 | INFO | number of discrete variables evaluations   = 4
2020-09-04 09:56:51 | INFO | number of mode evaluations                 = 3
2020-09-04 09:56:51 | INFO | end of job 'SMIB_StepEfd'
