2022-10-04 09:21:36 | INFO |  ============================================================ 
2022-10-04 09:21:36 | INFO | DYNAWO VERSION  :     1.4.0
2022-10-04 09:21:36 | INFO | DYNAWO REVISION :  2493_extvar_ref_optional-4d1b4ff51
2022-10-04 09:21:36 | INFO |  ============================================================ 
2022-10-04 09:21:36 | INFO | 
2022-10-04 09:21:36 | INFO | -----------------------------------------------------------------------
2022-10-04 09:21:36 | INFO | building model from input files
2022-10-04 09:21:36 | INFO | -----------------------------------------------------------------------
2022-10-04 09:22:23 | INFO | model was built successfully
2022-10-04 09:22:23 | INFO | -----------------------------------------------------------------------
2022-10-04 09:22:23 | INFO | 
2022-10-04 09:22:23 | INFO | -----------------------------------------------------------------------
2022-10-04 09:22:23 | INFO | starting local initialization
2022-10-04 09:22:23 | INFO | -----------------------------------------------------------------------
2022-10-04 09:22:23 | INFO | end of local initialization
2022-10-04 09:22:23 | INFO | -----------------------------------------------------------------------
2022-10-04 09:22:23 | INFO | 
2022-10-04 09:22:23 | INFO | -----------------------------------------------------------------------
2022-10-04 09:22:23 | INFO | starting global initialization
2022-10-04 09:22:23 | INFO | -----------------------------------------------------------------------
2022-10-04 09:22:23 | INFO | end of global initialization
2022-10-04 09:22:23 | INFO | -----------------------------------------------------------------------
2022-10-04 09:22:23 | INFO | 
2022-10-04 09:22:23 | INFO | -----------------------------------------------------------------------
2022-10-04 09:22:23 | INFO | starting curve initialization
2022-10-04 09:22:23 | INFO | -----------------------------------------------------------------------
2022-10-04 09:22:23 | INFO | end of curve initialization, added 18 curves
2022-10-04 09:22:23 | INFO | -----------------------------------------------------------------------
2022-10-04 09:22:23 | INFO | 
2022-10-04 09:22:23 | INFO | -----------------------------------------------------------------------
2022-10-04 09:22:23 | INFO | starting simulation with solver IDASolver
2022-10-04 09:22:23 | INFO | -----------------------------------------------------------------------
2022-10-04 09:22:23 | INFO | -----------------------------------------------------------------------
2022-10-04 09:22:23 | INFO | number of continuous variables : 81
2022-10-04 09:22:23 | INFO | number of discrete variables : 19
2022-10-04 09:22:23 | INFO | number of root functions : 23
2022-10-04 09:22:23 | INFO | -----------------------------------------------------------------------
2022-10-04 09:22:23 | INFO |         time | iter num   order (k)      time step (h)
2022-10-04 09:22:23 | INFO | -----------------------------------------------------------------------
2022-10-04 09:22:23 | INFO |        0.000 |        0           0              0.010 
2022-10-04 09:22:23 | INFO |        0.000 |        1           1              0.000 
2022-10-04 09:22:23 | INFO |        0.000 |        2           1              0.000 
2022-10-04 09:22:23 | INFO |        0.000 |        3           2              0.000 
2022-10-04 09:22:23 | INFO |        0.000 |        4           2              0.000 
2022-10-04 09:22:23 | INFO |        0.000 |        5           2              0.000 
2022-10-04 09:22:23 | INFO |        0.000 |        6           2              0.000 
2022-10-04 09:22:23 | INFO |        0.000 |        7           2              0.000 
2022-10-04 09:22:23 | INFO |        0.000 |        8           2              0.000 
2022-10-04 09:22:23 | INFO |        0.000 |        9           2              0.000 
2022-10-04 09:22:23 | INFO |        0.001 |       10           2              0.000 
2022-10-04 09:22:23 | INFO |        0.001 |       11           2              0.001 
2022-10-04 09:22:23 | INFO |        0.002 |       12           2              0.001 
2022-10-04 09:22:23 | INFO |        0.004 |       13           2              0.002 
2022-10-04 09:22:23 | INFO |        0.008 |       14           2              0.004 
2022-10-04 09:22:23 | INFO |        0.016 |       15           2              0.008 
2022-10-04 09:22:23 | INFO |        0.033 |       16           2              0.016 
2022-10-04 09:22:23 | INFO |        0.066 |       17           2              0.033 
2022-10-04 09:22:23 | INFO |        0.131 |       18           1              0.066 
2022-10-04 09:22:23 | INFO |        0.262 |       19           1              0.131 
2022-10-04 09:22:23 | INFO |        0.524 |       20           1              0.262 
2022-10-04 09:22:23 | INFO | Algebraic mode (with J recalculation) change at t = 1
2022-10-04 09:22:23 | INFO |        1.000 |       21           1              0.524 
2022-10-04 09:22:23 | INFO | calculation of the new starting point of the simulation.
2022-10-04 09:22:23 | INFO |        1.000 |        0           0              0.000 
2022-10-04 09:22:23 | INFO |        1.000 |        1           1              0.000 
2022-10-04 09:22:23 | INFO |        1.000 |        2           1              0.000 
2022-10-04 09:22:23 | INFO |        1.000 |        3           2              0.000 
2022-10-04 09:22:23 | INFO |        1.000 |        4           2              0.000 
2022-10-04 09:22:23 | INFO |        1.000 |        5           2              0.000 
2022-10-04 09:22:23 | INFO |        1.000 |        6           2              0.000 
2022-10-04 09:22:23 | INFO |        1.000 |        7           2              0.000 
2022-10-04 09:22:23 | INFO |        1.000 |        8           2              0.000 
2022-10-04 09:22:23 | INFO |        1.000 |        9           2              0.000 
2022-10-04 09:22:23 | INFO |        1.001 |       10           2              0.000 
2022-10-04 09:22:23 | INFO | Algebraic mode change at t = 1.00054
2022-10-04 09:22:23 | INFO |        1.001 |       11           2              0.001 
2022-10-04 09:22:23 | INFO | calculation of the new starting point of the simulation.
2022-10-04 09:22:23 | INFO |        1.001 |        0           0              0.000 
2022-10-04 09:22:23 | INFO |        1.001 |        1           1              0.000 
2022-10-04 09:22:23 | INFO |        1.001 |        2           1              0.000 
2022-10-04 09:22:23 | INFO |        1.001 |        3           2              0.000 
2022-10-04 09:22:23 | INFO |        1.001 |        4           2              0.000 
2022-10-04 09:22:23 | INFO |        1.001 |        5           2              0.000 
2022-10-04 09:22:23 | INFO |        1.001 |        6           2              0.000 
2022-10-04 09:22:23 | INFO |        1.001 |        7           2              0.000 
2022-10-04 09:22:23 | INFO |        1.001 |        8           2              0.000 
2022-10-04 09:22:23 | INFO |        1.001 |        9           2              0.000 
2022-10-04 09:22:23 | INFO |        1.001 |       10           2              0.000 
2022-10-04 09:22:23 | INFO |        1.002 |       11           2              0.001 
2022-10-04 09:22:23 | INFO |        1.003 |       12           2              0.001 
2022-10-04 09:22:23 | INFO |        1.005 |       13           2              0.002 
2022-10-04 09:22:23 | INFO |        1.007 |       14           2              0.002 
2022-10-04 09:22:23 | INFO |        1.009 |       15           2              0.002 
2022-10-04 09:22:23 | INFO |        1.011 |       16           2              0.002 
2022-10-04 09:22:23 | INFO |        1.013 |       17           2              0.002 
2022-10-04 09:22:23 | INFO |        1.015 |       18           2              0.002 
2022-10-04 09:22:23 | INFO |        1.017 |       19           2              0.002 
2022-10-04 09:22:23 | INFO |        1.019 |       20           2              0.002 
2022-10-04 09:22:23 | INFO |        1.021 |       21           2              0.002 
2022-10-04 09:22:23 | INFO |        1.023 |       22           2              0.002 
2022-10-04 09:22:23 | INFO |        1.025 |       23           2              0.002 
2022-10-04 09:22:23 | INFO |        1.027 |       24           2              0.002 
2022-10-04 09:22:23 | INFO |        1.029 |       25           2              0.002 
2022-10-04 09:22:23 | INFO |        1.033 |       26           2              0.004 
2022-10-04 09:22:23 | INFO |        1.037 |       27           2              0.004 
2022-10-04 09:22:23 | INFO |        1.041 |       28           2              0.004 
2022-10-04 09:22:23 | INFO |        1.044 |       29           2              0.004 
2022-10-04 09:22:23 | INFO |        1.048 |       30           2              0.004 
2022-10-04 09:22:23 | INFO |        1.052 |       31           2              0.004 
2022-10-04 09:22:23 | INFO |        1.055 |       32           2              0.004 
2022-10-04 09:22:23 | INFO |        1.059 |       33           2              0.004 
2022-10-04 09:22:23 | INFO |        1.063 |       34           2              0.004 
2022-10-04 09:22:23 | INFO |        1.066 |       35           2              0.004 
2022-10-04 09:22:23 | INFO | Algebraic mode change at t = 1.06712
2022-10-04 09:22:23 | INFO |        1.067 |       36           2              0.007 
2022-10-04 09:22:23 | INFO | calculation of the new starting point of the simulation.
2022-10-04 09:22:23 | INFO |        1.067 |        0           0              0.000 
2022-10-04 09:22:23 | INFO | Algebraic mode change at t = 1.06712
2022-10-04 09:22:23 | INFO |        1.067 |        1           1              0.000 
2022-10-04 09:22:23 | INFO | calculation of the new starting point of the simulation.
2022-10-04 09:22:23 | INFO |        1.067 |        0           0              0.000 
2022-10-04 09:22:23 | INFO |        1.067 |        1           1              0.000 
2022-10-04 09:22:23 | INFO |        1.067 |        2           1              0.000 
2022-10-04 09:22:23 | INFO |        1.067 |        3           2              0.000 
2022-10-04 09:22:23 | INFO |        1.067 |        4           2              0.000 
2022-10-04 09:22:23 | INFO |        1.067 |        5           2              0.000 
2022-10-04 09:22:23 | INFO |        1.067 |        6           2              0.000 
2022-10-04 09:22:23 | INFO |        1.067 |        7           2              0.000 
2022-10-04 09:22:23 | INFO |        1.067 |        8           2              0.000 
2022-10-04 09:22:23 | INFO |        1.067 |        9           2              0.000 
2022-10-04 09:22:23 | INFO |        1.068 |       10           2              0.000 
2022-10-04 09:22:23 | INFO |        1.068 |       11           2              0.001 
2022-10-04 09:22:23 | INFO |        1.069 |       12           2              0.001 
2022-10-04 09:22:23 | INFO | Algebraic mode (with J recalculation) change at t = 1.07
2022-10-04 09:22:23 | INFO |        1.070 |       13           2              0.002 
2022-10-04 09:22:23 | INFO | calculation of the new starting point of the simulation.
2022-10-04 09:22:23 | INFO |        1.070 |        0           0              0.000 
2022-10-04 09:22:23 | INFO |        1.070 |        1           1              0.000 
2022-10-04 09:22:23 | INFO |        1.070 |        2           1              0.000 
2022-10-04 09:22:23 | INFO |        1.070 |        3           2              0.000 
2022-10-04 09:22:23 | INFO |        1.070 |        4           2              0.000 
2022-10-04 09:22:23 | INFO |        1.070 |        5           2              0.000 
2022-10-04 09:22:23 | INFO |        1.070 |        6           2              0.000 
2022-10-04 09:22:23 | INFO |        1.070 |        7           2              0.000 
2022-10-04 09:22:23 | INFO |        1.070 |        8           2              0.000 
2022-10-04 09:22:23 | INFO |        1.070 |        9           2              0.000 
2022-10-04 09:22:23 | INFO |        1.071 |       10           2              0.000 
2022-10-04 09:22:23 | INFO |        1.071 |       11           2              0.001 
2022-10-04 09:22:23 | INFO | Algebraic mode change at t = 1.07133
2022-10-04 09:22:23 | INFO |        1.071 |       12           2              0.001 
2022-10-04 09:22:23 | INFO | calculation of the new starting point of the simulation.
2022-10-04 09:22:23 | INFO |        1.071 |        0           0              0.000 
2022-10-04 09:22:23 | INFO |        1.071 |        1           1              0.000 
2022-10-04 09:22:23 | INFO |        1.071 |        2           1              0.000 
2022-10-04 09:22:23 | INFO |        1.071 |        3           2              0.000 
2022-10-04 09:22:23 | INFO |        1.071 |        4           2              0.000 
2022-10-04 09:22:23 | INFO |        1.071 |        5           2              0.000 
2022-10-04 09:22:23 | INFO |        1.071 |        6           2              0.000 
2022-10-04 09:22:23 | INFO |        1.071 |        7           2              0.000 
2022-10-04 09:22:23 | INFO |        1.071 |        8           2              0.000 
2022-10-04 09:22:23 | INFO |        1.072 |        9           2              0.000 
2022-10-04 09:22:23 | INFO |        1.072 |       10           2              0.000 
2022-10-04 09:22:23 | INFO |        1.072 |       11           2              0.001 
2022-10-04 09:22:23 | INFO |        1.073 |       12           2              0.001 
2022-10-04 09:22:23 | INFO |        1.075 |       13           2              0.002 
2022-10-04 09:22:23 | INFO |        1.077 |       14           2              0.002 
2022-10-04 09:22:23 | INFO |        1.080 |       15           2              0.002 
2022-10-04 09:22:23 | INFO |        1.082 |       16           2              0.002 
2022-10-04 09:22:23 | INFO |        1.084 |       17           2              0.002 
2022-10-04 09:22:23 | INFO |        1.086 |       18           2              0.002 
2022-10-04 09:22:23 | INFO |        1.088 |       19           2              0.002 
2022-10-04 09:22:23 | INFO |        1.090 |       20           2              0.002 
2022-10-04 09:22:23 | INFO |        1.092 |       21           2              0.002 
2022-10-04 09:22:23 | INFO |        1.094 |       22           2              0.002 
2022-10-04 09:22:23 | INFO |        1.098 |       23           2              0.004 
2022-10-04 09:22:23 | INFO |        1.102 |       24           2              0.004 
2022-10-04 09:22:23 | INFO |        1.106 |       25           2              0.004 
2022-10-04 09:22:23 | INFO |        1.110 |       26           2              0.004 
2022-10-04 09:22:23 | INFO |        1.114 |       27           2              0.004 
2022-10-04 09:22:23 | INFO |        1.118 |       28           2              0.004 
2022-10-04 09:22:23 | INFO |        1.123 |       29           2              0.004 
2022-10-04 09:22:23 | INFO |        1.127 |       30           2              0.004 
2022-10-04 09:22:23 | INFO |        1.131 |       31           2              0.004 
2022-10-04 09:22:23 | INFO |        1.139 |       32           2              0.008 
2022-10-04 09:22:23 | INFO |        1.147 |       33           2              0.008 
2022-10-04 09:22:23 | INFO |        1.155 |       34           2              0.008 
2022-10-04 09:22:23 | INFO |        1.163 |       35           2              0.008 
2022-10-04 09:22:23 | INFO |        1.172 |       36           2              0.008 
2022-10-04 09:22:23 | INFO |        1.180 |       37           2              0.008 
2022-10-04 09:22:23 | INFO |        1.188 |       38           2              0.008 
2022-10-04 09:22:23 | INFO |        1.196 |       39           2              0.008 
2022-10-04 09:22:23 | INFO |        1.213 |       40           2              0.016 
2022-10-04 09:22:23 | INFO |        1.229 |       41           2              0.016 
2022-10-04 09:22:23 | INFO |        1.245 |       42           2              0.016 
2022-10-04 09:22:23 | INFO |        1.262 |       43           2              0.016 
2022-10-04 09:22:23 | INFO |        1.278 |       44           2              0.016 
2022-10-04 09:22:23 | INFO |        1.295 |       45           2              0.016 
2022-10-04 09:22:23 | INFO |        1.311 |       46           2              0.016 
2022-10-04 09:22:23 | INFO | Algebraic mode change at t = 1.31597
2022-10-04 09:22:23 | INFO |        1.316 |       47           2              0.016 
2022-10-04 09:22:23 | INFO | calculation of the new starting point of the simulation.
2022-10-04 09:22:23 | INFO |        1.316 |        0           0              0.000 
2022-10-04 09:22:23 | INFO |        1.316 |        1           1              0.000 
2022-10-04 09:22:23 | INFO |        1.316 |        2           1              0.000 
2022-10-04 09:22:23 | INFO |        1.316 |        3           2              0.000 
2022-10-04 09:22:23 | INFO |        1.316 |        4           2              0.000 
2022-10-04 09:22:23 | INFO |        1.316 |        5           2              0.000 
2022-10-04 09:22:23 | INFO |        1.316 |        6           2              0.000 
2022-10-04 09:22:23 | INFO |        1.316 |        7           2              0.000 
2022-10-04 09:22:23 | INFO |        1.316 |        8           2              0.000 
2022-10-04 09:22:23 | INFO |        1.316 |        9           2              0.000 
2022-10-04 09:22:23 | INFO |        1.316 |       10           2              0.000 
2022-10-04 09:22:23 | INFO |        1.317 |       11           2              0.001 
2022-10-04 09:22:23 | INFO |        1.318 |       12           2              0.001 
2022-10-04 09:22:23 | INFO |        1.320 |       13           2              0.002 
2022-10-04 09:22:23 | INFO |        1.324 |       14           2              0.004 
2022-10-04 09:22:23 | INFO |        1.332 |       15           2              0.008 
2022-10-04 09:22:23 | INFO |        1.349 |       16           2              0.016 
2022-10-04 09:22:23 | INFO |        1.365 |       17           2              0.016 
2022-10-04 09:22:23 | INFO |        1.382 |       18           2              0.016 
2022-10-04 09:22:23 | INFO |        1.398 |       19           2              0.016 
2022-10-04 09:22:23 | INFO |        1.431 |       20           2              0.033 
2022-10-04 09:22:23 | INFO |        1.460 |       21           2              0.029 
2022-10-04 09:22:23 | INFO |        1.490 |       22           2              0.029 
2022-10-04 09:22:23 | INFO |        1.519 |       23           2              0.029 
2022-10-04 09:22:23 | INFO |        1.549 |       24           2              0.029 
2022-10-04 09:22:23 | INFO |        1.578 |       25           2              0.029 
2022-10-04 09:22:23 | INFO |        1.608 |       26           2              0.029 
2022-10-04 09:22:23 | INFO |        1.637 |       27           2              0.029 
2022-10-04 09:22:23 | INFO |        1.667 |       28           2              0.029 
2022-10-04 09:22:23 | INFO |        1.696 |       29           2              0.029 
2022-10-04 09:22:23 | INFO |        1.726 |       30           2              0.029 
2022-10-04 09:22:23 | INFO |        1.755 |       31           2              0.029 
2022-10-04 09:22:23 | INFO |        1.785 |       32           2              0.029 
2022-10-04 09:22:23 | INFO |        1.814 |       33           2              0.029 
2022-10-04 09:22:23 | INFO |        1.844 |       34           2              0.029 
2022-10-04 09:22:23 | INFO |        1.873 |       35           2              0.029 
2022-10-04 09:22:23 | INFO |        1.903 |       36           2              0.029 
2022-10-04 09:22:23 | INFO |        1.932 |       37           2              0.029 
2022-10-04 09:22:23 | INFO |        1.961 |       38           2              0.029 
2022-10-04 09:22:23 | INFO |        1.991 |       39           2              0.029 
2022-10-04 09:22:23 | INFO |        2.020 |       40           2              0.029 
2022-10-04 09:22:23 | INFO |        2.050 |       41           2              0.029 
2022-10-04 09:22:23 | INFO |        2.079 |       42           2              0.029 
2022-10-04 09:22:23 | INFO |        2.109 |       43           2              0.029 
2022-10-04 09:22:23 | INFO |        2.138 |       44           2              0.029 
2022-10-04 09:22:23 | INFO |        2.168 |       45           2              0.029 
2022-10-04 09:22:23 | INFO |        2.197 |       46           2              0.029 
2022-10-04 09:22:23 | INFO |        2.227 |       47           2              0.029 
2022-10-04 09:22:23 | INFO |        2.256 |       48           2              0.029 
2022-10-04 09:22:23 | INFO |        2.286 |       49           2              0.029 
2022-10-04 09:22:23 | INFO |        2.315 |       50           2              0.029 
2022-10-04 09:22:23 | INFO |        2.345 |       51           2              0.029 
2022-10-04 09:22:23 | INFO |        2.374 |       52           2              0.029 
2022-10-04 09:22:23 | INFO |        2.404 |       53           2              0.029 
2022-10-04 09:22:23 | INFO |        2.433 |       54           2              0.029 
2022-10-04 09:22:23 | INFO |        2.463 |       55           2              0.029 
2022-10-04 09:22:23 | INFO |        2.522 |       56           2              0.059 
2022-10-04 09:22:23 | INFO |        2.575 |       57           2              0.053 
2022-10-04 09:22:23 | INFO |        2.628 |       58           2              0.053 
2022-10-04 09:22:23 | INFO |        2.681 |       59           2              0.053 
2022-10-04 09:22:23 | INFO |        2.729 |       60           2              0.048 
2022-10-04 09:22:23 | INFO |        2.777 |       61           2              0.048 
2022-10-04 09:22:23 | INFO |        2.820 |       62           2              0.043 
2022-10-04 09:22:23 | INFO |        2.863 |       63           2              0.043 
2022-10-04 09:22:23 | INFO |        2.906 |       64           2              0.043 
2022-10-04 09:22:23 | INFO |        2.949 |       65           2              0.043 
2022-10-04 09:22:23 | INFO |        2.992 |       66           2              0.043 
2022-10-04 09:22:23 | INFO |        3.035 |       67           2              0.043 
2022-10-04 09:22:23 | INFO |        3.078 |       68           2              0.043 
2022-10-04 09:22:23 | INFO |        3.121 |       69           2              0.043 
2022-10-04 09:22:23 | INFO |        3.164 |       70           2              0.043 
2022-10-04 09:22:23 | INFO |        3.207 |       71           2              0.043 
2022-10-04 09:22:23 | INFO |        3.250 |       72           2              0.043 
2022-10-04 09:22:23 | INFO |        3.293 |       73           2              0.043 
2022-10-04 09:22:23 | INFO |        3.336 |       74           2              0.043 
2022-10-04 09:22:23 | INFO |        3.379 |       75           2              0.043 
2022-10-04 09:22:23 | INFO |        3.422 |       76           2              0.043 
2022-10-04 09:22:23 | INFO |        3.465 |       77           2              0.043 
2022-10-04 09:22:23 | INFO |        3.508 |       78           2              0.043 
2022-10-04 09:22:23 | INFO |        3.551 |       79           2              0.043 
2022-10-04 09:22:23 | INFO |        3.594 |       80           2              0.043 
2022-10-04 09:22:23 | INFO |        3.637 |       81           2              0.043 
2022-10-04 09:22:23 | INFO |        3.680 |       82           2              0.043 
2022-10-04 09:22:23 | INFO |        3.723 |       83           2              0.043 
2022-10-04 09:22:23 | INFO |        3.766 |       84           2              0.043 
2022-10-04 09:22:23 | INFO |        3.809 |       85           2              0.043 
2022-10-04 09:22:23 | INFO |        3.852 |       86           2              0.043 
2022-10-04 09:22:23 | INFO |        3.895 |       87           2              0.043 
2022-10-04 09:22:23 | INFO |        3.938 |       88           2              0.043 
2022-10-04 09:22:23 | INFO |        3.981 |       89           2              0.043 
2022-10-04 09:22:23 | INFO |        4.024 |       90           2              0.043 
2022-10-04 09:22:23 | INFO |        4.067 |       91           2              0.043 
2022-10-04 09:22:23 | INFO |        4.110 |       92           2              0.043 
2022-10-04 09:22:23 | INFO |        4.153 |       93           2              0.043 
2022-10-04 09:22:23 | INFO |        4.196 |       94           2              0.043 
2022-10-04 09:22:23 | INFO |        4.239 |       95           2              0.043 
2022-10-04 09:22:23 | INFO |        4.282 |       96           2              0.043 
2022-10-04 09:22:23 | INFO |        4.325 |       97           2              0.043 
2022-10-04 09:22:23 | INFO |        4.368 |       98           2              0.043 
2022-10-04 09:22:23 | INFO |        4.411 |       99           2              0.043 
2022-10-04 09:22:23 | INFO |        4.454 |      100           2              0.043 
2022-10-04 09:22:23 | INFO |        4.497 |      101           2              0.043 
2022-10-04 09:22:23 | INFO |        4.540 |      102           2              0.043 
2022-10-04 09:22:23 | INFO |        4.583 |      103           2              0.043 
2022-10-04 09:22:23 | INFO |        4.626 |      104           2              0.043 
2022-10-04 09:22:23 | INFO |        4.712 |      105           2              0.086 
2022-10-04 09:22:23 | INFO |        4.798 |      106           2              0.086 
2022-10-04 09:22:23 | INFO |        4.884 |      107           2              0.086 
2022-10-04 09:22:23 | INFO |        4.970 |      108           2              0.086 
2022-10-04 09:22:23 | INFO |        5.000 |      109           2              0.030 
2022-10-04 09:22:23 | INFO | 
2022-10-04 09:22:23 | INFO | execution statistics :
2022-10-04 09:22:23 | INFO | 
2022-10-04 09:22:23 | INFO | number of time iterations                  = 250
2022-10-04 09:22:23 | INFO | number of residual evaluations             = 372
2022-10-04 09:22:23 | INFO | number of Jacobian evaluations             = 110
2022-10-04 09:22:23 | INFO | number of nonlinear iterations             = 356
2022-10-04 09:22:23 | INFO | number of error test failures              = 0
2022-10-04 09:22:23 | INFO | number of nonlinear convergence failures   = 0
2022-10-04 09:22:23 | INFO | number of root functions evaluations       = 529
2022-10-04 09:22:23 | INFO | number of discrete variables evaluations   = 16
2022-10-04 09:22:23 | INFO | number of mode evaluations                 = 14
2022-10-04 09:22:23 | INFO | end of job 'Kundur Example 13 - AVR and PSS case'
