2020-08-18 15:24:18 | INFO |  ============================================================ 
2020-08-18 15:24:18 | INFO | DYNAWO VERSION  :     1.3.0
2020-08-18 15:24:18 | INFO | DYNAWO REVISION :  1063_NrtUpdate-21f59376
2020-08-18 15:24:18 | INFO |  ============================================================ 
2020-08-18 15:24:18 | INFO | 
2020-08-18 15:24:18 | INFO | -----------------------------------------------------------------------
2020-08-18 15:24:18 | INFO | building model from input files
2020-08-18 15:24:18 | INFO | -----------------------------------------------------------------------
2020-08-18 15:25:46 | INFO | model was built successfully
2020-08-18 15:25:46 | INFO | -----------------------------------------------------------------------
2020-08-18 15:25:46 | INFO | 
2020-08-18 15:25:46 | INFO | -----------------------------------------------------------------------
2020-08-18 15:25:46 | INFO | starting local initialization
2020-08-18 15:25:46 | INFO | -----------------------------------------------------------------------
2020-08-18 15:25:46 | DEBUG | ------------------------------
2020-08-18 15:25:46 | DEBUG | starting local initialization of model SM
2020-08-18 15:25:46 | DEBUG | local initialization of model SM ended successfully
2020-08-18 15:25:46 | INFO | end of local initialization
2020-08-18 15:25:46 | INFO | -----------------------------------------------------------------------
2020-08-18 15:25:46 | INFO | 
2020-08-18 15:25:46 | INFO | -----------------------------------------------------------------------
2020-08-18 15:25:46 | INFO | starting global initialization
2020-08-18 15:25:46 | INFO | -----------------------------------------------------------------------
2020-08-18 15:25:46 | DEBUG | initialization of IDA solver : ok
2020-08-18 15:25:46 | INFO | Algebraic mode change for model SM
2020-08-18 15:25:46 | DEBUG | call of SolverReInit ie a new symbolic and numerical factorization will be performed
2020-08-18 15:25:46 | DEBUG | call of SolverReInit ie a new symbolic and numerical factorization will be performed
2020-08-18 15:25:46 | DEBUG | call of SolverReInit ie a new symbolic and numerical factorization will be performed
2020-08-18 15:25:46 | INFO | end of global initialization
2020-08-18 15:25:46 | INFO | -----------------------------------------------------------------------
2020-08-18 15:25:46 | INFO | 
2020-08-18 15:25:46 | INFO | -----------------------------------------------------------------------
2020-08-18 15:25:46 | INFO | starting curve initialization
2020-08-18 15:25:46 | INFO | -----------------------------------------------------------------------
2020-08-18 15:25:46 | DEBUG | adding curve : Id: SM; curve: gen_cePu found. (exact name)
2020-08-18 15:25:46 | DEBUG | adding curve : Id: SM; curve: gen_PePu found. (exact name)
2020-08-18 15:25:46 | DEBUG | adding curve : Id: SM; curve: gen_cmPu found. (exact name)
2020-08-18 15:25:46 | DEBUG | adding curve : Id: SM; output: gen_PmPu found.( gen_PmPu_value )
2020-08-18 15:25:46 | DEBUG | adding curve : Id: SM; curve: gen_ufPu found. (exact name)
2020-08-18 15:25:46 | DEBUG | adding curve : Id: SM; output: gen_efdPu found.( gen_efdPu_value )
2020-08-18 15:25:46 | DEBUG | adding curve : Id: SM; output: gen_omegaPu found.( gen_omegaPu_value )
2020-08-18 15:25:46 | DEBUG | adding curve : Id: SM; curve: gen_theta found. (exact name)
2020-08-18 15:25:46 | DEBUG | adding curve : Id: SM; curve: gen_PGenPu found. (exact name)
2020-08-18 15:25:46 | DEBUG | adding curve : Id: SM; curve: gen_QGenPu found. (exact name)
2020-08-18 15:25:46 | DEBUG | adding curve : Id: SM; curve: gen_PGen found. (exact name)
2020-08-18 15:25:46 | DEBUG | adding curve : Id: SM; curve: gen_QGen found. (exact name)
2020-08-18 15:25:46 | DEBUG | adding curve : Id: SM; curve: gen_UPu found. (exact name)
2020-08-18 15:25:46 | DEBUG | adding curve : Id: SM; output: gen_IStatorPu found.( gen_IStatorPu_value )
2020-08-18 15:25:46 | DEBUG | adding curve : Id: SM; output: gen_IRotorPu found.( gen_IRotorPu_value )
2020-08-18 15:25:46 | DEBUG | adding curve : Id: SM; output: gen_UStatorPu found.( gen_UStatorPu_value )
2020-08-18 15:25:46 | DEBUG | adding curve : Id: SM; output: gen_QStatorPu found.( gen_QStatorPu_value )
2020-08-18 15:25:46 | DEBUG | adding curve : Id: SM; output: gen_thetaInternal found.( gen_thetaInternal_value )
2020-08-18 15:25:46 | DEBUG | adding curve : Id: SM; output: gover_PmRefPu found.( gover_PmRefPu_value )
2020-08-18 15:25:46 | INFO | end of curve initialization, added 19 curves
2020-08-18 15:25:46 | INFO | -----------------------------------------------------------------------
2020-08-18 15:25:46 | INFO | 
2020-08-18 15:25:46 | INFO | -----------------------------------------------------------------------
2020-08-18 15:25:46 | INFO | starting simulation with solver IDASolver
2020-08-18 15:25:46 | INFO | -----------------------------------------------------------------------
2020-08-18 15:25:46 | INFO | -----------------------------------------------------------------------
2020-08-18 15:25:46 | INFO | number of continuous variables : 63
2020-08-18 15:25:46 | INFO | number of discrete variables : 30
2020-08-18 15:25:46 | INFO | -----------------------------------------------------------------------
2020-08-18 15:25:46 | INFO |         time | iter num   order (k)      time step (h)
2020-08-18 15:25:46 | INFO | -----------------------------------------------------------------------
2020-08-18 15:25:46 | INFO |        0.000 |        0           0              0.010 
2020-08-18 15:25:46 | DEBUG | call of SolverReInit ie a new symbolic and numerical factorization will be performed
2020-08-18 15:25:46 | INFO |        0.000 |        1           1              0.000 
2020-08-18 15:25:46 | DEBUG | largest derivative values (truncated to the first 10) at the current iteration
2020-08-18 15:25:46 | DEBUG | YP[3]=-0.00984018 (variable=Network_busInf_terminal_i_re)
2020-08-18 15:25:46 | DEBUG | YP[51]=0.00984018 (variable=SM_gen_terminal_i_re)
2020-08-18 15:25:46 | DEBUG | YP[17]=-0.00984018 (variable=Network_tfo_terminal2_i_re)
2020-08-18 15:25:46 | DEBUG | YP[15]=0.00984018 (variable=Network_tfo_terminal1_i_re)
2020-08-18 15:25:46 | DEBUG | YP[5]=0.00639951 (variable=Network_line1_terminal1_i_re)
2020-08-18 15:25:46 | DEBUG | YP[9]=-0.00639951 (variable=Network_line1_terminal2_i_re)
2020-08-18 15:25:46 | DEBUG | YP[2]=0.00579458 (variable=Network_busInf_terminal_i_im)
2020-08-18 15:25:46 | DEBUG | YP[50]=-0.00579458 (variable=SM_gen_terminal_i_im)
2020-08-18 15:25:46 | DEBUG | YP[16]=0.00579458 (variable=Network_tfo_terminal2_i_im)
2020-08-18 15:25:46 | DEBUG | YP[14]=-0.00579458 (variable=Network_tfo_terminal1_i_im)
2020-08-18 15:25:46 | INFO |        0.000 |        2           1              0.000 
2020-08-18 15:25:46 | INFO |        0.000 |        3           2              0.000 
2020-08-18 15:25:46 | DEBUG | call of SolverReInit ie a new symbolic and numerical factorization will be performed
2020-08-18 15:25:46 | INFO |        0.000 |        4           2              0.000 
2020-08-18 15:25:46 | DEBUG | call of SolverReInit ie a new symbolic and numerical factorization will be performed
2020-08-18 15:25:46 | INFO |        0.000 |        5           2              0.000 
2020-08-18 15:25:46 | DEBUG | call of SolverReInit ie a new symbolic and numerical factorization will be performed
2020-08-18 15:25:46 | INFO |        0.000 |        6           2              0.000 
2020-08-18 15:25:46 | DEBUG | call of SolverReInit ie a new symbolic and numerical factorization will be performed
2020-08-18 15:25:46 | INFO |        0.000 |        7           2              0.000 
2020-08-18 15:25:46 | DEBUG | call of SolverReInit ie a new symbolic and numerical factorization will be performed
2020-08-18 15:25:46 | INFO |        0.000 |        8           2              0.000 
2020-08-18 15:25:46 | DEBUG | call of SolverReInit ie a new symbolic and numerical factorization will be performed
2020-08-18 15:25:46 | INFO |        0.000 |        9           2              0.000 
2020-08-18 15:25:46 | DEBUG | call of SolverReInit ie a new symbolic and numerical factorization will be performed
2020-08-18 15:25:46 | INFO |        0.001 |       10           2              0.000 
2020-08-18 15:25:46 | DEBUG | call of SolverReInit ie a new symbolic and numerical factorization will be performed
2020-08-18 15:25:46 | INFO |        0.001 |       11           2              0.001 
2020-08-18 15:25:46 | DEBUG | call of SolverReInit ie a new symbolic and numerical factorization will be performed
2020-08-18 15:25:46 | INFO |        0.002 |       12           2              0.001 
2020-08-18 15:25:46 | DEBUG | call of SolverReInit ie a new symbolic and numerical factorization will be performed
2020-08-18 15:25:46 | INFO |        0.004 |       13           2              0.002 
2020-08-18 15:25:46 | DEBUG | call of SolverReInit ie a new symbolic and numerical factorization will be performed
2020-08-18 15:25:46 | INFO |        0.008 |       14           2              0.004 
2020-08-18 15:25:46 | DEBUG | call of SolverReInit ie a new symbolic and numerical factorization will be performed
2020-08-18 15:25:46 | INFO |        0.016 |       15           2              0.008 
2020-08-18 15:25:46 | DEBUG | call of SolverReInit ie a new symbolic and numerical factorization will be performed
2020-08-18 15:25:46 | INFO |        0.033 |       16           2              0.016 
2020-08-18 15:25:46 | DEBUG | call of SolverReInit ie a new symbolic and numerical factorization will be performed
2020-08-18 15:25:46 | INFO |        0.066 |       17           2              0.033 
2020-08-18 15:25:46 | INFO |        0.098 |       18           2              0.033 
2020-08-18 15:25:46 | DEBUG | call of SolverReInit ie a new symbolic and numerical factorization will be performed
2020-08-18 15:25:46 | INFO |        0.164 |       19           2              0.066 
2020-08-18 15:25:46 | INFO |        0.229 |       20           1              0.066 
2020-08-18 15:25:46 | DEBUG | call of SolverReInit ie a new symbolic and numerical factorization will be performed
2020-08-18 15:25:46 | INFO |        0.360 |       21           1              0.131 
2020-08-18 15:25:46 | INFO |        0.492 |       22           1              0.131 
2020-08-18 15:25:46 | INFO |        0.623 |       23           1              0.131 
2020-08-18 15:25:46 | INFO |        0.754 |       24           2              0.131 
2020-08-18 15:25:46 | INFO |        0.885 |       25           2              0.131 
2020-08-18 15:25:46 | INFO | Algebraic mode change for model SM
2020-08-18 15:25:46 | INFO |        1.000 |       26           2              0.262 
2020-08-18 15:25:46 | INFO | calculation of the new starting point of the simulation.
2020-08-18 15:25:46 | DEBUG | call of SolverReInit ie a new symbolic and numerical factorization will be performed
2020-08-18 15:25:46 | DEBUG | call of SolverReInit ie a new symbolic and numerical factorization will be performed
2020-08-18 15:25:46 | INFO |        1.000 |        0           0              0.000 
2020-08-18 15:25:46 | DEBUG | largest derivative values (truncated to the first 10) at the current iteration
2020-08-18 15:25:46 | DEBUG | YP[22]=0.00285808 (variable=SM_gen_omegaPu_value)
2020-08-18 15:25:46 | DEBUG | YP[25]=-4.17188e-05 (variable=SM_gen_theta)
2020-08-18 15:25:46 | DEBUG | YP[21]=-8.71039e-06 (variable=SM_gen_lambdafPu)
2020-08-18 15:25:46 | DEBUG | YP[20]=5.74053e-06 (variable=SM_gen_lambdaQ2Pu)
2020-08-18 15:25:46 | DEBUG | YP[19]=-3.08985e-06 (variable=SM_gen_lambdaQ1Pu)
2020-08-18 15:25:46 | DEBUG | YP[18]=1.23732e-06 (variable=SM_gen_lambdaDPu)
2020-08-18 15:25:46 | DEBUG | YP[43]=0 (variable=SM_gen_lambdaAirGapPu)
2020-08-18 15:25:46 | DEBUG | YP[45]=0 (variable=SM_gen_lambdaqPu)
2020-08-18 15:25:46 | DEBUG | YP[44]=0 (variable=SM_gen_lambdadPu)
2020-08-18 15:25:46 | DEBUG | YP[46]=0 (variable=SM_gen_mdsPu)
2020-08-18 15:25:46 | DEBUG | call of SolverReInit ie a new symbolic and numerical factorization will be performed
2020-08-18 15:25:46 | INFO |        1.000 |        1           1              0.000 
2020-08-18 15:25:46 | INFO |        1.000 |        2           1              0.000 
2020-08-18 15:25:46 | INFO |        1.000 |        3           2              0.000 
2020-08-18 15:25:46 | DEBUG | call of SolverReInit ie a new symbolic and numerical factorization will be performed
2020-08-18 15:25:46 | INFO |        1.000 |        4           2              0.000 
2020-08-18 15:25:46 | DEBUG | call of SolverReInit ie a new symbolic and numerical factorization will be performed
2020-08-18 15:25:46 | INFO |        1.000 |        5           2              0.000 
2020-08-18 15:25:46 | DEBUG | call of SolverReInit ie a new symbolic and numerical factorization will be performed
2020-08-18 15:25:46 | INFO |        1.000 |        6           2              0.000 
2020-08-18 15:25:46 | DEBUG | call of SolverReInit ie a new symbolic and numerical factorization will be performed
2020-08-18 15:25:46 | INFO |        1.000 |        7           2              0.000 
2020-08-18 15:25:46 | DEBUG | call of SolverReInit ie a new symbolic and numerical factorization will be performed
2020-08-18 15:25:46 | INFO |        1.000 |        8           2              0.000 
2020-08-18 15:25:46 | DEBUG | call of SolverReInit ie a new symbolic and numerical factorization will be performed
2020-08-18 15:25:46 | INFO |        1.000 |        9           2              0.000 
2020-08-18 15:25:46 | DEBUG | call of SolverReInit ie a new symbolic and numerical factorization will be performed
2020-08-18 15:25:46 | INFO |        1.001 |       10           2              0.000 
2020-08-18 15:25:46 | DEBUG | call of SolverReInit ie a new symbolic and numerical factorization will be performed
2020-08-18 15:25:46 | INFO |        1.001 |       11           2              0.001 
2020-08-18 15:25:46 | DEBUG | call of SolverReInit ie a new symbolic and numerical factorization will be performed
2020-08-18 15:25:46 | INFO |        1.002 |       12           2              0.001 
2020-08-18 15:25:46 | DEBUG | call of SolverReInit ie a new symbolic and numerical factorization will be performed
2020-08-18 15:25:46 | INFO |        1.004 |       13           2              0.002 
2020-08-18 15:25:46 | DEBUG | call of SolverReInit ie a new symbolic and numerical factorization will be performed
2020-08-18 15:25:46 | INFO |        1.008 |       14           2              0.004 
2020-08-18 15:25:46 | DEBUG | call of SolverReInit ie a new symbolic and numerical factorization will be performed
2020-08-18 15:25:46 | INFO |        1.016 |       15           2              0.008 
2020-08-18 15:25:46 | INFO |        1.025 |       16           2              0.008 
2020-08-18 15:25:46 | DEBUG | call of SolverReInit ie a new symbolic and numerical factorization will be performed
2020-08-18 15:25:46 | INFO |        1.041 |       17           2              0.016 
2020-08-18 15:25:46 | INFO |        1.057 |       18           2              0.016 
2020-08-18 15:25:46 | INFO |        1.074 |       19           2              0.016 
2020-08-18 15:25:46 | INFO |        1.090 |       20           2              0.016 
2020-08-18 15:25:46 | INFO |        1.106 |       21           2              0.016 
2020-08-18 15:25:46 | INFO |        1.123 |       22           2              0.016 
2020-08-18 15:25:46 | INFO |        1.139 |       23           2              0.016 
2020-08-18 15:25:46 | INFO |        1.156 |       24           2              0.016 
2020-08-18 15:25:46 | INFO |        1.172 |       25           2              0.016 
2020-08-18 15:25:46 | INFO |        1.188 |       26           2              0.016 
2020-08-18 15:25:46 | INFO |        1.205 |       27           2              0.016 
2020-08-18 15:25:46 | INFO |        1.221 |       28           2              0.016 
2020-08-18 15:25:46 | INFO |        1.238 |       29           2              0.016 
2020-08-18 15:25:46 | INFO |        1.254 |       30           2              0.016 
2020-08-18 15:25:46 | INFO |        1.270 |       31           2              0.016 
2020-08-18 15:25:46 | INFO |        1.287 |       32           2              0.016 
2020-08-18 15:25:46 | INFO |        1.303 |       33           2              0.016 
2020-08-18 15:25:46 | INFO |        1.319 |       34           2              0.016 
2020-08-18 15:25:46 | INFO |        1.336 |       35           2              0.016 
2020-08-18 15:25:46 | INFO |        1.352 |       36           2              0.016 
2020-08-18 15:25:46 | INFO |        1.369 |       37           2              0.016 
2020-08-18 15:25:46 | INFO |        1.385 |       38           2              0.016 
2020-08-18 15:25:46 | INFO |        1.401 |       39           2              0.016 
2020-08-18 15:25:46 | INFO |        1.418 |       40           2              0.016 
2020-08-18 15:25:46 | INFO |        1.434 |       41           2              0.016 
2020-08-18 15:25:46 | INFO |        1.451 |       42           2              0.016 
2020-08-18 15:25:46 | INFO |        1.467 |       43           2              0.016 
2020-08-18 15:25:46 | INFO |        1.483 |       44           2              0.016 
2020-08-18 15:25:46 | DEBUG | call of SolverReInit ie a new symbolic and numerical factorization will be performed
2020-08-18 15:25:46 | INFO |        1.516 |       45           2              0.033 
2020-08-18 15:25:46 | INFO |        1.543 |       46           2              0.027 
2020-08-18 15:25:46 | INFO |        1.569 |       47           2              0.027 
2020-08-18 15:25:46 | INFO |        1.593 |       48           2              0.023 
2020-08-18 15:25:46 | DEBUG | call of SolverReInit ie a new symbolic and numerical factorization will be performed
2020-08-18 15:25:46 | INFO |        1.613 |       49           2              0.021 
2020-08-18 15:25:46 | INFO |        1.632 |       50           2              0.019 
2020-08-18 15:25:46 | INFO |        1.651 |       51           2              0.019 
2020-08-18 15:25:46 | INFO |        1.668 |       52           2              0.017 
2020-08-18 15:25:46 | INFO |        1.685 |       53           2              0.017 
2020-08-18 15:25:46 | INFO |        1.702 |       54           2              0.017 
2020-08-18 15:25:46 | INFO |        1.718 |       55           2              0.017 
2020-08-18 15:25:46 | INFO |        1.735 |       56           2              0.017 
2020-08-18 15:25:46 | INFO |        1.752 |       57           2              0.017 
2020-08-18 15:25:46 | INFO |        1.769 |       58           2              0.017 
2020-08-18 15:25:46 | INFO |        1.786 |       59           2              0.017 
2020-08-18 15:25:46 | INFO |        1.803 |       60           2              0.017 
2020-08-18 15:25:46 | INFO |        1.820 |       61           2              0.017 
2020-08-18 15:25:46 | INFO |        1.837 |       62           2              0.017 
2020-08-18 15:25:46 | INFO |        1.853 |       63           2              0.017 
2020-08-18 15:25:46 | INFO |        1.870 |       64           2              0.017 
2020-08-18 15:25:46 | INFO |        1.887 |       65           2              0.017 
2020-08-18 15:25:46 | INFO |        1.904 |       66           2              0.017 
2020-08-18 15:25:46 | INFO |        1.921 |       67           2              0.017 
2020-08-18 15:25:46 | INFO |        1.938 |       68           2              0.017 
2020-08-18 15:25:46 | INFO |        1.955 |       69           2              0.017 
2020-08-18 15:25:46 | DEBUG | call of SolverReInit ie a new symbolic and numerical factorization will be performed
2020-08-18 15:25:46 | INFO |        1.988 |       70           2              0.034 
2020-08-18 15:25:46 | INFO |        2.018 |       71           2              0.030 
2020-08-18 15:25:46 | INFO |        2.046 |       72           2              0.027 
2020-08-18 15:25:46 | INFO |        2.070 |       73           2              0.024 
2020-08-18 15:25:46 | DEBUG | call of SolverReInit ie a new symbolic and numerical factorization will be performed
2020-08-18 15:25:46 | INFO |        2.092 |       74           2              0.022 
2020-08-18 15:25:46 | INFO |        2.112 |       75           2              0.020 
2020-08-18 15:25:46 | INFO |        2.131 |       76           2              0.020 
2020-08-18 15:25:46 | INFO |        2.151 |       77           2              0.020 
2020-08-18 15:25:46 | INFO |        2.171 |       78           2              0.020 
2020-08-18 15:25:46 | INFO |        2.189 |       79           2              0.018 
2020-08-18 15:25:46 | INFO |        2.207 |       80           2              0.018 
2020-08-18 15:25:46 | INFO |        2.224 |       81           2              0.018 
2020-08-18 15:25:46 | INFO |        2.242 |       82           2              0.018 
2020-08-18 15:25:46 | INFO |        2.260 |       83           2              0.018 
2020-08-18 15:25:46 | INFO |        2.278 |       84           2              0.018 
2020-08-18 15:25:46 | INFO |        2.295 |       85           2              0.018 
2020-08-18 15:25:46 | INFO |        2.313 |       86           2              0.018 
2020-08-18 15:25:46 | INFO |        2.331 |       87           2              0.018 
2020-08-18 15:25:46 | INFO |        2.349 |       88           2              0.018 
2020-08-18 15:25:46 | INFO |        2.367 |       89           2              0.018 
2020-08-18 15:25:46 | INFO |        2.384 |       90           2              0.018 
2020-08-18 15:25:46 | INFO |        2.402 |       91           2              0.018 
2020-08-18 15:25:46 | INFO |        2.420 |       92           2              0.018 
2020-08-18 15:25:46 | DEBUG | call of SolverReInit ie a new symbolic and numerical factorization will be performed
2020-08-18 15:25:46 | INFO |        2.455 |       93           2              0.036 
2020-08-18 15:25:46 | INFO |        2.491 |       94           2              0.036 
2020-08-18 15:25:46 | INFO |        2.523 |       95           2              0.032 
2020-08-18 15:25:46 | INFO |        2.552 |       96           2              0.029 
2020-08-18 15:25:46 | INFO |        2.577 |       97           2              0.026 
2020-08-18 15:25:46 | INFO |        2.601 |       98           2              0.023 
2020-08-18 15:25:46 | DEBUG | call of SolverReInit ie a new symbolic and numerical factorization will be performed
2020-08-18 15:25:46 | INFO |        2.621 |       99           2              0.021 
2020-08-18 15:25:46 | INFO |        2.642 |      100           2              0.021 
2020-08-18 15:25:46 | INFO |        2.663 |      101           2              0.021 
2020-08-18 15:25:46 | INFO |        2.684 |      102           2              0.021 
2020-08-18 15:25:46 | INFO |        2.704 |      103           2              0.021 
2020-08-18 15:25:46 | INFO |        2.725 |      104           2              0.021 
2020-08-18 15:25:46 | INFO |        2.746 |      105           2              0.021 
2020-08-18 15:25:46 | INFO |        2.767 |      106           2              0.021 
2020-08-18 15:25:46 | INFO |        2.788 |      107           2              0.021 
2020-08-18 15:25:46 | INFO |        2.808 |      108           2              0.021 
2020-08-18 15:25:46 | INFO |        2.829 |      109           2              0.021 
2020-08-18 15:25:46 | INFO |        2.850 |      110           2              0.021 
2020-08-18 15:25:46 | INFO |        2.871 |      111           2              0.021 
2020-08-18 15:25:46 | INFO |        2.892 |      112           2              0.021 
2020-08-18 15:25:46 | INFO |        2.912 |      113           2              0.021 
2020-08-18 15:25:46 | INFO |        2.933 |      114           2              0.021 
2020-08-18 15:25:46 | DEBUG | call of SolverReInit ie a new symbolic and numerical factorization will be performed
2020-08-18 15:25:46 | DEBUG | call of SolverReInit ie a new symbolic and numerical factorization will be performed
2020-08-18 15:25:46 | INFO |        2.960 |      115           2              0.027 
2020-08-18 15:25:46 | INFO |        2.987 |      116           2              0.027 
2020-08-18 15:25:46 | INFO |        3.013 |      117           2              0.027 
2020-08-18 15:25:46 | INFO |        3.040 |      118           2              0.027 
2020-08-18 15:25:46 | INFO |        3.064 |      119           2              0.024 
2020-08-18 15:25:46 | INFO |        3.088 |      120           2              0.024 
2020-08-18 15:25:46 | INFO |        3.110 |      121           2              0.022 
2020-08-18 15:25:46 | INFO |        3.132 |      122           2              0.022 
2020-08-18 15:25:46 | INFO |        3.154 |      123           2              0.022 
2020-08-18 15:25:46 | INFO |        3.175 |      124           2              0.022 
2020-08-18 15:25:46 | INFO |        3.197 |      125           2              0.022 
2020-08-18 15:25:46 | INFO |        3.219 |      126           2              0.022 
2020-08-18 15:25:46 | INFO |        3.240 |      127           2              0.022 
2020-08-18 15:25:46 | INFO |        3.262 |      128           2              0.022 
2020-08-18 15:25:46 | INFO |        3.284 |      129           2              0.022 
2020-08-18 15:25:46 | INFO |        3.305 |      130           2              0.022 
2020-08-18 15:25:46 | INFO |        3.327 |      131           2              0.022 
2020-08-18 15:25:46 | INFO |        3.349 |      132           2              0.022 
2020-08-18 15:25:46 | INFO |        3.371 |      133           2              0.022 
2020-08-18 15:25:46 | INFO |        3.392 |      134           2              0.022 
2020-08-18 15:25:46 | DEBUG | call of SolverReInit ie a new symbolic and numerical factorization will be performed
2020-08-18 15:25:46 | INFO |        3.436 |      135           2              0.043 
2020-08-18 15:25:46 | INFO |        3.474 |      136           2              0.038 
2020-08-18 15:25:46 | INFO |        3.508 |      137           2              0.034 
2020-08-18 15:25:46 | INFO |        3.538 |      138           2              0.031 
2020-08-18 15:25:46 | INFO |        3.566 |      139           2              0.028 
2020-08-18 15:25:46 | DEBUG | call of SolverReInit ie a new symbolic and numerical factorization will be performed
2020-08-18 15:25:46 | INFO |        3.591 |      140           2              0.025 
2020-08-18 15:25:46 | INFO |        3.616 |      141           2              0.025 
2020-08-18 15:25:46 | INFO |        3.638 |      142           2              0.022 
2020-08-18 15:25:46 | INFO |        3.661 |      143           2              0.022 
2020-08-18 15:25:46 | INFO |        3.683 |      144           2              0.022 
2020-08-18 15:25:46 | INFO |        3.705 |      145           2              0.022 
2020-08-18 15:25:46 | INFO |        3.728 |      146           2              0.022 
2020-08-18 15:25:46 | INFO |        3.750 |      147           2              0.022 
2020-08-18 15:25:46 | INFO |        3.773 |      148           2              0.022 
2020-08-18 15:25:46 | INFO |        3.795 |      149           2              0.022 
2020-08-18 15:25:46 | INFO |        3.817 |      150           2              0.022 
2020-08-18 15:25:46 | INFO |        3.840 |      151           2              0.022 
2020-08-18 15:25:46 | INFO |        3.862 |      152           2              0.022 
2020-08-18 15:25:46 | INFO |        3.885 |      153           2              0.022 
2020-08-18 15:25:46 | DEBUG | call of SolverReInit ie a new symbolic and numerical factorization will be performed
2020-08-18 15:25:46 | INFO |        3.929 |      154           2              0.045 
2020-08-18 15:25:46 | INFO |        3.966 |      155           2              0.037 
2020-08-18 15:25:46 | INFO |        4.003 |      156           2              0.037 
2020-08-18 15:25:46 | INFO |        4.034 |      157           2              0.031 
2020-08-18 15:25:46 | INFO |        4.062 |      158           2              0.028 
2020-08-18 15:25:46 | DEBUG | call of SolverReInit ie a new symbolic and numerical factorization will be performed
2020-08-18 15:25:46 | INFO |        4.088 |      159           2              0.025 
2020-08-18 15:25:46 | INFO |        4.113 |      160           2              0.025 
2020-08-18 15:25:46 | INFO |        4.138 |      161           2              0.025 
2020-08-18 15:25:46 | INFO |        4.163 |      162           2              0.025 
2020-08-18 15:25:46 | INFO |        4.189 |      163           2              0.025 
2020-08-18 15:25:46 | INFO |        4.214 |      164           2              0.025 
2020-08-18 15:25:46 | INFO |        4.239 |      165           2              0.025 
2020-08-18 15:25:46 | INFO |        4.265 |      166           2              0.025 
2020-08-18 15:25:46 | INFO |        4.290 |      167           2              0.025 
2020-08-18 15:25:46 | INFO |        4.315 |      168           2              0.025 
2020-08-18 15:25:46 | INFO |        4.340 |      169           2              0.025 
2020-08-18 15:25:46 | INFO |        4.366 |      170           2              0.025 
2020-08-18 15:25:46 | DEBUG | call of SolverReInit ie a new symbolic and numerical factorization will be performed
2020-08-18 15:25:46 | INFO |        4.401 |      171           2              0.035 
2020-08-18 15:25:46 | INFO |        4.437 |      172           2              0.035 
2020-08-18 15:25:46 | INFO |        4.472 |      173           2              0.035 
2020-08-18 15:25:46 | INFO |        4.504 |      174           2              0.032 
2020-08-18 15:25:46 | INFO |        4.536 |      175           2              0.032 
2020-08-18 15:25:46 | DEBUG | call of SolverReInit ie a new symbolic and numerical factorization will be performed
2020-08-18 15:25:46 | INFO |        4.565 |      176           2              0.029 
2020-08-18 15:25:46 | INFO |        4.594 |      177           2              0.029 
2020-08-18 15:25:46 | INFO |        4.619 |      178           2              0.026 
2020-08-18 15:25:46 | INFO |        4.645 |      179           2              0.026 
2020-08-18 15:25:46 | INFO |        4.671 |      180           2              0.026 
2020-08-18 15:25:46 | INFO |        4.697 |      181           2              0.026 
2020-08-18 15:25:46 | INFO |        4.723 |      182           2              0.026 
2020-08-18 15:25:46 | INFO |        4.749 |      183           2              0.026 
2020-08-18 15:25:46 | INFO |        4.775 |      184           2              0.026 
2020-08-18 15:25:46 | INFO |        4.800 |      185           2              0.026 
2020-08-18 15:25:46 | INFO |        4.826 |      186           2              0.026 
2020-08-18 15:25:46 | INFO |        4.852 |      187           2              0.026 
2020-08-18 15:25:46 | DEBUG | call of SolverReInit ie a new symbolic and numerical factorization will be performed
2020-08-18 15:25:46 | INFO |        4.904 |      188           2              0.052 
2020-08-18 15:25:46 | INFO |        4.945 |      189           2              0.041 
2020-08-18 15:25:46 | INFO |        4.987 |      190           2              0.041 
2020-08-18 15:25:46 | INFO |        5.022 |      191           2              0.035 
2020-08-18 15:25:46 | INFO |        5.054 |      192           2              0.032 
2020-08-18 15:25:46 | INFO |        5.085 |      193           2              0.032 
2020-08-18 15:25:46 | DEBUG | call of SolverReInit ie a new symbolic and numerical factorization will be performed
2020-08-18 15:25:46 | INFO |        5.114 |      194           2              0.029 
2020-08-18 15:25:46 | INFO |        5.142 |      195           2              0.029 
2020-08-18 15:25:46 | INFO |        5.171 |      196           2              0.029 
2020-08-18 15:25:46 | INFO |        5.200 |      197           2              0.029 
2020-08-18 15:25:46 | INFO |        5.228 |      198           2              0.029 
2020-08-18 15:25:46 | INFO |        5.257 |      199           2              0.029 
2020-08-18 15:25:46 | INFO |        5.285 |      200           2              0.029 
2020-08-18 15:25:46 | INFO |        5.314 |      201           2              0.029 
2020-08-18 15:25:46 | INFO |        5.342 |      202           2              0.029 
2020-08-18 15:25:46 | DEBUG | call of SolverReInit ie a new symbolic and numerical factorization will be performed
2020-08-18 15:25:46 | INFO |        5.381 |      203           2              0.038 
2020-08-18 15:25:46 | INFO |        5.419 |      204           2              0.038 
2020-08-18 15:25:46 | INFO |        5.457 |      205           2              0.038 
2020-08-18 15:25:46 | INFO |        5.495 |      206           2              0.038 
2020-08-18 15:25:46 | INFO |        5.530 |      207           2              0.034 
2020-08-18 15:25:46 | INFO |        5.564 |      208           2              0.034 
2020-08-18 15:25:46 | DEBUG | call of SolverReInit ie a new symbolic and numerical factorization will be performed
2020-08-18 15:25:46 | INFO |        5.595 |      209           2              0.031 
2020-08-18 15:25:46 | INFO |        5.626 |      210           2              0.031 
2020-08-18 15:25:46 | INFO |        5.657 |      211           2              0.031 
2020-08-18 15:25:46 | INFO |        5.688 |      212           2              0.031 
2020-08-18 15:25:46 | INFO |        5.719 |      213           2              0.031 
2020-08-18 15:25:46 | INFO |        5.750 |      214           2              0.031 
2020-08-18 15:25:46 | INFO |        5.781 |      215           2              0.031 
2020-08-18 15:25:46 | INFO |        5.812 |      216           2              0.031 
2020-08-18 15:25:46 | DEBUG | call of SolverReInit ie a new symbolic and numerical factorization will be performed
2020-08-18 15:25:46 | INFO |        5.874 |      217           2              0.062 
2020-08-18 15:25:46 | INFO |        5.924 |      218           2              0.049 
2020-08-18 15:25:46 | INFO |        5.973 |      219           2              0.049 
2020-08-18 15:25:46 | INFO |        6.014 |      220           2              0.041 
2020-08-18 15:25:46 | DEBUG | call of SolverReInit ie a new symbolic and numerical factorization will be performed
2020-08-18 15:25:46 | INFO |        6.051 |      221           2              0.037 
2020-08-18 15:25:46 | INFO |        6.087 |      222           2              0.037 
2020-08-18 15:25:46 | INFO |        6.120 |      223           2              0.033 
2020-08-18 15:25:46 | INFO |        6.153 |      224           2              0.033 
2020-08-18 15:25:46 | INFO |        6.186 |      225           2              0.033 
2020-08-18 15:25:46 | INFO |        6.219 |      226           2              0.033 
2020-08-18 15:25:46 | INFO |        6.253 |      227           2              0.033 
2020-08-18 15:25:46 | INFO |        6.286 |      228           2              0.033 
2020-08-18 15:25:46 | INFO |        6.319 |      229           2              0.033 
2020-08-18 15:25:46 | DEBUG | call of SolverReInit ie a new symbolic and numerical factorization will be performed
2020-08-18 15:25:46 | INFO |        6.362 |      230           2              0.044 
2020-08-18 15:25:46 | INFO |        6.406 |      231           2              0.044 
2020-08-18 15:25:46 | INFO |        6.450 |      232           2              0.044 
2020-08-18 15:25:46 | DEBUG | call of SolverReInit ie a new symbolic and numerical factorization will be performed
2020-08-18 15:25:46 | INFO |        6.490 |      233           2              0.039 
2020-08-18 15:25:46 | INFO |        6.529 |      234           2              0.039 
2020-08-18 15:25:46 | INFO |        6.565 |      235           2              0.036 
2020-08-18 15:25:46 | INFO |        6.600 |      236           2              0.036 
2020-08-18 15:25:46 | INFO |        6.636 |      237           2              0.036 
2020-08-18 15:25:46 | INFO |        6.671 |      238           2              0.036 
2020-08-18 15:25:46 | INFO |        6.707 |      239           2              0.036 
2020-08-18 15:25:46 | INFO |        6.742 |      240           2              0.036 
2020-08-18 15:25:46 | INFO |        6.778 |      241           2              0.036 
2020-08-18 15:25:46 | INFO |        6.813 |      242           2              0.036 
2020-08-18 15:25:46 | DEBUG | call of SolverReInit ie a new symbolic and numerical factorization will be performed
2020-08-18 15:25:46 | INFO |        6.859 |      243           2              0.045 
2020-08-18 15:25:46 | INFO |        6.904 |      244           2              0.045 
2020-08-18 15:25:46 | INFO |        6.949 |      245           2              0.045 
2020-08-18 15:25:46 | INFO |        6.995 |      246           2              0.045 
2020-08-18 15:25:46 | DEBUG | call of SolverReInit ie a new symbolic and numerical factorization will be performed
2020-08-18 15:25:46 | INFO |        7.036 |      247           2              0.041 
2020-08-18 15:25:46 | INFO |        7.077 |      248           2              0.041 
2020-08-18 15:25:46 | INFO |        7.117 |      249           2              0.041 
2020-08-18 15:25:46 | INFO |        7.158 |      250           2              0.041 
2020-08-18 15:25:46 | INFO |        7.199 |      251           2              0.041 
2020-08-18 15:25:46 | INFO |        7.240 |      252           2              0.041 
2020-08-18 15:25:46 | INFO |        7.281 |      253           2              0.041 
2020-08-18 15:25:46 | INFO |        7.321 |      254           2              0.041 
2020-08-18 15:25:46 | INFO |        7.362 |      255           2              0.041 
2020-08-18 15:25:46 | INFO |        7.403 |      256           2              0.041 
2020-08-18 15:25:46 | INFO |        7.444 |      257           2              0.041 
2020-08-18 15:25:46 | INFO |        7.485 |      258           2              0.041 
2020-08-18 15:25:46 | INFO |        7.526 |      259           2              0.041 
2020-08-18 15:25:46 | INFO |        7.566 |      260           2              0.041 
2020-08-18 15:25:46 | INFO |        7.607 |      261           2              0.041 
2020-08-18 15:25:46 | INFO |        7.648 |      262           2              0.041 
2020-08-18 15:25:46 | INFO |        7.689 |      263           2              0.041 
2020-08-18 15:25:46 | INFO |        7.730 |      264           2              0.041 
2020-08-18 15:25:46 | INFO |        7.771 |      265           2              0.041 
2020-08-18 15:25:46 | DEBUG | call of SolverReInit ie a new symbolic and numerical factorization will be performed
2020-08-18 15:25:46 | INFO |        7.827 |      266           2              0.057 
2020-08-18 15:25:46 | INFO |        7.884 |      267           2              0.057 
2020-08-18 15:25:46 | INFO |        7.941 |      268           2              0.057 
2020-08-18 15:25:46 | INFO |        7.991 |      269           2              0.051 
2020-08-18 15:25:46 | INFO |        8.042 |      270           2              0.051 
2020-08-18 15:25:46 | DEBUG | call of SolverReInit ie a new symbolic and numerical factorization will be performed
2020-08-18 15:25:46 | INFO |        8.068 |      271           1              0.026 
2020-08-18 15:25:46 | INFO |        8.094 |      272           1              0.026 
2020-08-18 15:25:46 | INFO |        8.119 |      273           1              0.026 
2020-08-18 15:25:46 | INFO |        8.171 |      274           2              0.051 
2020-08-18 15:25:46 | INFO |        8.222 |      275           2              0.051 
2020-08-18 15:25:46 | INFO |        8.273 |      276           2              0.051 
2020-08-18 15:25:46 | INFO |        8.325 |      277           2              0.051 
2020-08-18 15:25:46 | INFO |        8.376 |      278           2              0.051 
2020-08-18 15:25:46 | INFO |        8.427 |      279           2              0.051 
2020-08-18 15:25:46 | INFO |        8.479 |      280           2              0.051 
2020-08-18 15:25:46 | INFO |        8.530 |      281           2              0.051 
2020-08-18 15:25:46 | DEBUG | call of SolverReInit ie a new symbolic and numerical factorization will be performed
2020-08-18 15:25:46 | DEBUG | call of SolverReInit ie a new symbolic and numerical factorization will be performed
2020-08-18 15:25:46 | INFO |        8.560 |      282           1              0.030 
2020-08-18 15:25:46 | INFO |        8.590 |      283           1              0.030 
2020-08-18 15:25:46 | INFO |        8.620 |      284           1              0.030 
2020-08-18 15:25:46 | INFO |        8.679 |      285           2              0.060 
2020-08-18 15:25:46 | INFO |        8.739 |      286           2              0.060 
2020-08-18 15:25:46 | INFO |        8.799 |      287           2              0.060 
2020-08-18 15:25:46 | DEBUG | call of SolverReInit ie a new symbolic and numerical factorization will be performed
2020-08-18 15:25:46 | DEBUG | call of SolverReInit ie a new symbolic and numerical factorization will be performed
2020-08-18 15:25:46 | INFO |        8.858 |      288           2              0.059 
2020-08-18 15:25:46 | INFO |        8.916 |      289           2              0.059 
2020-08-18 15:25:46 | INFO |        8.975 |      290           2              0.059 
2020-08-18 15:25:46 | INFO |        9.033 |      291           2              0.059 
2020-08-18 15:25:46 | DEBUG | call of SolverReInit ie a new symbolic and numerical factorization will be performed
2020-08-18 15:25:46 | DEBUG | call of SolverReInit ie a new symbolic and numerical factorization will be performed
2020-08-18 15:25:46 | INFO |        9.066 |      292           1              0.033 
2020-08-18 15:25:46 | INFO |        9.099 |      293           1              0.033 
2020-08-18 15:25:46 | INFO |        9.132 |      294           1              0.033 
2020-08-18 15:25:46 | INFO |        9.198 |      295           2              0.066 
2020-08-18 15:25:46 | INFO |        9.264 |      296           2              0.066 
2020-08-18 15:25:46 | INFO |        9.330 |      297           2              0.066 
2020-08-18 15:25:46 | INFO |        9.396 |      298           2              0.066 
2020-08-18 15:25:46 | INFO |        9.462 |      299           2              0.066 
2020-08-18 15:25:46 | INFO |        9.528 |      300           2              0.066 
2020-08-18 15:25:46 | DEBUG | call of SolverReInit ie a new symbolic and numerical factorization will be performed
2020-08-18 15:25:46 | DEBUG | call of SolverReInit ie a new symbolic and numerical factorization will be performed
2020-08-18 15:25:46 | INFO |        9.568 |      301           1              0.039 
2020-08-18 15:25:46 | INFO |        9.607 |      302           1              0.039 
2020-08-18 15:25:46 | INFO |        9.646 |      303           1              0.039 
2020-08-18 15:25:46 | INFO |        9.725 |      304           2              0.079 
2020-08-18 15:25:46 | INFO |        9.803 |      305           2              0.079 
2020-08-18 15:25:46 | INFO |        9.882 |      306           2              0.079 
2020-08-18 15:25:46 | INFO |        9.961 |      307           2              0.079 
2020-08-18 15:25:46 | INFO |       10.039 |      308           2              0.079 
2020-08-18 15:25:46 | DEBUG | call of SolverReInit ie a new symbolic and numerical factorization will be performed
2020-08-18 15:25:46 | DEBUG | call of SolverReInit ie a new symbolic and numerical factorization will be performed
2020-08-18 15:25:46 | INFO |       10.085 |      309           1              0.046 
2020-08-18 15:25:46 | INFO |       10.132 |      310           1              0.046 
2020-08-18 15:25:46 | INFO |       10.178 |      311           1              0.046 
2020-08-18 15:25:46 | INFO |       10.271 |      312           2              0.093 
2020-08-18 15:25:46 | INFO |       10.354 |      313           2              0.083 
2020-08-18 15:25:46 | DEBUG | call of SolverReInit ie a new symbolic and numerical factorization will be performed
2020-08-18 15:25:46 | INFO |       10.442 |      314           1              0.088 
2020-08-18 15:25:46 | INFO |       10.510 |      315           1              0.067 
2020-08-18 15:25:46 | INFO |       10.577 |      316           1              0.067 
2020-08-18 15:25:46 | INFO |       10.645 |      317           1              0.067 
2020-08-18 15:25:46 | DEBUG | call of SolverReInit ie a new symbolic and numerical factorization will be performed
2020-08-18 15:25:46 | INFO |       10.712 |      318           2              0.067 
2020-08-18 15:25:46 | INFO |       10.779 |      319           2              0.067 
2020-08-18 15:25:46 | INFO |       10.847 |      320           2              0.067 
2020-08-18 15:25:46 | DEBUG | call of SolverReInit ie a new symbolic and numerical factorization will be performed
2020-08-18 15:25:46 | INFO |       10.981 |      321           2              0.135 
2020-08-18 15:25:46 | INFO |       11.095 |      322           2              0.114 
2020-08-18 15:25:46 | INFO |       11.209 |      323           1              0.114 
2020-08-18 15:25:46 | INFO |       11.299 |      324           1              0.089 
2020-08-18 15:25:46 | INFO |       11.388 |      325           1              0.089 
2020-08-18 15:25:46 | INFO |       11.477 |      326           1              0.089 
2020-08-18 15:25:46 | DEBUG | call of SolverReInit ie a new symbolic and numerical factorization will be performed
2020-08-18 15:25:46 | INFO |       11.655 |      327           1              0.178 
2020-08-18 15:25:46 | INFO |       11.834 |      328           1              0.178 
2020-08-18 15:25:46 | INFO |       12.012 |      329           1              0.178 
2020-08-18 15:25:46 | INFO |       12.191 |      330           1              0.178 
2020-08-18 15:25:46 | DEBUG | call of SolverReInit ie a new symbolic and numerical factorization will be performed
2020-08-18 15:25:46 | INFO |       12.547 |      331           1              0.357 
2020-08-18 15:25:46 | INFO |       12.904 |      332           1              0.357 
2020-08-18 15:25:46 | DEBUG | call of SolverReInit ie a new symbolic and numerical factorization will be performed
2020-08-18 15:25:46 | INFO |       13.618 |      333           1              0.714 
2020-08-18 15:25:46 | DEBUG | call of SolverReInit ie a new symbolic and numerical factorization will be performed
2020-08-18 15:25:46 | INFO |       15.045 |      334           1              1.427 
2020-08-18 15:25:46 | DEBUG | call of SolverReInit ie a new symbolic and numerical factorization will be performed
2020-08-18 15:25:46 | INFO |       17.900 |      335           1              2.855 
2020-08-18 15:25:46 | DEBUG | call of SolverReInit ie a new symbolic and numerical factorization will be performed
2020-08-18 15:25:46 | INFO |       23.609 |      336           1              5.709 
2020-08-18 15:25:46 | INFO |       30.000 |      337           1              6.391 
2020-08-18 15:25:46 | INFO | 
2020-08-18 15:25:46 | INFO | execution statistics :
2020-08-18 15:25:46 | INFO | 
2020-08-18 15:25:46 | INFO | number of time iterations                  = 363
2020-08-18 15:25:46 | INFO | number of residual evaluations             = 768
2020-08-18 15:25:46 | INFO | number of Jacobian evaluations             = 80
2020-08-18 15:25:46 | INFO | number of nonlinear iterations             = 764
2020-08-18 15:25:46 | INFO | number of error test failures              = 13
2020-08-18 15:25:46 | INFO | number of nonlinear convergence failures   = 0
2020-08-18 15:25:46 | INFO | number of root functions evaluations       = 412
2020-08-18 15:25:46 | INFO | number of discrete variables evaluations   = 4
2020-08-18 15:25:46 | INFO | number of mode evaluations                 = 3
2020-08-18 15:25:46 | INFO | end of job 'SMIB_StepPm'
