2023-04-25 16:28:51 | INFO |  ============================================================ 
2023-04-25 16:28:51 | INFO | DYNAWO VERSION  :     1.6.0
2023-04-25 16:28:51 | INFO | DYNAWO REVISION :    master-e473c85d51
2023-04-25 16:28:51 | INFO |  ============================================================ 
2023-04-25 16:28:51 | INFO | 
2023-04-25 16:28:51 | INFO | -----------------------------------------------------------------------
2023-04-25 16:28:51 | INFO | building model from input files
2023-04-25 16:28:51 | INFO | -----------------------------------------------------------------------
2023-04-25 16:28:51 | INFO | model was built successfully
2023-04-25 16:28:51 | INFO | -----------------------------------------------------------------------
2023-04-25 16:28:51 | INFO | 
2023-04-25 16:28:51 | INFO | -----------------------------------------------------------------------
2023-04-25 16:28:51 | INFO | starting local initialization
2023-04-25 16:28:51 | INFO | -----------------------------------------------------------------------
2023-04-25 16:28:51 | INFO | end of local initialization
2023-04-25 16:28:51 | INFO | -----------------------------------------------------------------------
2023-04-25 16:28:51 | INFO | 
2023-04-25 16:28:51 | INFO | -----------------------------------------------------------------------
2023-04-25 16:28:51 | INFO | starting global initialization
2023-04-25 16:28:51 | INFO | -----------------------------------------------------------------------
2023-04-25 16:28:51 | INFO | Algebraic mode change at t = 0
2023-04-25 16:28:51 | INFO | end of global initialization
2023-04-25 16:28:51 | INFO | -----------------------------------------------------------------------
2023-04-25 16:28:51 | INFO | 
2023-04-25 16:28:51 | INFO | -----------------------------------------------------------------------
2023-04-25 16:28:51 | INFO | starting curve initialization
2023-04-25 16:28:51 | INFO | -----------------------------------------------------------------------
2023-04-25 16:28:51 | INFO | end of curve initialization, added 52 curves
2023-04-25 16:28:51 | INFO | -----------------------------------------------------------------------
2023-04-25 16:28:51 | INFO | 
2023-04-25 16:28:51 | INFO | -----------------------------------------------------------------------
2023-04-25 16:28:51 | INFO | starting simulation with solver IDASolver
2023-04-25 16:28:51 | INFO | -----------------------------------------------------------------------
2023-04-25 16:28:51 | INFO | -----------------------------------------------------------------------
2023-04-25 16:28:51 | INFO | number of continuous variables : 455
2023-04-25 16:28:51 | INFO | number of discrete variables : 293
2023-04-25 16:28:51 | INFO | number of root functions : 287
2023-04-25 16:28:51 | INFO | -----------------------------------------------------------------------
2023-04-25 16:28:51 | INFO |         time | iter num   order (k)      time step (h)
2023-04-25 16:28:51 | INFO | -----------------------------------------------------------------------
2023-04-25 16:28:51 | INFO |        0.000 |        0           0              0.010 
2023-04-25 16:28:51 | INFO |        0.000 |        1           1              0.000 
2023-04-25 16:28:51 | INFO |        0.000 |        2           1              0.000 
2023-04-25 16:28:51 | INFO |        0.000 |        3           2              0.000 
2023-04-25 16:28:51 | INFO |        0.000 |        4           2              0.000 
2023-04-25 16:28:51 | INFO |        0.000 |        5           2              0.000 
2023-04-25 16:28:51 | INFO |        0.000 |        6           2              0.000 
2023-04-25 16:28:51 | INFO |        0.000 |        7           2              0.000 
2023-04-25 16:28:51 | INFO |        0.000 |        8           2              0.000 
2023-04-25 16:28:51 | INFO |        0.000 |        9           2              0.000 
2023-04-25 16:28:51 | INFO |        0.001 |       10           2              0.000 
2023-04-25 16:28:51 | INFO |        0.001 |       11           2              0.001 
2023-04-25 16:28:51 | INFO |        0.002 |       12           2              0.001 
2023-04-25 16:28:51 | INFO |        0.004 |       13           2              0.002 
2023-04-25 16:28:51 | INFO |        0.008 |       14           2              0.004 
2023-04-25 16:28:51 | INFO |        0.016 |       15           2              0.008 
2023-04-25 16:28:51 | INFO |        0.033 |       16           2              0.016 
2023-04-25 16:28:51 | INFO |        0.041 |       17           2              0.033 
2023-04-25 16:28:51 | INFO |        0.041 |       17           2              0.033 
2023-04-25 16:28:51 | INFO | Algebraic mode change at t = 0.0445431
2023-04-25 16:28:51 | INFO |        0.045 |       17           2              0.033 
2023-04-25 16:28:51 | INFO | calculation of the new starting point of the simulation.
2023-04-25 16:28:51 | INFO |        0.045 |        0           0              0.000 
2023-04-25 16:28:51 | INFO |        0.045 |        1           1              0.000 
2023-04-25 16:28:51 | INFO |        0.045 |        2           1              0.000 
2023-04-25 16:28:51 | INFO |        0.045 |        3           2              0.000 
2023-04-25 16:28:51 | INFO |        0.045 |        4           2              0.000 
2023-04-25 16:28:51 | INFO |        0.045 |        5           2              0.000 
2023-04-25 16:28:51 | INFO |        0.045 |        6           2              0.000 
2023-04-25 16:28:51 | INFO |        0.045 |        7           2              0.000 
2023-04-25 16:28:51 | INFO |        0.045 |        8           2              0.000 
2023-04-25 16:28:51 | INFO |        0.045 |        9           2              0.000 
2023-04-25 16:28:51 | INFO |        0.045 |       10           2              0.000 
2023-04-25 16:28:51 | INFO |        0.046 |       11           2              0.001 
2023-04-25 16:28:51 | INFO |        0.047 |       12           2              0.001 
2023-04-25 16:28:51 | INFO |        0.049 |       13           2              0.002 
2023-04-25 16:28:51 | INFO |        0.053 |       14           2              0.004 
2023-04-25 16:28:51 | INFO |        0.061 |       15           2              0.008 
2023-04-25 16:28:51 | INFO | Algebraic mode change at t = 0.0704008
2023-04-25 16:28:51 | INFO |        0.070 |       16           2              0.016 
2023-04-25 16:28:51 | INFO | calculation of the new starting point of the simulation.
2023-04-25 16:28:51 | INFO |        0.070 |        0           0              0.000 
2023-04-25 16:28:51 | INFO |        0.070 |        1           1              0.000 
2023-04-25 16:28:51 | INFO |        0.070 |        2           1              0.000 
2023-04-25 16:28:51 | INFO |        0.070 |        3           2              0.000 
2023-04-25 16:28:51 | INFO |        0.070 |        4           2              0.000 
2023-04-25 16:28:51 | INFO |        0.070 |        5           2              0.000 
2023-04-25 16:28:51 | INFO |        0.070 |        6           2              0.000 
2023-04-25 16:28:51 | INFO |        0.070 |        7           2              0.000 
2023-04-25 16:28:51 | INFO |        0.071 |        8           2              0.000 
2023-04-25 16:28:51 | INFO |        0.071 |        9           2              0.000 
2023-04-25 16:28:51 | INFO |        0.071 |       10           2              0.000 
2023-04-25 16:28:51 | INFO |        0.071 |       11           2              0.001 
2023-04-25 16:28:51 | INFO |        0.072 |       12           2              0.001 
2023-04-25 16:28:51 | INFO |        0.074 |       13           2              0.002 
2023-04-25 16:28:51 | INFO |        0.079 |       14           2              0.004 
2023-04-25 16:28:51 | INFO |        0.087 |       15           2              0.008 
2023-04-25 16:28:51 | INFO |        0.103 |       16           2              0.016 
2023-04-25 16:28:51 | INFO |        0.136 |       17           2              0.033 
2023-04-25 16:28:51 | INFO |        0.201 |       18           2              0.066 
2023-04-25 16:28:51 | INFO |        0.333 |       19           2              0.131 
2023-04-25 16:28:51 | INFO |        0.595 |       20           2              0.262 
2023-04-25 16:28:51 | INFO |        1.119 |       21           2              0.524 
2023-04-25 16:28:51 | INFO |        2.168 |       22           1              1.049 
2023-04-25 16:28:51 | INFO |        4.265 |       23           1              2.097 
2023-04-25 16:28:51 | INFO |        8.459 |       24           1              4.194 
2023-04-25 16:28:51 | INFO |       16.848 |       25           1              8.389 
2023-04-25 16:28:51 | INFO | Algebraic mode change at t = 20
2023-04-25 16:28:51 | INFO |       20.000 |       26           1             10.000 
2023-04-25 16:28:51 | INFO | calculation of the new starting point of the simulation.
2023-04-25 16:28:51 | INFO |       20.000 |        0           0              0.000 
2023-04-25 16:28:51 | INFO |       20.000 |        1           1              0.000 
2023-04-25 16:28:51 | INFO |       20.000 |        2           1              0.000 
2023-04-25 16:28:51 | INFO |       20.000 |        3           2              0.000 
2023-04-25 16:28:51 | INFO |       20.000 |        4           2              0.000 
2023-04-25 16:28:51 | INFO |       20.000 |        5           2              0.000 
2023-04-25 16:28:51 | INFO |       20.000 |        6           2              0.000 
2023-04-25 16:28:51 | INFO |       20.000 |        7           2              0.000 
2023-04-25 16:28:51 | INFO |       20.000 |        8           2              0.000 
2023-04-25 16:28:51 | INFO |       20.000 |        9           2              0.000 
2023-04-25 16:28:51 | INFO |       20.001 |       10           2              0.000 
2023-04-25 16:28:51 | INFO |       20.001 |       11           2              0.001 
2023-04-25 16:28:51 | INFO |       20.002 |       12           2              0.001 
2023-04-25 16:28:51 | INFO |       20.004 |       13           2              0.002 
2023-04-25 16:28:51 | INFO |       20.008 |       14           2              0.004 
2023-04-25 16:28:51 | INFO |       20.016 |       15           2              0.008 
2023-04-25 16:28:51 | INFO |       20.033 |       16           2              0.016 
2023-04-25 16:28:51 | INFO |       20.049 |       17           2              0.016 
2023-04-25 16:28:51 | INFO |       20.082 |       18           2              0.033 
2023-04-25 16:28:51 | INFO |       20.115 |       19           2              0.033 
2023-04-25 16:28:51 | INFO |       20.147 |       20           2              0.033 
2023-04-25 16:28:51 | INFO |       20.180 |       21           2              0.033 
2023-04-25 16:28:51 | INFO |       20.201 |       22           2              0.066 
2023-04-25 16:28:51 | INFO |       20.201 |       22           2              0.066 
2023-04-25 16:28:51 | INFO | Algebraic mode change at t = 20.2015
2023-04-25 16:28:51 | INFO |       20.202 |       22           2              0.066 
2023-04-25 16:28:51 | INFO | calculation of the new starting point of the simulation.
2023-04-25 16:28:51 | INFO |       20.202 |        0           0              0.000 
2023-04-25 16:28:51 | INFO |       20.202 |        1           1              0.000 
2023-04-25 16:28:51 | INFO |       20.202 |        2           1              0.000 
2023-04-25 16:28:51 | INFO |       20.202 |        3           2              0.000 
2023-04-25 16:28:51 | INFO |       20.202 |        4           2              0.000 
2023-04-25 16:28:51 | INFO |       20.202 |        5           2              0.000 
2023-04-25 16:28:51 | INFO |       20.202 |        6           2              0.000 
2023-04-25 16:28:51 | INFO |       20.202 |        7           2              0.000 
2023-04-25 16:28:51 | INFO |       20.202 |        8           2              0.000 
2023-04-25 16:28:51 | INFO |       20.202 |        9           2              0.000 
2023-04-25 16:28:51 | INFO |       20.202 |       10           2              0.000 
2023-04-25 16:28:51 | INFO |       20.203 |       11           2              0.001 
2023-04-25 16:28:51 | INFO |       20.204 |       12           2              0.001 
2023-04-25 16:28:51 | INFO |       20.206 |       13           2              0.002 
2023-04-25 16:28:51 | INFO |       20.210 |       14           2              0.004 
2023-04-25 16:28:51 | INFO |       20.218 |       15           2              0.008 
2023-04-25 16:28:51 | INFO |       20.234 |       16           2              0.016 
2023-04-25 16:28:51 | INFO |       20.267 |       17           2              0.033 
2023-04-25 16:28:51 | INFO |       20.333 |       18           2              0.066 
2023-04-25 16:28:51 | INFO |       20.398 |       19           2              0.066 
2023-04-25 16:28:51 | INFO |       20.529 |       20           2              0.131 
2023-04-25 16:28:51 | INFO |       20.660 |       21           2              0.131 
2023-04-25 16:28:51 | INFO |       20.791 |       22           2              0.131 
2023-04-25 16:28:51 | INFO |       20.922 |       23           2              0.131 
2023-04-25 16:28:51 | INFO |       21.053 |       24           2              0.131 
2023-04-25 16:28:51 | INFO |       21.185 |       25           2              0.131 
2023-04-25 16:28:51 | INFO |       21.316 |       26           2              0.131 
2023-04-25 16:28:51 | INFO |       21.447 |       27           2              0.131 
2023-04-25 16:28:51 | INFO |       21.578 |       28           2              0.131 
2023-04-25 16:28:51 | INFO |       21.709 |       29           2              0.131 
2023-04-25 16:28:51 | INFO |       21.840 |       30           2              0.131 
2023-04-25 16:28:51 | INFO |       21.971 |       31           2              0.131 
2023-04-25 16:28:51 | INFO |       21.976 |       32           2              0.131 
2023-04-25 16:28:51 | INFO |       21.976 |       32           2              0.131 
2023-04-25 16:28:51 | INFO |       22.102 |       32           2              0.131 
2023-04-25 16:28:51 | INFO |       22.233 |       33           2              0.131 
2023-04-25 16:28:51 | INFO |       22.364 |       34           2              0.131 
2023-04-25 16:28:51 | INFO |       22.600 |       35           1              0.236 
2023-04-25 16:28:51 | INFO |       22.836 |       36           1              0.236 
2023-04-25 16:28:51 | INFO |       23.072 |       37           1              0.236 
2023-04-25 16:28:51 | INFO |       23.308 |       38           1              0.236 
2023-04-25 16:28:51 | INFO |       23.780 |       39           1              0.472 
2023-04-25 16:28:51 | INFO |       24.252 |       40           1              0.472 
2023-04-25 16:28:51 | INFO |       25.195 |       41           1              0.944 
2023-04-25 16:28:51 | INFO |       26.139 |       42           1              0.944 
2023-04-25 16:28:51 | INFO |       27.083 |       43           1              0.944 
2023-04-25 16:28:51 | INFO |       28.970 |       44           2              1.887 
2023-04-25 16:28:51 | INFO |       30.858 |       45           2              1.887 
2023-04-25 16:28:51 | INFO |       34.633 |       46           2              3.775 
2023-04-25 16:28:51 | INFO |       38.407 |       47           2              3.775 
2023-04-25 16:28:51 | INFO |       42.182 |       48           2              3.775 
2023-04-25 16:28:51 | INFO |       45.957 |       49           2              3.775 
2023-04-25 16:28:51 | INFO |       53.507 |       50           2              7.550 
2023-04-25 16:28:51 | INFO |       63.507 |       51           1             10.000 
2023-04-25 16:28:51 | INFO |       73.507 |       52           1             10.000 
2023-04-25 16:28:51 | INFO | Algebraic mode change at t = 80
2023-04-25 16:28:51 | INFO |       80.000 |       53           1             10.000 
2023-04-25 16:28:51 | INFO | calculation of the new starting point of the simulation.
2023-04-25 16:28:51 | INFO |       80.000 |        0           0              0.000 
2023-04-25 16:28:51 | INFO |       80.000 |        1           1              0.000 
2023-04-25 16:28:51 | INFO |       80.000 |        2           1              0.000 
2023-04-25 16:28:51 | INFO |       80.000 |        3           2              0.000 
2023-04-25 16:28:51 | INFO |       80.000 |        4           2              0.000 
2023-04-25 16:28:51 | INFO |       80.000 |        5           2              0.000 
2023-04-25 16:28:51 | INFO |       80.000 |        6           2              0.000 
2023-04-25 16:28:51 | INFO |       80.000 |        7           2              0.000 
2023-04-25 16:28:51 | INFO |       80.000 |        8           2              0.000 
2023-04-25 16:28:51 | INFO |       80.000 |        9           2              0.000 
2023-04-25 16:28:51 | INFO |       80.000 |       10           2              0.000 
2023-04-25 16:28:51 | INFO |       80.001 |       11           2              0.001 
2023-04-25 16:28:51 | INFO |       80.002 |       12           2              0.001 
2023-04-25 16:28:51 | INFO |       80.004 |       13           2              0.002 
2023-04-25 16:28:51 | INFO |       80.005 |       14           2              0.004 
2023-04-25 16:28:51 | INFO |       80.008 |       14           2              0.004 
2023-04-25 16:28:51 | INFO |       80.016 |       15           2              0.008 
2023-04-25 16:28:51 | INFO |       80.033 |       16           2              0.016 
2023-04-25 16:28:51 | INFO |       80.066 |       17           2              0.033 
2023-04-25 16:28:51 | INFO |       80.131 |       18           2              0.066 
2023-04-25 16:28:51 | INFO |       80.262 |       19           2              0.131 
2023-04-25 16:28:51 | INFO |       80.374 |       20           1              0.262 
2023-04-25 16:28:51 | INFO |       80.374 |       20           1              0.262 
2023-04-25 16:28:51 | INFO |       80.524 |       20           1              0.262 
2023-04-25 16:28:51 | INFO |       81.049 |       21           1              0.524 
2023-04-25 16:28:51 | INFO |       81.573 |       22           1              0.524 
2023-04-25 16:28:51 | INFO |       82.621 |       23           1              1.049 
2023-04-25 16:28:51 | INFO |       84.719 |       24           1              2.097 
2023-04-25 16:28:51 | INFO |       88.913 |       25           1              4.194 
2023-04-25 16:28:51 | INFO | Algebraic mode change at t = 90
2023-04-25 16:28:51 | INFO |       90.000 |       26           1              8.389 
2023-04-25 16:28:51 | INFO | calculation of the new starting point of the simulation.
2023-04-25 16:28:51 | INFO |       90.000 |        0           0              0.000 
2023-04-25 16:28:51 | INFO |       90.000 |        1           1              0.000 
2023-04-25 16:28:51 | INFO |       90.000 |        2           1              0.000 
2023-04-25 16:28:51 | INFO |       90.000 |        3           2              0.000 
2023-04-25 16:28:51 | INFO |       90.000 |        4           2              0.000 
2023-04-25 16:28:51 | INFO |       90.000 |        5           2              0.000 
2023-04-25 16:28:51 | INFO |       90.000 |        6           2              0.000 
2023-04-25 16:28:51 | INFO |       90.000 |        7           2              0.000 
2023-04-25 16:28:51 | INFO |       90.000 |        8           2              0.000 
2023-04-25 16:28:51 | INFO |       90.000 |        9           2              0.000 
2023-04-25 16:28:51 | INFO |       90.000 |       10           2              0.000 
2023-04-25 16:28:51 | INFO |       90.001 |       11           2              0.001 
2023-04-25 16:28:51 | INFO |       90.002 |       12           2              0.001 
2023-04-25 16:28:51 | INFO |       90.004 |       13           2              0.002 
2023-04-25 16:28:51 | INFO |       90.008 |       14           2              0.004 
2023-04-25 16:28:51 | INFO |       90.016 |       15           2              0.008 
2023-04-25 16:28:51 | INFO |       90.033 |       16           2              0.016 
2023-04-25 16:28:51 | INFO |       90.066 |       17           2              0.033 
2023-04-25 16:28:51 | INFO |       90.131 |       18           2              0.066 
2023-04-25 16:28:51 | INFO |       90.262 |       19           2              0.131 
2023-04-25 16:28:51 | INFO |       90.524 |       20           1              0.262 
2023-04-25 16:28:51 | INFO |       91.049 |       21           1              0.524 
2023-04-25 16:28:51 | INFO |       91.573 |       22           1              0.524 
2023-04-25 16:28:51 | INFO |       92.621 |       23           1              1.049 
2023-04-25 16:28:51 | INFO |       94.719 |       24           1              2.097 
2023-04-25 16:28:51 | INFO |       98.913 |       25           1              4.194 
2023-04-25 16:28:51 | INFO | Algebraic mode change at t = 100
2023-04-25 16:28:51 | INFO |      100.000 |       26           1              8.389 
2023-04-25 16:28:51 | INFO | calculation of the new starting point of the simulation.
2023-04-25 16:28:51 | INFO |      100.000 |        0           0              0.000 
2023-04-25 16:28:51 | INFO |      100.000 |        1           1              0.000 
2023-04-25 16:28:51 | INFO |      100.000 |        2           1              0.000 
2023-04-25 16:28:51 | INFO |      100.000 |        3           2              0.000 
2023-04-25 16:28:51 | INFO |      100.000 |        4           2              0.000 
2023-04-25 16:28:51 | INFO |      100.000 |        5           2              0.000 
2023-04-25 16:28:51 | INFO |      100.000 |        6           2              0.000 
2023-04-25 16:28:51 | INFO |      100.000 |        7           2              0.000 
2023-04-25 16:28:51 | INFO |      100.000 |        8           2              0.000 
2023-04-25 16:28:51 | INFO |      100.000 |        9           2              0.000 
2023-04-25 16:28:51 | INFO |      100.000 |       10           2              0.000 
2023-04-25 16:28:51 | INFO |      100.001 |       11           2              0.001 
2023-04-25 16:28:51 | INFO |      100.002 |       12           2              0.001 
2023-04-25 16:28:51 | INFO |      100.004 |       13           2              0.002 
2023-04-25 16:28:51 | INFO |      100.008 |       14           2              0.004 
2023-04-25 16:28:51 | INFO |      100.016 |       15           2              0.008 
2023-04-25 16:28:51 | INFO |      100.033 |       16           2              0.016 
2023-04-25 16:28:51 | INFO |      100.066 |       17           2              0.033 
2023-04-25 16:28:51 | INFO |      100.131 |       18           2              0.066 
2023-04-25 16:28:51 | INFO |      100.262 |       19           2              0.131 
2023-04-25 16:28:51 | INFO |      100.524 |       20           1              0.262 
2023-04-25 16:28:51 | INFO |      101.049 |       21           1              0.524 
2023-04-25 16:28:51 | INFO |      101.573 |       22           1              0.524 
2023-04-25 16:28:51 | INFO |      102.621 |       23           1              1.049 
2023-04-25 16:28:51 | INFO |      104.719 |       24           1              2.097 
2023-04-25 16:28:51 | INFO |      108.913 |       25           1              4.194 
2023-04-25 16:28:51 | INFO | Algebraic mode change at t = 110
2023-04-25 16:28:51 | INFO |      110.000 |       26           1              8.389 
2023-04-25 16:28:51 | INFO | calculation of the new starting point of the simulation.
2023-04-25 16:28:51 | INFO |      110.000 |        0           0              0.000 
2023-04-25 16:28:51 | INFO |      110.000 |        1           1              0.000 
2023-04-25 16:28:51 | INFO |      110.000 |        2           1              0.000 
2023-04-25 16:28:51 | INFO |      110.000 |        3           2              0.000 
2023-04-25 16:28:51 | INFO |      110.000 |        4           2              0.000 
2023-04-25 16:28:51 | INFO |      110.000 |        5           2              0.000 
2023-04-25 16:28:51 | INFO |      110.000 |        6           2              0.000 
2023-04-25 16:28:51 | INFO |      110.000 |        7           2              0.000 
2023-04-25 16:28:51 | INFO |      110.000 |        8           2              0.000 
2023-04-25 16:28:51 | INFO |      110.000 |        9           2              0.000 
2023-04-25 16:28:51 | INFO |      110.000 |       10           2              0.000 
2023-04-25 16:28:51 | INFO |      110.001 |       11           2              0.001 
2023-04-25 16:28:51 | INFO |      110.002 |       12           2              0.001 
2023-04-25 16:28:51 | INFO |      110.004 |       13           2              0.002 
2023-04-25 16:28:51 | INFO |      110.008 |       14           2              0.004 
2023-04-25 16:28:51 | INFO |      110.016 |       15           2              0.008 
2023-04-25 16:28:51 | INFO |      110.033 |       16           2              0.016 
2023-04-25 16:28:51 | INFO |      110.066 |       17           2              0.033 
2023-04-25 16:28:51 | INFO |      110.131 |       18           2              0.066 
2023-04-25 16:28:51 | INFO |      110.262 |       19           2              0.131 
2023-04-25 16:28:51 | INFO |      110.524 |       20           1              0.262 
2023-04-25 16:28:51 | INFO |      111.049 |       21           1              0.524 
2023-04-25 16:28:51 | INFO |      111.573 |       22           1              0.524 
2023-04-25 16:28:51 | INFO |      112.621 |       23           1              1.049 
2023-04-25 16:28:51 | INFO |      114.719 |       24           1              2.097 
2023-04-25 16:28:51 | INFO |      118.913 |       25           1              4.194 
2023-04-25 16:28:51 | INFO | Algebraic mode change at t = 120
2023-04-25 16:28:51 | INFO |      120.000 |       26           1              8.389 
2023-04-25 16:28:51 | INFO | calculation of the new starting point of the simulation.
2023-04-25 16:28:51 | INFO |      120.000 |        0           0              0.000 
2023-04-25 16:28:51 | INFO |      120.000 |        1           1              0.000 
2023-04-25 16:28:51 | INFO |      120.000 |        2           1              0.000 
2023-04-25 16:28:51 | INFO |      120.000 |        3           2              0.000 
2023-04-25 16:28:51 | INFO |      120.000 |        4           2              0.000 
2023-04-25 16:28:51 | INFO |      120.000 |        5           2              0.000 
2023-04-25 16:28:51 | INFO |      120.000 |        6           2              0.000 
2023-04-25 16:28:51 | INFO |      120.000 |        7           2              0.000 
2023-04-25 16:28:51 | INFO |      120.000 |        8           2              0.000 
2023-04-25 16:28:51 | INFO |      120.000 |        9           2              0.000 
2023-04-25 16:28:51 | INFO |      120.000 |       10           2              0.000 
2023-04-25 16:28:51 | INFO |      120.001 |       11           2              0.001 
2023-04-25 16:28:51 | INFO |      120.002 |       12           2              0.001 
2023-04-25 16:28:51 | INFO |      120.004 |       13           2              0.002 
2023-04-25 16:28:51 | INFO |      120.008 |       14           2              0.004 
2023-04-25 16:28:51 | INFO |      120.016 |       15           2              0.008 
2023-04-25 16:28:51 | INFO |      120.033 |       16           2              0.016 
2023-04-25 16:28:51 | INFO |      120.066 |       17           2              0.033 
2023-04-25 16:28:51 | INFO |      120.131 |       18           2              0.066 
2023-04-25 16:28:51 | INFO |      120.262 |       19           2              0.131 
2023-04-25 16:28:51 | INFO |      120.524 |       20           1              0.262 
2023-04-25 16:28:51 | INFO |      121.049 |       21           1              0.524 
2023-04-25 16:28:51 | INFO |      121.573 |       22           1              0.524 
2023-04-25 16:28:51 | INFO |      122.621 |       23           1              1.049 
2023-04-25 16:28:51 | INFO |      124.719 |       24           1              2.097 
2023-04-25 16:28:51 | INFO |      128.913 |       25           1              4.194 
2023-04-25 16:28:51 | INFO |      137.301 |       26           1              8.389 
2023-04-25 16:28:51 | INFO |      145.690 |       27           1              8.389 
2023-04-25 16:28:51 | INFO |      155.690 |       28           1             10.000 
2023-04-25 16:28:51 | INFO |      165.690 |       29           1             10.000 
2023-04-25 16:28:51 | INFO |      170.000 |       30           1              4.310 
2023-04-25 16:28:51 | INFO | 
2023-04-25 16:28:51 | INFO | execution statistics :
2023-04-25 16:28:51 | INFO | 
2023-04-25 16:28:51 | INFO | number of time iterations                  = 268
2023-04-25 16:28:51 | INFO | number of residual evaluations             = 406
2023-04-25 16:28:51 | INFO | number of Jacobian evaluations             = 214
2023-04-25 16:28:51 | INFO | number of nonlinear iterations             = 386
2023-04-25 16:28:51 | INFO | number of error test failures              = 1
2023-04-25 16:28:51 | INFO | number of nonlinear convergence failures   = 0
2023-04-25 16:28:51 | INFO | number of root functions evaluations       = 953
2023-04-25 16:28:51 | INFO | number of discrete variables evaluations   = 49
2023-04-25 16:28:51 | INFO | number of mode evaluations                 = 29
2023-04-25 16:28:51 | INFO | end of job 'IEEE14 - TapChangerLock'
