2022-09-26 17:20:57 | INFO |  ============================================================ 
2022-09-26 17:20:57 | INFO | DYNAWO VERSION  :     1.4.0
2022-09-26 17:20:57 | INFO | DYNAWO REVISION :  2493_extvar_ref_optional-2b21b2150
2022-09-26 17:20:57 | INFO |  ============================================================ 
2022-09-26 17:20:57 | INFO | 
2022-09-26 17:20:57 | INFO | -----------------------------------------------------------------------
2022-09-26 17:20:57 | INFO | building model from input files
2022-09-26 17:20:57 | INFO | -----------------------------------------------------------------------
2022-09-26 17:20:57 | INFO | model was built successfully
2022-09-26 17:20:57 | INFO | -----------------------------------------------------------------------
2022-09-26 17:20:57 | INFO | 
2022-09-26 17:20:57 | INFO | -----------------------------------------------------------------------
2022-09-26 17:20:57 | INFO | starting local initialization
2022-09-26 17:20:57 | INFO | -----------------------------------------------------------------------
2022-09-26 17:20:57 | INFO | end of local initialization
2022-09-26 17:20:57 | INFO | -----------------------------------------------------------------------
2022-09-26 17:20:57 | INFO | 
2022-09-26 17:20:57 | INFO | -----------------------------------------------------------------------
2022-09-26 17:20:57 | INFO | starting global initialization
2022-09-26 17:20:57 | INFO | -----------------------------------------------------------------------
2022-09-26 17:20:57 | INFO | end of global initialization
2022-09-26 17:20:57 | INFO | -----------------------------------------------------------------------
2022-09-26 17:20:57 | INFO | 
2022-09-26 17:20:57 | INFO | -----------------------------------------------------------------------
2022-09-26 17:20:57 | INFO | starting curve initialization
2022-09-26 17:20:57 | INFO | -----------------------------------------------------------------------
2022-09-26 17:20:57 | INFO | end of curve initialization, added 37 curves
2022-09-26 17:20:57 | INFO | -----------------------------------------------------------------------
2022-09-26 17:20:57 | INFO | 
2022-09-26 17:20:57 | INFO | -----------------------------------------------------------------------
2022-09-26 17:20:57 | INFO | starting simulation with solver SimplifiedSolver
2022-09-26 17:20:57 | INFO | -----------------------------------------------------------------------
2022-09-26 17:20:57 | INFO | -----------------------------------------------------------------------
2022-09-26 17:20:57 | INFO | number of continuous variables : 488
2022-09-26 17:20:57 | INFO | number of discrete variables : 594
2022-09-26 17:20:57 | INFO | number of root functions : 387
2022-09-26 17:20:57 | INFO | -----------------------------------------------------------------------
2022-09-26 17:20:57 | INFO |         time | iter num   Nonlinear iter   jac eval      time step (h)
2022-09-26 17:20:57 | INFO | -----------------------------------------------------------------------
2022-09-26 17:20:57 | INFO |        0.000 |        0                0          0              1.000 
2022-09-26 17:20:57 | INFO | state of Line _BEAV___6-CLIN___8-1_AC change from 2 to 4
2022-09-26 17:20:57 | INFO | Algebraic mode (with J recalculation) change at t = 1
2022-09-26 17:20:57 | INFO |        1.000 |        1                1          1              1.000 
2022-09-26 17:20:57 | INFO | calculation of the new starting point of the simulation.
2022-09-26 17:20:57 | INFO |        1.000 |        1                2          2              1.000 
2022-09-26 17:20:57 | INFO | Algebraic mode change at t = 2
2022-09-26 17:20:57 | INFO |        2.000 |        2                5          3              1.000 
2022-09-26 17:20:57 | INFO | calculation of the new starting point of the simulation.
2022-09-26 17:20:57 | INFO |        2.000 |        2                6          3              1.000 
2022-09-26 17:20:57 | INFO | Algebraic mode change at t = 3
2022-09-26 17:20:57 | INFO |        3.000 |        3                8          3              1.000 
2022-09-26 17:20:57 | INFO | calculation of the new starting point of the simulation.
2022-09-26 17:20:57 | INFO |        3.000 |        3                9          3              1.000 
2022-09-26 17:20:57 | INFO |        4.000 |        4               11          3              1.000 
2022-09-26 17:20:57 | INFO |        5.000 |        5               12          3              1.000 
2022-09-26 17:20:57 | INFO |        6.000 |        6               13          3              1.000 
2022-09-26 17:20:57 | INFO |        7.000 |        7               14          3              1.000 
2022-09-26 17:20:57 | INFO |        8.000 |        8               15          3              1.000 
2022-09-26 17:20:57 | INFO |        9.000 |        9               16          3              1.000 
2022-09-26 17:20:57 | INFO |       10.000 |       10               17          3              1.000 
2022-09-26 17:20:57 | INFO |       11.000 |       11               18          3              1.000 
2022-09-26 17:20:57 | INFO |       12.000 |       12               19          3              1.000 
2022-09-26 17:20:57 | INFO | initial guess of the algebraic solver is accurate, following SimplifiedSolver iterations will be skipped until the next mode change
2022-09-26 17:20:57 | INFO |       13.000 |       13               19          3              1.000 
2022-09-26 17:20:57 | INFO |       14.000 |       14               19          3              1.000 
2022-09-26 17:20:57 | INFO |       15.000 |       15               19          3              1.000 
2022-09-26 17:20:57 | INFO |       16.000 |       16               19          3              1.000 
2022-09-26 17:20:57 | INFO |       17.000 |       17               19          3              1.000 
2022-09-26 17:20:57 | INFO |       18.000 |       18               19          3              1.000 
2022-09-26 17:20:57 | INFO |       19.000 |       19               19          3              1.000 
2022-09-26 17:20:57 | INFO |       20.000 |       20               19          3              1.000 
2022-09-26 17:20:57 | INFO |       21.000 |       21               19          3              1.000 
2022-09-26 17:20:57 | INFO |       22.000 |       22               19          3              1.000 
2022-09-26 17:20:57 | INFO |       23.000 |       23               19          3              1.000 
2022-09-26 17:20:57 | INFO |       24.000 |       24               19          3              1.000 
2022-09-26 17:20:57 | INFO |       25.000 |       25               19          3              1.000 
2022-09-26 17:20:57 | INFO |       26.000 |       26               19          3              1.000 
2022-09-26 17:20:57 | INFO |       27.000 |       27               19          3              1.000 
2022-09-26 17:20:57 | INFO |       28.000 |       28               19          3              1.000 
2022-09-26 17:20:57 | INFO |       29.000 |       29               19          3              1.000 
2022-09-26 17:20:57 | INFO |       30.000 |       30               19          3              1.000 
2022-09-26 17:20:57 | INFO | 
2022-09-26 17:20:57 | INFO | execution statistics :
2022-09-26 17:20:57 | INFO | 
2022-09-26 17:20:57 | INFO | number of time iterations                  = 30
2022-09-26 17:20:57 | INFO | number of residual evaluations             = 35
2022-09-26 17:20:57 | INFO | number of Jacobian evaluations             = 3
2022-09-26 17:20:57 | INFO | number of nonlinear iterations             = 19
2022-09-26 17:20:57 | INFO | number of error test failures              = 0
2022-09-26 17:20:57 | INFO | number of nonlinear convergence failures   = 0
2022-09-26 17:20:57 | INFO | number of root functions evaluations       = 37
2022-09-26 17:20:57 | INFO | number of discrete variables evaluations   = 12
2022-09-26 17:20:57 | INFO | number of mode evaluations                 = 8
2022-09-26 17:20:57 | INFO | end of job 'IEEE57 - Disconnect line 6-8 - Simplified solver'
