2023-04-26 11:37:01 | INFO |  ============================================================ 
2023-04-26 11:37:01 | INFO | DYNAWO VERSION  :     1.6.0
2023-04-26 11:37:01 | INFO | DYNAWO REVISION :    master-e473c85d51
2023-04-26 11:37:01 | INFO |  ============================================================ 
2023-04-26 11:37:01 | INFO | 
2023-04-26 11:37:01 | INFO | -----------------------------------------------------------------------
2023-04-26 11:37:01 | INFO | building model from input files
2023-04-26 11:37:01 | INFO | -----------------------------------------------------------------------
2023-04-26 11:37:01 | INFO | model was built successfully
2023-04-26 11:37:01 | INFO | -----------------------------------------------------------------------
2023-04-26 11:37:01 | INFO | 
2023-04-26 11:37:01 | INFO | -----------------------------------------------------------------------
2023-04-26 11:37:01 | INFO | starting local initialization
2023-04-26 11:37:01 | INFO | -----------------------------------------------------------------------
2023-04-26 11:37:01 | INFO | end of local initialization
2023-04-26 11:37:01 | INFO | -----------------------------------------------------------------------
2023-04-26 11:37:01 | INFO | 
2023-04-26 11:37:01 | INFO | -----------------------------------------------------------------------
2023-04-26 11:37:01 | INFO | starting global initialization
2023-04-26 11:37:01 | INFO | -----------------------------------------------------------------------
2023-04-26 11:37:01 | INFO | Algebraic mode change at t = 0
2023-04-26 11:37:01 | INFO | end of global initialization
2023-04-26 11:37:01 | INFO | -----------------------------------------------------------------------
2023-04-26 11:37:01 | INFO | 
2023-04-26 11:37:01 | INFO | -----------------------------------------------------------------------
2023-04-26 11:37:01 | INFO | starting curve initialization
2023-04-26 11:37:01 | INFO | -----------------------------------------------------------------------
2023-04-26 11:37:01 | INFO | end of curve initialization, added 74 curves
2023-04-26 11:37:01 | INFO | -----------------------------------------------------------------------
2023-04-26 11:37:01 | INFO | 
2023-04-26 11:37:01 | INFO | -----------------------------------------------------------------------
2023-04-26 11:37:01 | INFO | starting simulation with solver SimplifiedSolver
2023-04-26 11:37:01 | INFO | -----------------------------------------------------------------------
2023-04-26 11:37:01 | INFO | -----------------------------------------------------------------------
2023-04-26 11:37:01 | INFO | number of continuous variables : 1740
2023-04-26 11:37:01 | INFO | number of discrete variables : 950
2023-04-26 11:37:01 | INFO | number of root functions : 610
2023-04-26 11:37:01 | INFO | -----------------------------------------------------------------------
2023-04-26 11:37:01 | INFO |         time | iter num   Nonlinear iter   jac eval      time step (h)
2023-04-26 11:37:01 | INFO | -----------------------------------------------------------------------
2023-04-26 11:37:01 | INFO |        0.000 |        0                0          0              2.000 
2023-04-26 11:37:01 | INFO | state of Line L4032-4044 change from 2 to 1
2023-04-26 11:37:01 | INFO | Algebraic mode (with J recalculation) change at t = 2
2023-04-26 11:37:01 | INFO |        2.000 |        1                1          1              2.000 
2023-04-26 11:37:01 | INFO | calculation of the new starting point of the simulation.
2023-04-26 11:37:01 | INFO |        2.000 |        1                3          3              2.000 
2023-04-26 11:37:01 | INFO | Algebraic mode change at t = 4
2023-04-26 11:37:01 | INFO |        4.000 |        2                6          4              2.000 
2023-04-26 11:37:01 | INFO | calculation of the new starting point of the simulation.
2023-04-26 11:37:01 | INFO |        4.000 |        2                6          4              2.000 
2023-04-26 11:37:01 | INFO | Differential mode change at t = 6
2023-04-26 11:37:01 | INFO |        6.000 |        3                9          4              2.000 
2023-04-26 11:37:01 | INFO | calculation of the new starting point of the simulation.
2023-04-26 11:37:01 | INFO |        6.000 |        3                9          4              2.000 
2023-04-26 11:37:01 | INFO |        8.000 |        4               13          4              2.000 
2023-04-26 11:37:01 | INFO | Algebraic mode change at t = 10
2023-04-26 11:37:01 | INFO |       10.000 |        5               17          5              2.000 
2023-04-26 11:37:01 | INFO | calculation of the new starting point of the simulation.
2023-04-26 11:37:01 | INFO |       10.000 |        5               17          5              2.000 
2023-04-26 11:37:01 | INFO |       12.000 |        6               18          5              2.000 
2023-04-26 11:37:01 | INFO |       14.000 |        7               19          5              2.000 
2023-04-26 11:37:01 | INFO |       16.000 |        8               20          5              2.000 
2023-04-26 11:37:01 | INFO | Algebraic mode change at t = 18
2023-04-26 11:37:01 | INFO |       18.000 |        9               21          5              2.000 
2023-04-26 11:37:01 | INFO | calculation of the new starting point of the simulation.
2023-04-26 11:37:01 | INFO |       18.000 |        9               21          5              2.000 
2023-04-26 11:37:01 | INFO | Differential mode change at t = 20
2023-04-26 11:37:01 | INFO |       20.000 |       10               22          5              2.000 
2023-04-26 11:37:01 | INFO | calculation of the new starting point of the simulation.
2023-04-26 11:37:01 | INFO |       20.000 |       10               22          5              2.000 
2023-04-26 11:37:01 | INFO |       22.000 |       11               23          5              2.000 
2023-04-26 11:37:01 | INFO |       24.000 |       12               24          5              2.000 
2023-04-26 11:37:01 | INFO |       26.000 |       13               25          5              2.000 
2023-04-26 11:37:01 | INFO |       28.000 |       14               26          5              2.000 
2023-04-26 11:37:01 | INFO |       30.000 |       15               27          5              2.000 
2023-04-26 11:37:01 | INFO | Algebraic mode change at t = 32
2023-04-26 11:37:01 | INFO |       32.000 |       16               28          5              2.000 
2023-04-26 11:37:01 | INFO | calculation of the new starting point of the simulation.
2023-04-26 11:37:01 | INFO |       32.000 |       16               28          5              2.000 
2023-04-26 11:37:01 | INFO | Algebraic mode change at t = 34
2023-04-26 11:37:01 | INFO |       34.000 |       17               31          5              2.000 
2023-04-26 11:37:01 | INFO | calculation of the new starting point of the simulation.
2023-04-26 11:37:01 | INFO |       34.000 |       17               31          5              2.000 
2023-04-26 11:37:01 | INFO | Differential mode change at t = 36
2023-04-26 11:37:01 | INFO |       36.000 |       18               33          5              2.000 
2023-04-26 11:37:01 | INFO | calculation of the new starting point of the simulation.
2023-04-26 11:37:01 | INFO |       36.000 |       18               33          5              2.000 
2023-04-26 11:37:01 | INFO | Algebraic mode change at t = 38
2023-04-26 11:37:01 | INFO |       38.000 |       19               34          5              2.000 
2023-04-26 11:37:01 | INFO | calculation of the new starting point of the simulation.
2023-04-26 11:37:01 | INFO |       38.000 |       19               34          5              2.000 
2023-04-26 11:37:01 | INFO |       40.000 |       20               35          5              2.000 
2023-04-26 11:37:01 | INFO | Algebraic mode change at t = 42
2023-04-26 11:37:01 | INFO |       42.000 |       21               36          5              2.000 
2023-04-26 11:37:01 | INFO | calculation of the new starting point of the simulation.
2023-04-26 11:37:01 | INFO |       42.000 |       21               36          5              2.000 
2023-04-26 11:37:01 | INFO | Algebraic mode change at t = 44
2023-04-26 11:37:01 | INFO |       44.000 |       22               39          5              2.000 
2023-04-26 11:37:01 | INFO | calculation of the new starting point of the simulation.
2023-04-26 11:37:01 | INFO |       44.000 |       22               39          5              2.000 
2023-04-26 11:37:01 | INFO | Differential mode change at t = 46
2023-04-26 11:37:01 | INFO |       46.000 |       23               41          5              2.000 
2023-04-26 11:37:01 | INFO | calculation of the new starting point of the simulation.
2023-04-26 11:37:01 | INFO |       46.000 |       23               41          5              2.000 
2023-04-26 11:37:01 | INFO |       48.000 |       24               43          5              2.000 
2023-04-26 11:37:01 | INFO | Algebraic mode change at t = 50
2023-04-26 11:37:01 | INFO |       50.000 |       25               44          5              2.000 
2023-04-26 11:37:01 | INFO | calculation of the new starting point of the simulation.
2023-04-26 11:37:01 | INFO |       50.000 |       25               44          5              2.000 
2023-04-26 11:37:01 | INFO | Algebraic mode change at t = 52
2023-04-26 11:37:01 | INFO |       52.000 |       26               46          5              2.000 
2023-04-26 11:37:01 | INFO | calculation of the new starting point of the simulation.
2023-04-26 11:37:01 | INFO |       52.000 |       26               46          5              2.000 
2023-04-26 11:37:01 | INFO | Algebraic mode change at t = 54
2023-04-26 11:37:01 | INFO |       54.000 |       27               50          5              2.000 
2023-04-26 11:37:01 | INFO | calculation of the new starting point of the simulation.
2023-04-26 11:37:01 | INFO |       54.000 |       27               50          5              2.000 
2023-04-26 11:37:01 | INFO | Algebraic mode (with J recalculation) change at t = 56
2023-04-26 11:37:01 | INFO |       56.000 |       28               52          5              2.000 
2023-04-26 11:37:01 | INFO | calculation of the new starting point of the simulation.
2023-04-26 11:37:01 | INFO |       56.000 |       28               53          6              2.000 
2023-04-26 11:37:01 | INFO | Algebraic mode change at t = 58
2023-04-26 11:37:01 | INFO |       58.000 |       29               55          7              2.000 
2023-04-26 11:37:01 | INFO | calculation of the new starting point of the simulation.
2023-04-26 11:37:01 | INFO |       58.000 |       29               55          7              2.000 
2023-04-26 11:37:01 | INFO | Algebraic mode change at t = 60
2023-04-26 11:37:01 | INFO |       60.000 |       30               57          7              2.000 
2023-04-26 11:37:01 | INFO | calculation of the new starting point of the simulation.
2023-04-26 11:37:01 | INFO |       60.000 |       30               57          7              2.000 
2023-04-26 11:37:01 | INFO | Algebraic mode change at t = 62
2023-04-26 11:37:01 | INFO |       62.000 |       31               59          7              2.000 
2023-04-26 11:37:01 | INFO | calculation of the new starting point of the simulation.
2023-04-26 11:37:01 | INFO |       62.000 |       31               59          7              2.000 
2023-04-26 11:37:01 | INFO | Algebraic mode change at t = 64
2023-04-26 11:37:01 | INFO |       64.000 |       32               62          7              2.000 
2023-04-26 11:37:01 | INFO | calculation of the new starting point of the simulation.
2023-04-26 11:37:01 | INFO |       64.000 |       32               62          7              2.000 
2023-04-26 11:37:01 | INFO | Algebraic mode change at t = 66
2023-04-26 11:37:01 | INFO |       66.000 |       33               64          7              2.000 
2023-04-26 11:37:01 | INFO | calculation of the new starting point of the simulation.
2023-04-26 11:37:01 | INFO |       66.000 |       33               64          7              2.000 
2023-04-26 11:37:01 | INFO |       68.000 |       34               66          7              2.000 
2023-04-26 11:37:01 | INFO |       70.000 |       35               68          7              2.000 
2023-04-26 11:37:01 | INFO | Algebraic mode (with J recalculation) change at t = 72
2023-04-26 11:37:01 | INFO |       72.000 |       36               70          7              2.000 
2023-04-26 11:37:01 | INFO | calculation of the new starting point of the simulation.
2023-04-26 11:37:01 | INFO |       72.000 |       36               71          8              2.000 
2023-04-26 11:37:01 | INFO | Algebraic mode change at t = 74
2023-04-26 11:37:01 | INFO |       74.000 |       37               76          9              2.000 
2023-04-26 11:37:01 | INFO | calculation of the new starting point of the simulation.
2023-04-26 11:37:01 | INFO |       74.000 |       37               76          9              2.000 
2023-04-26 11:37:01 | INFO | Algebraic mode (with J recalculation) change at t = 76
2023-04-26 11:37:01 | INFO |       76.000 |       38               80          9              2.000 
2023-04-26 11:37:01 | INFO | calculation of the new starting point of the simulation.
2023-04-26 11:37:01 | INFO |       76.000 |       38               81         10              2.000 
2023-04-26 11:37:01 | INFO | Algebraic mode change at t = 78
2023-04-26 11:37:01 | INFO |       78.000 |       39               84         11              2.000 
2023-04-26 11:37:01 | INFO | calculation of the new starting point of the simulation.
2023-04-26 11:37:01 | INFO |       78.000 |       39               84         11              2.000 
2023-04-26 11:37:01 | INFO |       80.000 |       40               86         11              2.000 
2023-04-26 11:37:02 | INFO | Algebraic mode change at t = 82
2023-04-26 11:37:02 | INFO |       82.000 |       41               88         11              2.000 
2023-04-26 11:37:02 | INFO | calculation of the new starting point of the simulation.
2023-04-26 11:37:02 | INFO |       82.000 |       41               88         11              2.000 
2023-04-26 11:37:02 | INFO | Algebraic mode change at t = 84
2023-04-26 11:37:02 | INFO |       84.000 |       42               90         11              2.000 
2023-04-26 11:37:02 | INFO | calculation of the new starting point of the simulation.
2023-04-26 11:37:02 | INFO |       84.000 |       42               90         11              2.000 
2023-04-26 11:37:02 | INFO | Algebraic mode (with J recalculation) change at t = 86
2023-04-26 11:37:02 | INFO |       86.000 |       43               92         11              2.000 
2023-04-26 11:37:02 | INFO | calculation of the new starting point of the simulation.
2023-04-26 11:37:02 | INFO |       86.000 |       43               93         12              2.000 
2023-04-26 11:37:02 | INFO | Algebraic mode change at t = 88
2023-04-26 11:37:02 | INFO |       88.000 |       44               95         13              2.000 
2023-04-26 11:37:02 | INFO | calculation of the new starting point of the simulation.
2023-04-26 11:37:02 | INFO |       88.000 |       44               95         13              2.000 
2023-04-26 11:37:02 | INFO |       90.000 |       45               96         13              2.000 
2023-04-26 11:37:02 | INFO | Algebraic mode change at t = 92
2023-04-26 11:37:02 | INFO |       92.000 |       46               97         13              2.000 
2023-04-26 11:37:02 | INFO | calculation of the new starting point of the simulation.
2023-04-26 11:37:02 | INFO |       92.000 |       46               97         13              2.000 
2023-04-26 11:37:02 | INFO | Algebraic mode change at t = 94
2023-04-26 11:37:02 | INFO |       94.000 |       47              100         13              2.000 
2023-04-26 11:37:02 | INFO | calculation of the new starting point of the simulation.
2023-04-26 11:37:02 | INFO |       94.000 |       47              100         13              2.000 
2023-04-26 11:37:02 | INFO |       96.000 |       48              102         13              2.000 
2023-04-26 11:37:02 | INFO |       98.000 |       49              103         13              2.000 
2023-04-26 11:37:02 | INFO |      100.000 |       50              104         13              2.000 
2023-04-26 11:37:02 | INFO | Algebraic mode change at t = 102
2023-04-26 11:37:02 | INFO |      102.000 |       51              105         13              2.000 
2023-04-26 11:37:02 | INFO | calculation of the new starting point of the simulation.
2023-04-26 11:37:02 | INFO |      102.000 |       51              105         13              2.000 
2023-04-26 11:37:02 | INFO | Algebraic mode change at t = 104
2023-04-26 11:37:02 | INFO |      104.000 |       52              108         13              2.000 
2023-04-26 11:37:02 | INFO | calculation of the new starting point of the simulation.
2023-04-26 11:37:02 | INFO |      104.000 |       52              108         13              2.000 
2023-04-26 11:37:02 | INFO | Algebraic mode change at t = 106
2023-04-26 11:37:02 | INFO |      106.000 |       53              111         13              2.000 
2023-04-26 11:37:02 | INFO | calculation of the new starting point of the simulation.
2023-04-26 11:37:02 | INFO |      106.000 |       53              111         13              2.000 
2023-04-26 11:37:02 | INFO |      108.000 |       54              113         13              2.000 
2023-04-26 11:37:02 | INFO |      110.000 |       55              114         13              2.000 
2023-04-26 11:37:02 | INFO | Algebraic mode change at t = 112
2023-04-26 11:37:02 | INFO |      112.000 |       56              115         13              2.000 
2023-04-26 11:37:02 | INFO | calculation of the new starting point of the simulation.
2023-04-26 11:37:02 | INFO |      112.000 |       56              115         13              2.000 
2023-04-26 11:37:02 | INFO | Algebraic mode change at t = 114
2023-04-26 11:37:02 | INFO |      114.000 |       57              119         14              2.000 
2023-04-26 11:37:02 | INFO | calculation of the new starting point of the simulation.
2023-04-26 11:37:02 | INFO |      114.000 |       57              119         14              2.000 
2023-04-26 11:37:02 | INFO | Algebraic mode change at t = 116
2023-04-26 11:37:02 | INFO |      116.000 |       58              121         14              2.000 
2023-04-26 11:37:02 | INFO | calculation of the new starting point of the simulation.
2023-04-26 11:37:02 | INFO |      116.000 |       58              121         14              2.000 
2023-04-26 11:37:02 | INFO |      118.000 |       59              123         14              2.000 
2023-04-26 11:37:02 | INFO |      120.000 |       60              124         14              2.000 
2023-04-26 11:37:02 | INFO | Algebraic mode change at t = 122
2023-04-26 11:37:02 | INFO |      122.000 |       61              125         14              2.000 
2023-04-26 11:37:02 | INFO | calculation of the new starting point of the simulation.
2023-04-26 11:37:02 | INFO |      122.000 |       61              125         14              2.000 
2023-04-26 11:37:02 | INFO | Algebraic mode change at t = 124
2023-04-26 11:37:02 | INFO |      124.000 |       62              128         14              2.000 
2023-04-26 11:37:02 | INFO | calculation of the new starting point of the simulation.
2023-04-26 11:37:02 | INFO |      124.000 |       62              128         14              2.000 
2023-04-26 11:37:02 | INFO | Algebraic mode (with J recalculation) change at t = 126
2023-04-26 11:37:02 | INFO |      126.000 |       63              131         14              2.000 
2023-04-26 11:37:02 | INFO | calculation of the new starting point of the simulation.
2023-04-26 11:37:02 | INFO | Differential mode change at t = 126
2023-04-26 11:37:02 | INFO |      126.000 |       63              132         15              2.000 
2023-04-26 11:37:02 | INFO | Algebraic mode change at t = 128
2023-04-26 11:37:02 | INFO |      128.000 |       64              135         16              2.000 
2023-04-26 11:37:02 | INFO | calculation of the new starting point of the simulation.
2023-04-26 11:37:02 | INFO |      128.000 |       64              135         16              2.000 
2023-04-26 11:37:02 | INFO | Differential mode change at t = 130
2023-04-26 11:37:02 | INFO |      130.000 |       65              137         16              2.000 
2023-04-26 11:37:02 | INFO | calculation of the new starting point of the simulation.
2023-04-26 11:37:02 | INFO |      130.000 |       65              137         16              2.000 
2023-04-26 11:37:02 | INFO | Algebraic mode change at t = 132
2023-04-26 11:37:02 | INFO |      132.000 |       66              138         16              2.000 
2023-04-26 11:37:02 | INFO | calculation of the new starting point of the simulation.
2023-04-26 11:37:02 | INFO |      132.000 |       66              138         16              2.000 
2023-04-26 11:37:02 | INFO | Algebraic mode change at t = 134
2023-04-26 11:37:02 | INFO |      134.000 |       67              141         16              2.000 
2023-04-26 11:37:02 | INFO | calculation of the new starting point of the simulation.
2023-04-26 11:37:02 | INFO |      134.000 |       67              141         16              2.000 
2023-04-26 11:37:02 | INFO | Algebraic mode change at t = 136
2023-04-26 11:37:02 | INFO |      136.000 |       68              143         16              2.000 
2023-04-26 11:37:02 | INFO | calculation of the new starting point of the simulation.
2023-04-26 11:37:02 | INFO |      136.000 |       68              143         16              2.000 
2023-04-26 11:37:02 | INFO | Algebraic mode change at t = 138
2023-04-26 11:37:02 | INFO |      138.000 |       69              145         16              2.000 
2023-04-26 11:37:02 | INFO | calculation of the new starting point of the simulation.
2023-04-26 11:37:02 | INFO |      138.000 |       69              145         16              2.000 
2023-04-26 11:37:02 | INFO |      140.000 |       70              147         16              2.000 
2023-04-26 11:37:02 | INFO | Algebraic mode change at t = 142
2023-04-26 11:37:02 | INFO |      142.000 |       71              148         16              2.000 
2023-04-26 11:37:02 | INFO | calculation of the new starting point of the simulation.
2023-04-26 11:37:02 | INFO |      142.000 |       71              148         16              2.000 
2023-04-26 11:37:02 | INFO | Algebraic mode change at t = 144
2023-04-26 11:37:02 | INFO |      144.000 |       72              151         16              2.000 
2023-04-26 11:37:02 | INFO | calculation of the new starting point of the simulation.
2023-04-26 11:37:02 | INFO |      144.000 |       72              151         16              2.000 
2023-04-26 11:37:02 | INFO | Algebraic mode change at t = 146
2023-04-26 11:37:02 | INFO |      146.000 |       73              154         16              2.000 
2023-04-26 11:37:02 | INFO | calculation of the new starting point of the simulation.
2023-04-26 11:37:02 | INFO |      146.000 |       73              154         16              2.000 
2023-04-26 11:37:02 | INFO | Algebraic mode (with J recalculation) change at t = 148
2023-04-26 11:37:02 | INFO |      148.000 |       74              157         16              2.000 
2023-04-26 11:37:02 | INFO | calculation of the new starting point of the simulation.
2023-04-26 11:37:02 | INFO |      148.000 |       74              158         17              2.000 
2023-04-26 11:37:02 | INFO | Algebraic mode change at t = 150
2023-04-26 11:37:02 | INFO |      150.000 |       75              165         19              2.000 
2023-04-26 11:37:02 | INFO | calculation of the new starting point of the simulation.
2023-04-26 11:37:02 | INFO |      150.000 |       75              165         19              2.000 
2023-04-26 11:37:02 | INFO | Algebraic mode change at t = 152
2023-04-26 11:37:02 | INFO |      152.000 |       76              168         19              2.000 
2023-04-26 11:37:02 | INFO | calculation of the new starting point of the simulation.
2023-04-26 11:37:02 | INFO |      152.000 |       76              168         19              2.000 
2023-04-26 11:37:02 | INFO | Algebraic mode change at t = 154
2023-04-26 11:37:02 | INFO |      154.000 |       77              171         19              2.000 
2023-04-26 11:37:02 | INFO | calculation of the new starting point of the simulation.
2023-04-26 11:37:02 | INFO |      154.000 |       77              171         19              2.000 
2023-04-26 11:37:02 | INFO | Algebraic mode (with J recalculation) change at t = 156
2023-04-26 11:37:02 | INFO |      156.000 |       78              175         19              2.000 
2023-04-26 11:37:02 | INFO | calculation of the new starting point of the simulation.
2023-04-26 11:37:02 | INFO |      156.000 |       78              176         20              2.000 
2023-04-26 11:37:02 | INFO | Algebraic mode change at t = 158
2023-04-26 11:37:02 | INFO |      158.000 |       79              182         21              2.000 
2023-04-26 11:37:02 | INFO | calculation of the new starting point of the simulation.
2023-04-26 11:37:02 | INFO |      158.000 |       79              182         21              2.000 
2023-04-26 11:37:02 | INFO | Algebraic mode change at t = 160
2023-04-26 11:37:02 | INFO |      160.000 |       80              188         22              2.000 
2023-04-26 11:37:02 | INFO | calculation of the new starting point of the simulation.
2023-04-26 11:37:02 | INFO |      160.000 |       80              188         22              2.000 
2023-04-26 11:37:02 | INFO | Algebraic mode change at t = 162
2023-04-26 11:37:02 | INFO |      162.000 |       81              191         22              2.000 
2023-04-26 11:37:02 | INFO | calculation of the new starting point of the simulation.
2023-04-26 11:37:02 | INFO |      162.000 |       81              191         22              2.000 
2023-04-26 11:37:02 | INFO | Algebraic mode change at t = 164
2023-04-26 11:37:02 | INFO |      164.000 |       82              194         22              2.000 
2023-04-26 11:37:02 | INFO | calculation of the new starting point of the simulation.
2023-04-26 11:37:02 | INFO |      164.000 |       82              194         22              2.000 
2023-04-26 11:37:02 | INFO |      166.000 |       83              197         22              2.000 
2023-04-26 11:37:02 | INFO |      168.000 |       84              201         22              2.000 
2023-04-26 11:37:02 | INFO |      170.000 |       85              206         22              2.000 
2023-04-26 11:37:02 | INFO | Algebraic mode change at t = 172
2023-04-26 11:37:02 | INFO |      172.000 |       86              212         23              2.000 
2023-04-26 11:37:02 | INFO | calculation of the new starting point of the simulation.
2023-04-26 11:37:02 | INFO |      172.000 |       86              212         23              2.000 
2023-04-26 11:37:02 | WARN | the maximum number of nonlinear iterations has been reached
2023-04-26 11:37:02 | INFO |      173.000 |       87              230         26              1.000 
2023-04-26 11:37:02 | WARN | the system function failed in an unrecoverable manner
2023-04-26 11:37:02 | INFO |      173.500 |       88              246         29              0.500 
2023-04-26 11:37:02 | WARN | the maximum number of nonlinear iterations has been reached
2023-04-26 11:37:02 | INFO | Algebraic mode change at t = 174
2023-04-26 11:37:02 | INFO |      174.000 |       89              264         32              0.500 
2023-04-26 11:37:02 | INFO | calculation of the new starting point of the simulation.
2023-04-26 11:37:02 | INFO |      174.000 |       89              264         32              0.500 
2023-04-26 11:37:02 | WARN | the system function failed in an unrecoverable manner
2023-04-26 11:37:02 | INFO |      174.250 |       90              277         34              0.250 
2023-04-26 11:37:02 | WARN | the system function failed in an unrecoverable manner
2023-04-26 11:37:02 | INFO |      174.500 |       91              290         36              0.250 
2023-04-26 11:37:02 | INFO | Algebraic mode change at t = 174.75
2023-04-26 11:37:02 | INFO |      174.750 |       92              294         36              0.250 
2023-04-26 11:37:02 | INFO | calculation of the new starting point of the simulation.
2023-04-26 11:37:02 | INFO |      174.750 |       92              294         36              0.250 
2023-04-26 11:37:02 | WARN | the system function failed in an unrecoverable manner
2023-04-26 11:37:02 | INFO |      174.875 |       93              307         38              0.125 
2023-04-26 11:37:02 | INFO |      175.000 |       94              312         38              0.125 
2023-04-26 11:37:02 | INFO | 
2023-04-26 11:37:02 | INFO | execution statistics :
2023-04-26 11:37:02 | INFO | 
2023-04-26 11:37:02 | INFO | number of time iterations                  = 94
2023-04-26 11:37:02 | INFO | number of residual evaluations             = 420
2023-04-26 11:37:02 | INFO | number of Jacobian evaluations             = 38
2023-04-26 11:37:02 | INFO | number of nonlinear iterations             = 312
2023-04-26 11:37:02 | INFO | number of error test failures              = 0
2023-04-26 11:37:02 | INFO | number of nonlinear convergence failures   = 6
2023-04-26 11:37:02 | INFO | number of root functions evaluations       = 103
2023-04-26 11:37:02 | INFO | number of discrete variables evaluations   = 83
2023-04-26 11:37:02 | INFO | number of mode evaluations                 = 82
2023-04-26 11:37:02 | INFO | end of job 'Nordic Test System with a fault, the tripping of a line and a voltage collapse'
