2024-04-25 17:29:43 | INFO |  ============================================================ 
2024-04-25 17:29:43 | INFO | DYNAWO VERSION  :     1.7.0
2024-04-25 17:29:43 | INFO | DYNAWO REVISION :  master-18-cf2130ea6f
2024-04-25 17:29:43 | INFO |  ============================================================ 
2024-04-25 17:29:43 | INFO | 
2024-04-25 17:29:43 | INFO | -----------------------------------------------------------------------
2024-04-25 17:29:43 | INFO | building model from input files
2024-04-25 17:29:43 | INFO | -----------------------------------------------------------------------
2024-04-25 17:29:44 | INFO | model was built successfully
2024-04-25 17:29:44 | INFO | -----------------------------------------------------------------------
2024-04-25 17:29:44 | INFO | 
2024-04-25 17:29:44 | INFO | -----------------------------------------------------------------------
2024-04-25 17:29:44 | INFO | starting local initialization
2024-04-25 17:29:44 | INFO | -----------------------------------------------------------------------
2024-04-25 17:29:44 | INFO | end of local initialization
2024-04-25 17:29:44 | INFO | -----------------------------------------------------------------------
2024-04-25 17:29:44 | INFO | 
2024-04-25 17:29:44 | INFO | -----------------------------------------------------------------------
2024-04-25 17:29:44 | INFO | starting global initialization
2024-04-25 17:29:44 | INFO | -----------------------------------------------------------------------
2024-04-25 17:29:44 | INFO | end of global initialization
2024-04-25 17:29:44 | INFO | -----------------------------------------------------------------------
2024-04-25 17:29:44 | INFO | 
2024-04-25 17:29:44 | INFO | -----------------------------------------------------------------------
2024-04-25 17:29:44 | INFO | starting curve initialization
2024-04-25 17:29:44 | INFO | -----------------------------------------------------------------------
2024-04-25 17:29:44 | WARN | curve not added: Id: NETWORK , name: Load_zP
2024-04-25 17:29:44 | WARN | curve not added: Id: NETWORK , name: Load_zQ
2024-04-25 17:29:44 | WARN | curve not added: Id: NETWORK , name: Load_DeltaPc
2024-04-25 17:29:44 | WARN | curve not added: Id: NETWORK , name: Load_DeltaQc
2024-04-25 17:29:44 | INFO | end of curve initialization, added 14 curves
2024-04-25 17:29:44 | INFO | -----------------------------------------------------------------------
2024-04-25 17:29:44 | INFO | 
2024-04-25 17:29:44 | INFO | -----------------------------------------------------------------------
2024-04-25 17:29:44 | INFO | starting simulation with solver SimplifiedSolver
2024-04-25 17:29:44 | INFO | -----------------------------------------------------------------------
2024-04-25 17:29:44 | INFO | -----------------------------------------------------------------------
2024-04-25 17:29:44 | INFO | number of continuous variables : 22
2024-04-25 17:29:44 | INFO | number of discrete variables : 17
2024-04-25 17:29:44 | INFO | number of root functions : 9
2024-04-25 17:29:44 | INFO | -----------------------------------------------------------------------
2024-04-25 17:29:44 | INFO |         time | iter num   Nonlinear iter   jac eval      time step (h)
2024-04-25 17:29:44 | INFO | -----------------------------------------------------------------------
2024-04-25 17:29:44 | INFO |        0.000 |        0                0          0              1.000 
2024-04-25 17:29:44 | INFO |        1.000 |        1                0          0              1.000 
2024-04-25 17:29:44 | INFO |        2.000 |        2                0          0              1.000 
2024-04-25 17:29:44 | INFO |        3.000 |        3                0          0              1.000 
2024-04-25 17:29:44 | INFO |        4.000 |        4                0          0              1.000 
2024-04-25 17:29:44 | INFO |        5.000 |        5                0          0              1.000 
2024-04-25 17:29:44 | INFO |        6.000 |        6                0          0              1.000 
2024-04-25 17:29:44 | INFO |        7.000 |        7                0          0              1.000 
2024-04-25 17:29:44 | INFO |        8.000 |        8                0          0              1.000 
2024-04-25 17:29:44 | INFO |        9.000 |        9                0          0              1.000 
2024-04-25 17:29:44 | INFO | state of Load Load change from 2 to 1
2024-04-25 17:29:44 | INFO | Algebraic mode change at t = 10
2024-04-25 17:29:44 | INFO |       10.000 |       10                0          0              1.000 
2024-04-25 17:29:44 | INFO | calculation of the new starting point of the simulation.
2024-04-25 17:29:44 | INFO |       10.000 |       10                1          0              1.000 
2024-04-25 17:29:44 | INFO |       11.000 |       11                2          1              1.000 
2024-04-25 17:29:44 | INFO |       12.000 |       12                2          2              1.000 
2024-04-25 17:29:44 | INFO |       13.000 |       13                2          3              1.000 
2024-04-25 17:29:44 | INFO |       14.000 |       14                2          4              1.000 
2024-04-25 17:29:44 | INFO |       15.000 |       15                2          5              1.000 
2024-04-25 17:29:44 | INFO |       16.000 |       16                2          6              1.000 
2024-04-25 17:29:44 | INFO |       17.000 |       17                2          7              1.000 
2024-04-25 17:29:44 | INFO |       18.000 |       18                2          8              1.000 
2024-04-25 17:29:44 | INFO |       19.000 |       19                2          9              1.000 
2024-04-25 17:29:44 | INFO |       20.000 |       20                2         10              1.000 
2024-04-25 17:29:44 | INFO | 
2024-04-25 17:29:44 | INFO | execution statistics :
2024-04-25 17:29:44 | INFO | 
2024-04-25 17:29:44 | INFO | number of time iterations                  = 20
2024-04-25 17:29:44 | INFO | number of residual evaluations             = 23
2024-04-25 17:29:44 | INFO | number of Jacobian evaluations             = 10
2024-04-25 17:29:44 | INFO | number of nonlinear iterations             = 2
2024-04-25 17:29:44 | INFO | number of error test failures              = 0
2024-04-25 17:29:44 | INFO | number of nonlinear convergence failures   = 0
2024-04-25 17:29:44 | INFO | number of root functions evaluations       = 22
2024-04-25 17:29:44 | INFO | number of discrete variables evaluations   = 3
2024-04-25 17:29:44 | INFO | number of mode evaluations                 = 2
2024-04-25 17:29:44 | INFO | end of job 'Disconnect load test'
