2020-05-20 17:42:19 | INFO |  ============================================================ 
2020-05-20 17:42:19 | INFO | DYNAWO VERSION  :     1.1.0
2020-05-20 17:42:19 | INFO | DYNAWO REVISION :  919_ExecutionStats-e7e2f6bf
2020-05-20 17:42:19 | INFO |  ============================================================ 
2020-05-20 17:42:19 | INFO | 
2020-05-20 17:42:19 | INFO | -----------------------------------------------------------------------
2020-05-20 17:42:19 | INFO | building model from input files
2020-05-20 17:42:19 | INFO | -----------------------------------------------------------------------
2020-05-20 17:43:06 | INFO | model was built successfully
2020-05-20 17:43:06 | INFO | -----------------------------------------------------------------------
2020-05-20 17:43:06 | INFO | 
2020-05-20 17:43:06 | INFO | -----------------------------------------------------------------------
2020-05-20 17:43:06 | INFO | starting local initialization
2020-05-20 17:43:06 | INFO | -----------------------------------------------------------------------
2020-05-20 17:43:06 | DEBUG | ------------------------------
2020-05-20 17:43:06 | DEBUG | starting local initialization of model SM
2020-05-20 17:43:06 | DEBUG | local initialization of model SM ended successfully
2020-05-20 17:43:06 | INFO | end of local initialization
2020-05-20 17:43:06 | INFO | -----------------------------------------------------------------------
2020-05-20 17:43:06 | INFO | 
2020-05-20 17:43:06 | INFO | -----------------------------------------------------------------------
2020-05-20 17:43:06 | INFO | starting global initialization
2020-05-20 17:43:06 | INFO | -----------------------------------------------------------------------
2020-05-20 17:43:06 | DEBUG | initialization of IDA solver : ok
2020-05-20 17:43:06 | DEBUG | call of SolverReInit ie a new symbolic and numerical factorization will be performed
2020-05-20 17:43:06 | DEBUG | call of SolverReInit ie a new symbolic and numerical factorization will be performed
2020-05-20 17:43:06 | DEBUG | call of SolverReInit ie a new symbolic and numerical factorization will be performed
2020-05-20 17:43:06 | INFO | end of global initialization
2020-05-20 17:43:06 | INFO | -----------------------------------------------------------------------
2020-05-20 17:43:06 | INFO | 
2020-05-20 17:43:06 | INFO | -----------------------------------------------------------------------
2020-05-20 17:43:06 | INFO | starting curve initialization
2020-05-20 17:43:06 | INFO | -----------------------------------------------------------------------
2020-05-20 17:43:06 | DEBUG | adding curve : Id: SM; curve: gen_cePu found. (exact name)
2020-05-20 17:43:06 | DEBUG | adding curve : Id: SM; curve: gen_PePu found. (exact name)
2020-05-20 17:43:06 | DEBUG | adding curve : Id: SM; curve: gen_cmPu found. (exact name)
2020-05-20 17:43:06 | DEBUG | adding curve : Id: SM; output: gen_PmPu found.( gen_PmPu_value )
2020-05-20 17:43:06 | DEBUG | adding curve : Id: SM; curve: gen_ufPu found. (exact name)
2020-05-20 17:43:06 | DEBUG | adding curve : Id: SM; output: gen_efdPu found.( gen_efdPu_value )
2020-05-20 17:43:06 | DEBUG | adding curve : Id: SM; output: gen_omegaPu found.( gen_omegaPu_value )
2020-05-20 17:43:06 | DEBUG | adding curve : Id: SM; curve: gen_theta found. (exact name)
2020-05-20 17:43:06 | DEBUG | adding curve : Id: SM; curve: gen_PGenPu found. (exact name)
2020-05-20 17:43:06 | DEBUG | adding curve : Id: SM; curve: gen_QGenPu found. (exact name)
2020-05-20 17:43:06 | DEBUG | adding curve : Id: SM; curve: gen_PGen found. (exact name)
2020-05-20 17:43:06 | DEBUG | adding curve : Id: SM; curve: gen_QGen found. (exact name)
2020-05-20 17:43:06 | DEBUG | adding curve : Id: SM; curve: gen_UPu found. (exact name)
2020-05-20 17:43:06 | DEBUG | adding curve : Id: SM; output: gen_IStatorPu found.( gen_IStatorPu_value )
2020-05-20 17:43:06 | DEBUG | adding curve : Id: SM; output: gen_IRotorPu found.( gen_IRotorPu_value )
2020-05-20 17:43:06 | DEBUG | adding curve : Id: SM; output: gen_UStatorPu found.( gen_UStatorPu_value )
2020-05-20 17:43:06 | DEBUG | adding curve : Id: SM; output: gen_QStatorPu found.( gen_QStatorPu_value )
2020-05-20 17:43:06 | DEBUG | adding curve : Id: SM; output: gen_thetaInternal found.( gen_thetaInternal_value )
2020-05-20 17:43:06 | INFO | end of curve initialization, added 18 curves
2020-05-20 17:43:06 | INFO | -----------------------------------------------------------------------
2020-05-20 17:43:06 | INFO | 
2020-05-20 17:43:06 | INFO | -----------------------------------------------------------------------
2020-05-20 17:43:06 | INFO | starting simulation with solver IDASolver
2020-05-20 17:43:06 | INFO | -----------------------------------------------------------------------
2020-05-20 17:43:06 | INFO | -----------------------------------------------------------------------
2020-05-20 17:43:06 | INFO | number of continuous variables : 68
2020-05-20 17:43:06 | INFO | number of discrete variables : 18
2020-05-20 17:43:06 | INFO | -----------------------------------------------------------------------
2020-05-20 17:43:06 | INFO |         time | iter num   order (k)      time step (h)
2020-05-20 17:43:06 | INFO | -----------------------------------------------------------------------
2020-05-20 17:43:06 | INFO |        0.000 |        0           0              0.010 
2020-05-20 17:43:06 | DEBUG | call of SolverReInit ie a new symbolic and numerical factorization will be performed
2020-05-20 17:43:06 | INFO |        0.000 |        1           1              0.000 
2020-05-20 17:43:06 | INFO |        0.000 |        2           1              0.000 
2020-05-20 17:43:06 | INFO |        0.000 |        3           2              0.000 
2020-05-20 17:43:06 | DEBUG | call of SolverReInit ie a new symbolic and numerical factorization will be performed
2020-05-20 17:43:06 | INFO |        0.000 |        4           2              0.000 
2020-05-20 17:43:06 | DEBUG | call of SolverReInit ie a new symbolic and numerical factorization will be performed
2020-05-20 17:43:06 | INFO |        0.000 |        5           2              0.000 
2020-05-20 17:43:06 | DEBUG | call of SolverReInit ie a new symbolic and numerical factorization will be performed
2020-05-20 17:43:06 | INFO |        0.000 |        6           2              0.000 
2020-05-20 17:43:06 | DEBUG | call of SolverReInit ie a new symbolic and numerical factorization will be performed
2020-05-20 17:43:06 | INFO |        0.000 |        7           2              0.000 
2020-05-20 17:43:06 | DEBUG | call of SolverReInit ie a new symbolic and numerical factorization will be performed
2020-05-20 17:43:06 | INFO |        0.000 |        8           2              0.000 
2020-05-20 17:43:06 | DEBUG | call of SolverReInit ie a new symbolic and numerical factorization will be performed
2020-05-20 17:43:06 | INFO |        0.000 |        9           2              0.000 
2020-05-20 17:43:06 | DEBUG | call of SolverReInit ie a new symbolic and numerical factorization will be performed
2020-05-20 17:43:06 | INFO |        0.001 |       10           2              0.000 
2020-05-20 17:43:06 | DEBUG | call of SolverReInit ie a new symbolic and numerical factorization will be performed
2020-05-20 17:43:06 | INFO |        0.001 |       11           2              0.001 
2020-05-20 17:43:06 | DEBUG | call of SolverReInit ie a new symbolic and numerical factorization will be performed
2020-05-20 17:43:06 | INFO |        0.002 |       12           2              0.001 
2020-05-20 17:43:06 | DEBUG | call of SolverReInit ie a new symbolic and numerical factorization will be performed
2020-05-20 17:43:06 | INFO |        0.004 |       13           2              0.002 
2020-05-20 17:43:06 | DEBUG | call of SolverReInit ie a new symbolic and numerical factorization will be performed
2020-05-20 17:43:06 | INFO |        0.008 |       14           2              0.004 
2020-05-20 17:43:06 | DEBUG | call of SolverReInit ie a new symbolic and numerical factorization will be performed
2020-05-20 17:43:06 | INFO |        0.016 |       15           2              0.008 
2020-05-20 17:43:06 | DEBUG | call of SolverReInit ie a new symbolic and numerical factorization will be performed
2020-05-20 17:43:06 | INFO |        0.033 |       16           2              0.016 
2020-05-20 17:43:06 | DEBUG | call of SolverReInit ie a new symbolic and numerical factorization will be performed
2020-05-20 17:43:06 | INFO |        0.066 |       17           2              0.033 
2020-05-20 17:43:06 | DEBUG | call of SolverReInit ie a new symbolic and numerical factorization will be performed
2020-05-20 17:43:06 | INFO |        0.131 |       18           1              0.066 
2020-05-20 17:43:06 | DEBUG | call of SolverReInit ie a new symbolic and numerical factorization will be performed
2020-05-20 17:43:06 | INFO |        0.262 |       19           1              0.131 
2020-05-20 17:43:06 | DEBUG | call of SolverReInit ie a new symbolic and numerical factorization will be performed
2020-05-20 17:43:06 | INFO |        0.524 |       20           1              0.262 
2020-05-20 17:43:06 | DEBUG | call of SolverReInit ie a new symbolic and numerical factorization will be performed
2020-05-20 17:43:06 | INFO | Algebraic mode (with J recalculation) change for model Network
2020-05-20 17:43:06 | INFO |        1.000 |       21           1              0.524 
2020-05-20 17:43:06 | INFO | calculation of the new starting point of the simulation.
2020-05-20 17:43:06 | DEBUG | call of SolverReInit ie a new symbolic and numerical factorization will be performed
2020-05-20 17:43:06 | DEBUG | call of SolverReInit ie a new symbolic and numerical factorization will be performed
2020-05-20 17:43:06 | DEBUG | call of SolverReInit ie a new symbolic and numerical factorization will be performed
2020-05-20 17:43:06 | INFO |        1.000 |        0           0              0.000 
2020-05-20 17:43:06 | DEBUG | call of SolverReInit ie a new symbolic and numerical factorization will be performed
2020-05-20 17:43:06 | INFO |        1.000 |        1           1              0.000 
2020-05-20 17:43:06 | INFO |        1.000 |        2           1              0.000 
2020-05-20 17:43:06 | INFO |        1.000 |        3           2              0.000 
2020-05-20 17:43:06 | DEBUG | call of SolverReInit ie a new symbolic and numerical factorization will be performed
2020-05-20 17:43:06 | INFO |        1.000 |        4           2              0.000 
2020-05-20 17:43:06 | DEBUG | call of SolverReInit ie a new symbolic and numerical factorization will be performed
2020-05-20 17:43:06 | INFO |        1.000 |        5           2              0.000 
2020-05-20 17:43:06 | DEBUG | call of SolverReInit ie a new symbolic and numerical factorization will be performed
2020-05-20 17:43:06 | INFO |        1.000 |        6           2              0.000 
2020-05-20 17:43:06 | DEBUG | call of SolverReInit ie a new symbolic and numerical factorization will be performed
2020-05-20 17:43:06 | INFO |        1.000 |        7           2              0.000 
2020-05-20 17:43:06 | DEBUG | call of SolverReInit ie a new symbolic and numerical factorization will be performed
2020-05-20 17:43:06 | INFO |        1.000 |        8           2              0.000 
2020-05-20 17:43:06 | DEBUG | call of SolverReInit ie a new symbolic and numerical factorization will be performed
2020-05-20 17:43:06 | INFO |        1.000 |        9           2              0.000 
2020-05-20 17:43:06 | DEBUG | call of SolverReInit ie a new symbolic and numerical factorization will be performed
2020-05-20 17:43:06 | INFO |        1.001 |       10           2              0.000 
2020-05-20 17:43:06 | DEBUG | call of SolverReInit ie a new symbolic and numerical factorization will be performed
2020-05-20 17:43:06 | INFO | Algebraic mode change for model SM
2020-05-20 17:43:06 | INFO |        1.001 |       11           2              0.001 
2020-05-20 17:43:06 | INFO | calculation of the new starting point of the simulation.
2020-05-20 17:43:06 | INFO |        1.001 |        0           0              0.000 
2020-05-20 17:43:06 | DEBUG | call of SolverReInit ie a new symbolic and numerical factorization will be performed
2020-05-20 17:43:06 | INFO |        1.001 |        1           1              0.000 
2020-05-20 17:43:06 | INFO |        1.001 |        2           1              0.000 
2020-05-20 17:43:06 | INFO |        1.001 |        3           2              0.000 
2020-05-20 17:43:06 | DEBUG | call of SolverReInit ie a new symbolic and numerical factorization will be performed
2020-05-20 17:43:06 | INFO |        1.001 |        4           2              0.000 
2020-05-20 17:43:06 | DEBUG | call of SolverReInit ie a new symbolic and numerical factorization will be performed
2020-05-20 17:43:06 | INFO |        1.001 |        5           2              0.000 
2020-05-20 17:43:06 | DEBUG | call of SolverReInit ie a new symbolic and numerical factorization will be performed
2020-05-20 17:43:06 | INFO |        1.001 |        6           2              0.000 
2020-05-20 17:43:06 | DEBUG | call of SolverReInit ie a new symbolic and numerical factorization will be performed
2020-05-20 17:43:06 | INFO |        1.001 |        7           2              0.000 
2020-05-20 17:43:06 | DEBUG | call of SolverReInit ie a new symbolic and numerical factorization will be performed
2020-05-20 17:43:06 | INFO |        1.001 |        8           2              0.000 
2020-05-20 17:43:06 | DEBUG | call of SolverReInit ie a new symbolic and numerical factorization will be performed
2020-05-20 17:43:06 | INFO |        1.001 |        9           2              0.000 
2020-05-20 17:43:06 | DEBUG | call of SolverReInit ie a new symbolic and numerical factorization will be performed
2020-05-20 17:43:06 | INFO |        1.001 |       10           2              0.000 
2020-05-20 17:43:06 | DEBUG | call of SolverReInit ie a new symbolic and numerical factorization will be performed
2020-05-20 17:43:06 | INFO |        1.002 |       11           2              0.001 
2020-05-20 17:43:06 | DEBUG | call of SolverReInit ie a new symbolic and numerical factorization will be performed
2020-05-20 17:43:06 | INFO |        1.003 |       12           2              0.001 
2020-05-20 17:43:06 | DEBUG | call of SolverReInit ie a new symbolic and numerical factorization will be performed
2020-05-20 17:43:06 | INFO |        1.005 |       13           2              0.002 
2020-05-20 17:43:06 | INFO |        1.007 |       14           2              0.002 
2020-05-20 17:43:06 | INFO |        1.009 |       15           2              0.002 
2020-05-20 17:43:06 | INFO |        1.011 |       16           2              0.002 
2020-05-20 17:43:06 | INFO |        1.013 |       17           2              0.002 
2020-05-20 17:43:06 | INFO |        1.015 |       18           2              0.002 
2020-05-20 17:43:06 | INFO |        1.017 |       19           2              0.002 
2020-05-20 17:43:06 | INFO |        1.019 |       20           2              0.002 
2020-05-20 17:43:06 | INFO |        1.021 |       21           2              0.002 
2020-05-20 17:43:06 | INFO |        1.023 |       22           2              0.002 
2020-05-20 17:43:06 | INFO |        1.025 |       23           2              0.002 
2020-05-20 17:43:06 | INFO |        1.027 |       24           2              0.002 
2020-05-20 17:43:06 | INFO |        1.029 |       25           2              0.002 
2020-05-20 17:43:06 | INFO |        1.031 |       26           2              0.002 
2020-05-20 17:43:06 | DEBUG | call of SolverReInit ie a new symbolic and numerical factorization will be performed
2020-05-20 17:43:06 | INFO |        1.035 |       27           2              0.004 
2020-05-20 17:43:06 | INFO |        1.039 |       28           2              0.004 
2020-05-20 17:43:06 | INFO |        1.043 |       29           2              0.004 
2020-05-20 17:43:06 | INFO |        1.046 |       30           2              0.004 
2020-05-20 17:43:06 | INFO |        1.050 |       31           2              0.004 
2020-05-20 17:43:06 | INFO |        1.054 |       32           2              0.004 
2020-05-20 17:43:06 | INFO |        1.057 |       33           2              0.004 
2020-05-20 17:43:06 | INFO |        1.061 |       34           2              0.004 
2020-05-20 17:43:06 | INFO |        1.065 |       35           2              0.004 
2020-05-20 17:43:06 | INFO | Algebraic mode change for model SM
2020-05-20 17:43:06 | INFO |        1.067 |       36           2              0.004 
2020-05-20 17:43:06 | INFO | calculation of the new starting point of the simulation.
2020-05-20 17:43:06 | INFO |        1.067 |        0           0              0.000 
2020-05-20 17:43:06 | DEBUG | call of SolverReInit ie a new symbolic and numerical factorization will be performed
2020-05-20 17:43:06 | INFO |        1.067 |        1           1              0.000 
2020-05-20 17:43:06 | INFO |        1.067 |        2           1              0.000 
2020-05-20 17:43:06 | INFO |        1.067 |        3           2              0.000 
2020-05-20 17:43:06 | DEBUG | call of SolverReInit ie a new symbolic and numerical factorization will be performed
2020-05-20 17:43:06 | INFO |        1.067 |        4           2              0.000 
2020-05-20 17:43:06 | DEBUG | call of SolverReInit ie a new symbolic and numerical factorization will be performed
2020-05-20 17:43:06 | INFO |        1.067 |        5           2              0.000 
2020-05-20 17:43:06 | DEBUG | call of SolverReInit ie a new symbolic and numerical factorization will be performed
2020-05-20 17:43:06 | INFO |        1.067 |        6           2              0.000 
2020-05-20 17:43:06 | DEBUG | call of SolverReInit ie a new symbolic and numerical factorization will be performed
2020-05-20 17:43:06 | INFO |        1.067 |        7           2              0.000 
2020-05-20 17:43:06 | DEBUG | call of SolverReInit ie a new symbolic and numerical factorization will be performed
2020-05-20 17:43:06 | INFO |        1.067 |        8           2              0.000 
2020-05-20 17:43:06 | DEBUG | call of SolverReInit ie a new symbolic and numerical factorization will be performed
2020-05-20 17:43:06 | INFO |        1.067 |        9           2              0.000 
2020-05-20 17:43:06 | DEBUG | call of SolverReInit ie a new symbolic and numerical factorization will be performed
2020-05-20 17:43:06 | INFO |        1.068 |       10           2              0.000 
2020-05-20 17:43:06 | DEBUG | call of SolverReInit ie a new symbolic and numerical factorization will be performed
2020-05-20 17:43:06 | INFO |        1.068 |       11           2              0.001 
2020-05-20 17:43:06 | DEBUG | call of SolverReInit ie a new symbolic and numerical factorization will be performed
2020-05-20 17:43:06 | INFO |        1.069 |       12           2              0.001 
2020-05-20 17:43:06 | DEBUG | call of SolverReInit ie a new symbolic and numerical factorization will be performed
2020-05-20 17:43:06 | INFO | Algebraic mode (with J recalculation) change for model Network
2020-05-20 17:43:06 | INFO |        1.070 |       13           2              0.002 
2020-05-20 17:43:06 | INFO | calculation of the new starting point of the simulation.
2020-05-20 17:43:06 | DEBUG | call of SolverReInit ie a new symbolic and numerical factorization will be performed
2020-05-20 17:43:06 | DEBUG | call of SolverReInit ie a new symbolic and numerical factorization will be performed
2020-05-20 17:43:06 | DEBUG | call of SolverReInit ie a new symbolic and numerical factorization will be performed
2020-05-20 17:43:06 | INFO |        1.070 |        0           0              0.000 
2020-05-20 17:43:06 | DEBUG | call of SolverReInit ie a new symbolic and numerical factorization will be performed
2020-05-20 17:43:06 | INFO |        1.070 |        1           1              0.000 
2020-05-20 17:43:06 | INFO |        1.070 |        2           1              0.000 
2020-05-20 17:43:06 | INFO |        1.070 |        3           2              0.000 
2020-05-20 17:43:06 | DEBUG | call of SolverReInit ie a new symbolic and numerical factorization will be performed
2020-05-20 17:43:06 | INFO |        1.070 |        4           2              0.000 
2020-05-20 17:43:06 | DEBUG | call of SolverReInit ie a new symbolic and numerical factorization will be performed
2020-05-20 17:43:06 | INFO |        1.070 |        5           2              0.000 
2020-05-20 17:43:06 | DEBUG | call of SolverReInit ie a new symbolic and numerical factorization will be performed
2020-05-20 17:43:06 | INFO |        1.070 |        6           2              0.000 
2020-05-20 17:43:06 | DEBUG | call of SolverReInit ie a new symbolic and numerical factorization will be performed
2020-05-20 17:43:06 | INFO |        1.070 |        7           2              0.000 
2020-05-20 17:43:06 | DEBUG | call of SolverReInit ie a new symbolic and numerical factorization will be performed
2020-05-20 17:43:06 | INFO |        1.070 |        8           2              0.000 
2020-05-20 17:43:06 | DEBUG | call of SolverReInit ie a new symbolic and numerical factorization will be performed
2020-05-20 17:43:06 | INFO |        1.070 |        9           2              0.000 
2020-05-20 17:43:06 | DEBUG | call of SolverReInit ie a new symbolic and numerical factorization will be performed
2020-05-20 17:43:06 | INFO |        1.071 |       10           2              0.000 
2020-05-20 17:43:06 | DEBUG | call of SolverReInit ie a new symbolic and numerical factorization will be performed
2020-05-20 17:43:06 | INFO |        1.071 |       11           2              0.001 
2020-05-20 17:43:06 | DEBUG | call of SolverReInit ie a new symbolic and numerical factorization will be performed
2020-05-20 17:43:06 | INFO | Algebraic mode change for model SM
2020-05-20 17:43:06 | INFO |        1.071 |       12           2              0.001 
2020-05-20 17:43:06 | INFO | calculation of the new starting point of the simulation.
2020-05-20 17:43:06 | INFO |        1.071 |        0           0              0.000 
2020-05-20 17:43:06 | DEBUG | call of SolverReInit ie a new symbolic and numerical factorization will be performed
2020-05-20 17:43:06 | INFO |        1.071 |        1           1              0.000 
2020-05-20 17:43:06 | INFO |        1.071 |        2           1              0.000 
2020-05-20 17:43:06 | INFO |        1.071 |        3           2              0.000 
2020-05-20 17:43:06 | DEBUG | call of SolverReInit ie a new symbolic and numerical factorization will be performed
2020-05-20 17:43:06 | INFO |        1.071 |        4           2              0.000 
2020-05-20 17:43:06 | DEBUG | call of SolverReInit ie a new symbolic and numerical factorization will be performed
2020-05-20 17:43:06 | INFO |        1.071 |        5           2              0.000 
2020-05-20 17:43:06 | DEBUG | call of SolverReInit ie a new symbolic and numerical factorization will be performed
2020-05-20 17:43:06 | INFO |        1.071 |        6           2              0.000 
2020-05-20 17:43:06 | DEBUG | call of SolverReInit ie a new symbolic and numerical factorization will be performed
2020-05-20 17:43:06 | INFO |        1.071 |        7           2              0.000 
2020-05-20 17:43:06 | DEBUG | call of SolverReInit ie a new symbolic and numerical factorization will be performed
2020-05-20 17:43:06 | INFO |        1.071 |        8           2              0.000 
2020-05-20 17:43:06 | DEBUG | call of SolverReInit ie a new symbolic and numerical factorization will be performed
2020-05-20 17:43:06 | INFO |        1.072 |        9           2              0.000 
2020-05-20 17:43:06 | DEBUG | call of SolverReInit ie a new symbolic and numerical factorization will be performed
2020-05-20 17:43:06 | INFO |        1.072 |       10           2              0.000 
2020-05-20 17:43:06 | DEBUG | call of SolverReInit ie a new symbolic and numerical factorization will be performed
2020-05-20 17:43:06 | INFO |        1.072 |       11           2              0.001 
2020-05-20 17:43:06 | DEBUG | call of SolverReInit ie a new symbolic and numerical factorization will be performed
2020-05-20 17:43:06 | INFO |        1.073 |       12           2              0.001 
2020-05-20 17:43:06 | DEBUG | call of SolverReInit ie a new symbolic and numerical factorization will be performed
2020-05-20 17:43:06 | INFO |        1.075 |       13           2              0.002 
2020-05-20 17:43:06 | INFO |        1.077 |       14           2              0.002 
2020-05-20 17:43:06 | INFO |        1.080 |       15           2              0.002 
2020-05-20 17:43:06 | INFO |        1.082 |       16           2              0.002 
2020-05-20 17:43:06 | INFO |        1.084 |       17           2              0.002 
2020-05-20 17:43:06 | INFO |        1.086 |       18           2              0.002 
2020-05-20 17:43:06 | INFO |        1.088 |       19           2              0.002 
2020-05-20 17:43:06 | INFO |        1.090 |       20           2              0.002 
2020-05-20 17:43:06 | INFO |        1.092 |       21           2              0.002 
2020-05-20 17:43:06 | INFO |        1.094 |       22           2              0.002 
2020-05-20 17:43:06 | DEBUG | call of SolverReInit ie a new symbolic and numerical factorization will be performed
2020-05-20 17:43:06 | INFO |        1.098 |       23           2              0.004 
2020-05-20 17:43:06 | INFO |        1.102 |       24           2              0.004 
2020-05-20 17:43:06 | INFO |        1.105 |       25           2              0.004 
2020-05-20 17:43:06 | INFO |        1.109 |       26           2              0.004 
2020-05-20 17:43:06 | INFO |        1.113 |       27           2              0.004 
2020-05-20 17:43:06 | INFO |        1.116 |       28           2              0.004 
2020-05-20 17:43:06 | INFO |        1.120 |       29           2              0.004 
2020-05-20 17:43:06 | INFO |        1.124 |       30           2              0.004 
2020-05-20 17:43:06 | INFO |        1.127 |       31           2              0.004 
2020-05-20 17:43:06 | DEBUG | call of SolverReInit ie a new symbolic and numerical factorization will be performed
2020-05-20 17:43:06 | INFO |        1.135 |       32           2              0.007 
2020-05-20 17:43:06 | INFO |        1.142 |       33           2              0.007 
2020-05-20 17:43:06 | INFO |        1.150 |       34           2              0.007 
2020-05-20 17:43:06 | INFO |        1.157 |       35           2              0.007 
2020-05-20 17:43:06 | INFO |        1.164 |       36           2              0.007 
2020-05-20 17:43:06 | INFO |        1.172 |       37           2              0.007 
2020-05-20 17:43:06 | INFO |        1.179 |       38           2              0.007 
2020-05-20 17:43:06 | INFO |        1.186 |       39           2              0.007 
2020-05-20 17:43:06 | DEBUG | call of SolverReInit ie a new symbolic and numerical factorization will be performed
2020-05-20 17:43:06 | INFO |        1.201 |       40           2              0.015 
2020-05-20 17:43:06 | INFO |        1.216 |       41           2              0.015 
2020-05-20 17:43:06 | INFO |        1.231 |       42           2              0.015 
2020-05-20 17:43:06 | INFO |        1.245 |       43           2              0.015 
2020-05-20 17:43:06 | INFO |        1.260 |       44           2              0.015 
2020-05-20 17:43:06 | INFO |        1.275 |       45           2              0.015 
2020-05-20 17:43:06 | INFO |        1.290 |       46           2              0.015 
2020-05-20 17:43:06 | INFO |        1.304 |       47           2              0.015 
2020-05-20 17:43:06 | DEBUG | call of SolverReInit ie a new symbolic and numerical factorization will be performed
2020-05-20 17:43:06 | INFO | Algebraic mode change for model SM
2020-05-20 17:43:06 | INFO |        1.316 |       48           2              0.029 
2020-05-20 17:43:06 | INFO | calculation of the new starting point of the simulation.
2020-05-20 17:43:06 | DEBUG | call of SolverReInit ie a new symbolic and numerical factorization will be performed
2020-05-20 17:43:06 | INFO |        1.316 |        0           0              0.000 
2020-05-20 17:43:06 | DEBUG | call of SolverReInit ie a new symbolic and numerical factorization will be performed
2020-05-20 17:43:06 | INFO |        1.316 |        1           1              0.000 
2020-05-20 17:43:06 | INFO |        1.316 |        2           1              0.000 
2020-05-20 17:43:06 | INFO |        1.316 |        3           2              0.000 
2020-05-20 17:43:06 | DEBUG | call of SolverReInit ie a new symbolic and numerical factorization will be performed
2020-05-20 17:43:06 | INFO |        1.316 |        4           2              0.000 
2020-05-20 17:43:06 | DEBUG | call of SolverReInit ie a new symbolic and numerical factorization will be performed
2020-05-20 17:43:06 | INFO |        1.316 |        5           2              0.000 
2020-05-20 17:43:06 | DEBUG | call of SolverReInit ie a new symbolic and numerical factorization will be performed
2020-05-20 17:43:06 | INFO |        1.316 |        6           2              0.000 
2020-05-20 17:43:06 | DEBUG | call of SolverReInit ie a new symbolic and numerical factorization will be performed
2020-05-20 17:43:06 | INFO |        1.316 |        7           2              0.000 
2020-05-20 17:43:06 | DEBUG | call of SolverReInit ie a new symbolic and numerical factorization will be performed
2020-05-20 17:43:06 | INFO |        1.316 |        8           2              0.000 
2020-05-20 17:43:06 | DEBUG | call of SolverReInit ie a new symbolic and numerical factorization will be performed
2020-05-20 17:43:06 | INFO |        1.316 |        9           2              0.000 
2020-05-20 17:43:06 | DEBUG | call of SolverReInit ie a new symbolic and numerical factorization will be performed
2020-05-20 17:43:06 | INFO |        1.316 |       10           2              0.000 
2020-05-20 17:43:06 | DEBUG | call of SolverReInit ie a new symbolic and numerical factorization will be performed
2020-05-20 17:43:06 | INFO |        1.317 |       11           2              0.001 
2020-05-20 17:43:06 | DEBUG | call of SolverReInit ie a new symbolic and numerical factorization will be performed
2020-05-20 17:43:06 | INFO |        1.318 |       12           2              0.001 
2020-05-20 17:43:06 | DEBUG | call of SolverReInit ie a new symbolic and numerical factorization will be performed
2020-05-20 17:43:06 | INFO |        1.320 |       13           2              0.002 
2020-05-20 17:43:06 | DEBUG | call of SolverReInit ie a new symbolic and numerical factorization will be performed
2020-05-20 17:43:06 | INFO |        1.324 |       14           2              0.004 
2020-05-20 17:43:06 | DEBUG | call of SolverReInit ie a new symbolic and numerical factorization will be performed
2020-05-20 17:43:06 | INFO |        1.332 |       15           2              0.008 
2020-05-20 17:43:06 | DEBUG | call of SolverReInit ie a new symbolic and numerical factorization will be performed
2020-05-20 17:43:06 | INFO |        1.349 |       16           2              0.016 
2020-05-20 17:43:06 | INFO |        1.365 |       17           2              0.016 
2020-05-20 17:43:06 | INFO |        1.381 |       18           2              0.016 
2020-05-20 17:43:06 | INFO |        1.398 |       19           2              0.016 
2020-05-20 17:43:06 | DEBUG | call of SolverReInit ie a new symbolic and numerical factorization will be performed
2020-05-20 17:43:06 | INFO |        1.431 |       20           2              0.033 
2020-05-20 17:43:06 | INFO |        1.460 |       21           2              0.029 
2020-05-20 17:43:06 | INFO |        1.490 |       22           2              0.029 
2020-05-20 17:43:06 | INFO |        1.519 |       23           2              0.029 
2020-05-20 17:43:06 | INFO |        1.549 |       24           2              0.029 
2020-05-20 17:43:06 | INFO |        1.578 |       25           2              0.029 
2020-05-20 17:43:06 | INFO |        1.608 |       26           2              0.029 
2020-05-20 17:43:06 | INFO |        1.637 |       27           2              0.029 
2020-05-20 17:43:06 | DEBUG | call of SolverReInit ie a new symbolic and numerical factorization will be performed
2020-05-20 17:43:06 | INFO |        1.667 |       28           2              0.029 
2020-05-20 17:43:06 | INFO |        1.696 |       29           2              0.029 
2020-05-20 17:43:06 | INFO |        1.726 |       30           2              0.029 
2020-05-20 17:43:06 | INFO |        1.755 |       31           2              0.029 
2020-05-20 17:43:06 | INFO |        1.785 |       32           2              0.029 
2020-05-20 17:43:06 | INFO |        1.814 |       33           2              0.029 
2020-05-20 17:43:06 | INFO |        1.843 |       34           2              0.029 
2020-05-20 17:43:06 | INFO |        1.873 |       35           2              0.029 
2020-05-20 17:43:06 | DEBUG | call of SolverReInit ie a new symbolic and numerical factorization will be performed
2020-05-20 17:43:06 | INFO |        1.902 |       36           2              0.029 
2020-05-20 17:43:06 | INFO |        1.932 |       37           2              0.029 
2020-05-20 17:43:06 | INFO |        1.961 |       38           2              0.029 
2020-05-20 17:43:06 | INFO |        1.991 |       39           2              0.029 
2020-05-20 17:43:06 | INFO |        2.020 |       40           2              0.029 
2020-05-20 17:43:06 | INFO |        2.050 |       41           2              0.029 
2020-05-20 17:43:06 | INFO |        2.079 |       42           2              0.029 
2020-05-20 17:43:06 | INFO |        2.109 |       43           2              0.029 
2020-05-20 17:43:06 | INFO |        2.138 |       44           2              0.029 
2020-05-20 17:43:06 | INFO |        2.168 |       45           2              0.029 
2020-05-20 17:43:06 | INFO |        2.197 |       46           2              0.029 
2020-05-20 17:43:06 | INFO |        2.227 |       47           2              0.029 
2020-05-20 17:43:06 | INFO |        2.256 |       48           2              0.029 
2020-05-20 17:43:06 | INFO |        2.286 |       49           2              0.029 
2020-05-20 17:43:06 | INFO |        2.315 |       50           2              0.029 
2020-05-20 17:43:06 | INFO |        2.345 |       51           2              0.029 
2020-05-20 17:43:06 | INFO |        2.374 |       52           2              0.029 
2020-05-20 17:43:06 | INFO |        2.404 |       53           2              0.029 
2020-05-20 17:43:06 | INFO |        2.433 |       54           2              0.029 
2020-05-20 17:43:06 | INFO |        2.463 |       55           2              0.029 
2020-05-20 17:43:06 | INFO |        2.492 |       56           2              0.029 
2020-05-20 17:43:06 | DEBUG | call of SolverReInit ie a new symbolic and numerical factorization will be performed
2020-05-20 17:43:06 | INFO |        2.551 |       57           2              0.059 
2020-05-20 17:43:06 | INFO |        2.604 |       58           2              0.053 
2020-05-20 17:43:06 | INFO |        2.657 |       59           2              0.053 
2020-05-20 17:43:06 | INFO |        2.705 |       60           2              0.048 
2020-05-20 17:43:06 | INFO |        2.752 |       61           2              0.048 
2020-05-20 17:43:06 | INFO |        2.795 |       62           2              0.043 
2020-05-20 17:43:06 | INFO |        2.838 |       63           2              0.043 
2020-05-20 17:43:06 | INFO |        2.881 |       64           2              0.043 
2020-05-20 17:43:06 | INFO |        2.924 |       65           2              0.043 
2020-05-20 17:43:06 | DEBUG | call of SolverReInit ie a new symbolic and numerical factorization will be performed
2020-05-20 17:43:06 | INFO |        2.967 |       66           2              0.043 
2020-05-20 17:43:06 | INFO |        3.010 |       67           2              0.043 
2020-05-20 17:43:06 | INFO |        3.052 |       68           2              0.043 
2020-05-20 17:43:06 | INFO |        3.095 |       69           2              0.043 
2020-05-20 17:43:06 | INFO |        3.138 |       70           2              0.043 
2020-05-20 17:43:06 | INFO |        3.181 |       71           2              0.043 
2020-05-20 17:43:06 | INFO |        3.224 |       72           2              0.043 
2020-05-20 17:43:06 | INFO |        3.267 |       73           2              0.043 
2020-05-20 17:43:06 | INFO |        3.310 |       74           2              0.043 
2020-05-20 17:43:06 | INFO |        3.352 |       75           2              0.043 
2020-05-20 17:43:06 | INFO |        3.395 |       76           2              0.043 
2020-05-20 17:43:06 | INFO |        3.438 |       77           2              0.043 
2020-05-20 17:43:06 | INFO |        3.481 |       78           2              0.043 
2020-05-20 17:43:06 | INFO |        3.524 |       79           2              0.043 
2020-05-20 17:43:06 | INFO |        3.567 |       80           2              0.043 
2020-05-20 17:43:06 | INFO |        3.610 |       81           2              0.043 
2020-05-20 17:43:06 | INFO |        3.652 |       82           2              0.043 
2020-05-20 17:43:06 | INFO |        3.695 |       83           2              0.043 
2020-05-20 17:43:06 | INFO |        3.738 |       84           2              0.043 
2020-05-20 17:43:06 | INFO |        3.781 |       85           2              0.043 
2020-05-20 17:43:06 | INFO |        3.824 |       86           2              0.043 
2020-05-20 17:43:06 | INFO |        3.867 |       87           2              0.043 
2020-05-20 17:43:06 | INFO |        3.910 |       88           2              0.043 
2020-05-20 17:43:06 | INFO |        3.953 |       89           2              0.043 
2020-05-20 17:43:06 | INFO |        3.995 |       90           2              0.043 
2020-05-20 17:43:06 | INFO |        4.038 |       91           2              0.043 
2020-05-20 17:43:06 | INFO |        4.081 |       92           2              0.043 
2020-05-20 17:43:06 | INFO |        4.124 |       93           2              0.043 
2020-05-20 17:43:06 | INFO |        4.167 |       94           2              0.043 
2020-05-20 17:43:06 | INFO |        4.210 |       95           2              0.043 
2020-05-20 17:43:06 | INFO |        4.253 |       96           2              0.043 
2020-05-20 17:43:06 | INFO |        4.295 |       97           2              0.043 
2020-05-20 17:43:06 | INFO |        4.338 |       98           2              0.043 
2020-05-20 17:43:06 | INFO |        4.381 |       99           2              0.043 
2020-05-20 17:43:06 | INFO |        4.424 |      100           2              0.043 
2020-05-20 17:43:06 | INFO |        4.467 |      101           2              0.043 
2020-05-20 17:43:06 | INFO |        4.510 |      102           2              0.043 
2020-05-20 17:43:06 | INFO |        4.553 |      103           2              0.043 
2020-05-20 17:43:06 | INFO |        4.595 |      104           2              0.043 
2020-05-20 17:43:06 | INFO |        4.638 |      105           2              0.043 
2020-05-20 17:43:06 | DEBUG | call of SolverReInit ie a new symbolic and numerical factorization will be performed
2020-05-20 17:43:06 | INFO |        4.724 |      106           2              0.086 
2020-05-20 17:43:06 | INFO |        4.810 |      107           2              0.086 
2020-05-20 17:43:06 | INFO |        4.896 |      108           2              0.086 
2020-05-20 17:43:06 | INFO |        4.981 |      109           2              0.086 
2020-05-20 17:43:06 | DEBUG | call of SolverReInit ie a new symbolic and numerical factorization will be performed
2020-05-20 17:43:06 | INFO |        5.000 |      110           2              0.019 
2020-05-20 17:43:06 | INFO | 
2020-05-20 17:43:06 | INFO | execution statistics :
2020-05-20 17:43:06 | INFO | 
2020-05-20 17:43:06 | INFO | number of time iterations                  = 251
2020-05-20 17:43:06 | INFO | number of residual evaluations             = 380
2020-05-20 17:43:06 | INFO | number of Jacobian evaluations             = 110
2020-05-20 17:43:06 | INFO | number of nonlinear iterations             = 366
2020-05-20 17:43:06 | INFO | number of error test failures              = 0
2020-05-20 17:43:06 | INFO | number of nonlinear convergence failures   = 0
2020-05-20 17:43:06 | INFO | number of root functions evaluations       = 529
2020-05-20 17:43:06 | INFO | number of discrete variables evaluations   = 17
2020-05-20 17:43:06 | INFO | number of mode evaluations                 = 12
2020-05-20 17:43:06 | INFO | end of job 'SMIB_AVR_PSS'
