2023-04-26 11:36:47 | INFO |  ============================================================ 
2023-04-26 11:36:47 | INFO | DYNAWO VERSION  :     1.6.0
2023-04-26 11:36:47 | INFO | DYNAWO REVISION :    master-e473c85d51
2023-04-26 11:36:47 | INFO |  ============================================================ 
2023-04-26 11:36:47 | INFO | 
2023-04-26 11:36:47 | INFO | -----------------------------------------------------------------------
2023-04-26 11:36:47 | INFO | building model from input files
2023-04-26 11:36:47 | INFO | -----------------------------------------------------------------------
2023-04-26 11:36:47 | INFO | model was built successfully
2023-04-26 11:36:47 | INFO | -----------------------------------------------------------------------
2023-04-26 11:36:47 | INFO | 
2023-04-26 11:36:47 | INFO | -----------------------------------------------------------------------
2023-04-26 11:36:47 | INFO | starting local initialization
2023-04-26 11:36:47 | INFO | -----------------------------------------------------------------------
2023-04-26 11:36:47 | INFO | end of local initialization
2023-04-26 11:36:47 | INFO | -----------------------------------------------------------------------
2023-04-26 11:36:47 | INFO | 
2023-04-26 11:36:47 | INFO | -----------------------------------------------------------------------
2023-04-26 11:36:47 | INFO | starting global initialization
2023-04-26 11:36:47 | INFO | -----------------------------------------------------------------------
2023-04-26 11:36:47 | INFO | end of global initialization
2023-04-26 11:36:47 | INFO | -----------------------------------------------------------------------
2023-04-26 11:36:47 | INFO | 
2023-04-26 11:36:47 | INFO | -----------------------------------------------------------------------
2023-04-26 11:36:47 | INFO | starting curve initialization
2023-04-26 11:36:47 | INFO | -----------------------------------------------------------------------
2023-04-26 11:36:47 | INFO | end of curve initialization, added 18 curves
2023-04-26 11:36:47 | INFO | -----------------------------------------------------------------------
2023-04-26 11:36:47 | INFO | 
2023-04-26 11:36:47 | INFO | -----------------------------------------------------------------------
2023-04-26 11:36:47 | INFO | starting simulation with solver IDASolver
2023-04-26 11:36:47 | INFO | -----------------------------------------------------------------------
2023-04-26 11:36:47 | INFO | -----------------------------------------------------------------------
2023-04-26 11:36:47 | INFO | number of continuous variables : 86
2023-04-26 11:36:47 | INFO | number of discrete variables : 20
2023-04-26 11:36:47 | INFO | number of root functions : 24
2023-04-26 11:36:47 | INFO | -----------------------------------------------------------------------
2023-04-26 11:36:47 | INFO |         time | iter num   order (k)      time step (h)
2023-04-26 11:36:47 | INFO | -----------------------------------------------------------------------
2023-04-26 11:36:47 | INFO |        0.000 |        0           0              0.010 
2023-04-26 11:36:47 | INFO |        0.000 |        1           1              0.000 
2023-04-26 11:36:47 | INFO |        0.000 |        2           1              0.000 
2023-04-26 11:36:47 | INFO |        0.000 |        3           2              0.000 
2023-04-26 11:36:47 | INFO |        0.000 |        4           2              0.000 
2023-04-26 11:36:47 | INFO |        0.000 |        5           2              0.000 
2023-04-26 11:36:47 | INFO |        0.000 |        6           2              0.000 
2023-04-26 11:36:47 | INFO |        0.000 |        7           2              0.000 
2023-04-26 11:36:47 | INFO |        0.000 |        8           2              0.000 
2023-04-26 11:36:47 | INFO |        0.000 |        9           2              0.000 
2023-04-26 11:36:47 | INFO |        0.001 |       10           2              0.000 
2023-04-26 11:36:47 | INFO |        0.001 |       11           2              0.001 
2023-04-26 11:36:47 | INFO |        0.002 |       12           2              0.001 
2023-04-26 11:36:47 | INFO |        0.004 |       13           2              0.002 
2023-04-26 11:36:47 | INFO |        0.008 |       14           2              0.004 
2023-04-26 11:36:47 | INFO |        0.016 |       15           2              0.008 
2023-04-26 11:36:47 | INFO |        0.033 |       16           2              0.016 
2023-04-26 11:36:47 | INFO |        0.066 |       17           2              0.033 
2023-04-26 11:36:47 | INFO |        0.131 |       18           1              0.066 
2023-04-26 11:36:47 | INFO |        0.262 |       19           1              0.131 
2023-04-26 11:36:47 | INFO |        0.524 |       20           1              0.262 
2023-04-26 11:36:47 | INFO | Algebraic mode (with J recalculation) change at t = 1
2023-04-26 11:36:47 | INFO |        1.000 |       21           1              0.524 
2023-04-26 11:36:47 | INFO | calculation of the new starting point of the simulation.
2023-04-26 11:36:47 | INFO |        1.000 |        0           0              0.000 
2023-04-26 11:36:47 | INFO |        1.000 |        1           1              0.000 
2023-04-26 11:36:47 | INFO |        1.000 |        2           1              0.000 
2023-04-26 11:36:47 | INFO |        1.000 |        3           2              0.000 
2023-04-26 11:36:47 | INFO |        1.000 |        4           2              0.000 
2023-04-26 11:36:47 | INFO |        1.000 |        5           2              0.000 
2023-04-26 11:36:47 | INFO |        1.000 |        6           2              0.000 
2023-04-26 11:36:47 | INFO |        1.000 |        7           2              0.000 
2023-04-26 11:36:47 | INFO |        1.000 |        8           2              0.000 
2023-04-26 11:36:47 | INFO |        1.000 |        9           2              0.000 
2023-04-26 11:36:47 | INFO |        1.001 |       10           2              0.000 
2023-04-26 11:36:47 | INFO | Algebraic mode change at t = 1.00054
2023-04-26 11:36:47 | INFO |        1.001 |       11           2              0.001 
2023-04-26 11:36:47 | INFO | calculation of the new starting point of the simulation.
2023-04-26 11:36:47 | INFO |        1.001 |        0           0              0.000 
2023-04-26 11:36:47 | INFO |        1.001 |        1           1              0.000 
2023-04-26 11:36:47 | INFO |        1.001 |        2           1              0.000 
2023-04-26 11:36:47 | INFO |        1.001 |        3           2              0.000 
2023-04-26 11:36:47 | INFO |        1.001 |        4           2              0.000 
2023-04-26 11:36:47 | INFO |        1.001 |        5           2              0.000 
2023-04-26 11:36:47 | INFO |        1.001 |        6           2              0.000 
2023-04-26 11:36:47 | INFO |        1.001 |        7           2              0.000 
2023-04-26 11:36:47 | INFO |        1.001 |        8           2              0.000 
2023-04-26 11:36:47 | INFO |        1.001 |        9           2              0.000 
2023-04-26 11:36:47 | INFO |        1.001 |       10           2              0.000 
2023-04-26 11:36:47 | INFO |        1.002 |       11           2              0.001 
2023-04-26 11:36:47 | INFO |        1.003 |       12           2              0.001 
2023-04-26 11:36:47 | INFO |        1.005 |       13           2              0.002 
2023-04-26 11:36:47 | INFO |        1.007 |       14           2              0.002 
2023-04-26 11:36:47 | INFO |        1.009 |       15           2              0.002 
2023-04-26 11:36:47 | INFO |        1.011 |       16           2              0.002 
2023-04-26 11:36:47 | INFO |        1.013 |       17           2              0.002 
2023-04-26 11:36:47 | INFO |        1.015 |       18           2              0.002 
2023-04-26 11:36:47 | INFO |        1.017 |       19           2              0.002 
2023-04-26 11:36:47 | INFO |        1.019 |       20           2              0.002 
2023-04-26 11:36:47 | INFO |        1.021 |       21           2              0.002 
2023-04-26 11:36:47 | INFO |        1.023 |       22           2              0.002 
2023-04-26 11:36:47 | INFO |        1.025 |       23           2              0.002 
2023-04-26 11:36:47 | INFO |        1.027 |       24           2              0.002 
2023-04-26 11:36:47 | INFO |        1.029 |       25           2              0.002 
2023-04-26 11:36:47 | INFO |        1.033 |       26           2              0.004 
2023-04-26 11:36:47 | INFO |        1.037 |       27           2              0.004 
2023-04-26 11:36:47 | INFO |        1.041 |       28           2              0.004 
2023-04-26 11:36:47 | INFO |        1.044 |       29           2              0.004 
2023-04-26 11:36:47 | INFO |        1.048 |       30           2              0.004 
2023-04-26 11:36:47 | INFO |        1.052 |       31           2              0.004 
2023-04-26 11:36:47 | INFO |        1.055 |       32           2              0.004 
2023-04-26 11:36:47 | INFO |        1.059 |       33           2              0.004 
2023-04-26 11:36:47 | INFO |        1.063 |       34           2              0.004 
2023-04-26 11:36:47 | INFO |        1.066 |       35           2              0.004 
2023-04-26 11:36:47 | INFO | Algebraic mode change at t = 1.06712
2023-04-26 11:36:47 | INFO |        1.067 |       36           2              0.007 
2023-04-26 11:36:47 | INFO | calculation of the new starting point of the simulation.
2023-04-26 11:36:47 | INFO |        1.067 |        0           0              0.000 
2023-04-26 11:36:47 | INFO |        1.067 |        1           1              0.000 
2023-04-26 11:36:47 | INFO |        1.067 |        2           1              0.000 
2023-04-26 11:36:47 | INFO |        1.067 |        3           2              0.000 
2023-04-26 11:36:47 | INFO |        1.067 |        4           2              0.000 
2023-04-26 11:36:47 | INFO |        1.067 |        5           2              0.000 
2023-04-26 11:36:47 | INFO |        1.067 |        6           2              0.000 
2023-04-26 11:36:47 | INFO |        1.067 |        7           2              0.000 
2023-04-26 11:36:47 | INFO |        1.067 |        8           2              0.000 
2023-04-26 11:36:47 | INFO |        1.067 |        9           2              0.000 
2023-04-26 11:36:47 | INFO |        1.068 |       10           2              0.000 
2023-04-26 11:36:47 | INFO |        1.068 |       11           2              0.001 
2023-04-26 11:36:47 | INFO |        1.069 |       12           2              0.001 
2023-04-26 11:36:47 | INFO | Algebraic mode (with J recalculation) change at t = 1.07
2023-04-26 11:36:47 | INFO |        1.070 |       13           2              0.002 
2023-04-26 11:36:47 | INFO | calculation of the new starting point of the simulation.
2023-04-26 11:36:47 | INFO |        1.070 |        0           0              0.000 
2023-04-26 11:36:47 | INFO |        1.070 |        1           1              0.000 
2023-04-26 11:36:47 | INFO |        1.070 |        2           1              0.000 
2023-04-26 11:36:47 | INFO |        1.070 |        3           2              0.000 
2023-04-26 11:36:47 | INFO |        1.070 |        4           2              0.000 
2023-04-26 11:36:47 | INFO |        1.070 |        5           2              0.000 
2023-04-26 11:36:47 | INFO |        1.070 |        6           2              0.000 
2023-04-26 11:36:47 | INFO |        1.070 |        7           2              0.000 
2023-04-26 11:36:47 | INFO |        1.070 |        8           2              0.000 
2023-04-26 11:36:47 | INFO |        1.070 |        9           2              0.000 
2023-04-26 11:36:47 | INFO |        1.071 |       10           2              0.000 
2023-04-26 11:36:47 | INFO |        1.071 |       11           2              0.001 
2023-04-26 11:36:47 | INFO | Algebraic mode change at t = 1.07133
2023-04-26 11:36:47 | INFO |        1.071 |       12           2              0.001 
2023-04-26 11:36:47 | INFO | calculation of the new starting point of the simulation.
2023-04-26 11:36:47 | INFO |        1.071 |        0           0              0.000 
2023-04-26 11:36:47 | INFO |        1.071 |        1           1              0.000 
2023-04-26 11:36:47 | INFO |        1.071 |        2           1              0.000 
2023-04-26 11:36:47 | INFO |        1.071 |        3           2              0.000 
2023-04-26 11:36:47 | INFO |        1.071 |        4           2              0.000 
2023-04-26 11:36:47 | INFO |        1.071 |        5           2              0.000 
2023-04-26 11:36:47 | INFO |        1.071 |        6           2              0.000 
2023-04-26 11:36:47 | INFO |        1.071 |        7           2              0.000 
2023-04-26 11:36:47 | INFO |        1.071 |        8           2              0.000 
2023-04-26 11:36:47 | INFO |        1.072 |        9           2              0.000 
2023-04-26 11:36:47 | INFO |        1.072 |       10           2              0.000 
2023-04-26 11:36:47 | INFO |        1.072 |       11           2              0.001 
2023-04-26 11:36:47 | INFO |        1.073 |       12           2              0.001 
2023-04-26 11:36:47 | INFO |        1.075 |       13           2              0.002 
2023-04-26 11:36:47 | INFO |        1.077 |       14           2              0.002 
2023-04-26 11:36:47 | INFO |        1.080 |       15           2              0.002 
2023-04-26 11:36:47 | INFO |        1.082 |       16           2              0.002 
2023-04-26 11:36:47 | INFO |        1.084 |       17           2              0.002 
2023-04-26 11:36:47 | INFO |        1.086 |       18           2              0.002 
2023-04-26 11:36:47 | INFO |        1.088 |       19           2              0.002 
2023-04-26 11:36:47 | INFO |        1.090 |       20           2              0.002 
2023-04-26 11:36:47 | INFO |        1.092 |       21           2              0.002 
2023-04-26 11:36:47 | INFO |        1.096 |       22           2              0.004 
2023-04-26 11:36:47 | INFO |        1.100 |       23           2              0.004 
2023-04-26 11:36:47 | INFO |        1.103 |       24           2              0.004 
2023-04-26 11:36:47 | INFO |        1.107 |       25           2              0.004 
2023-04-26 11:36:47 | INFO |        1.111 |       26           2              0.004 
2023-04-26 11:36:47 | INFO |        1.114 |       27           2              0.004 
2023-04-26 11:36:47 | INFO |        1.118 |       28           2              0.004 
2023-04-26 11:36:47 | INFO |        1.122 |       29           2              0.004 
2023-04-26 11:36:47 | INFO |        1.125 |       30           2              0.004 
2023-04-26 11:36:47 | INFO |        1.133 |       31           2              0.007 
2023-04-26 11:36:47 | INFO |        1.140 |       32           2              0.007 
2023-04-26 11:36:47 | INFO |        1.148 |       33           2              0.007 
2023-04-26 11:36:47 | INFO |        1.155 |       34           2              0.007 
2023-04-26 11:36:47 | INFO |        1.162 |       35           2              0.007 
2023-04-26 11:36:47 | INFO |        1.170 |       36           2              0.007 
2023-04-26 11:36:47 | INFO |        1.177 |       37           2              0.007 
2023-04-26 11:36:47 | INFO |        1.184 |       38           2              0.007 
2023-04-26 11:36:47 | INFO |        1.199 |       39           2              0.015 
2023-04-26 11:36:47 | INFO |        1.214 |       40           2              0.015 
2023-04-26 11:36:47 | INFO |        1.229 |       41           2              0.015 
2023-04-26 11:36:47 | INFO |        1.243 |       42           2              0.015 
2023-04-26 11:36:47 | INFO |        1.258 |       43           2              0.015 
2023-04-26 11:36:47 | INFO |        1.273 |       44           2              0.015 
2023-04-26 11:36:47 | INFO |        1.288 |       45           2              0.015 
2023-04-26 11:36:47 | INFO |        1.302 |       46           2              0.015 
2023-04-26 11:36:47 | INFO | Algebraic mode change at t = 1.3159
2023-04-26 11:36:47 | INFO |        1.316 |       47           2              0.029 
2023-04-26 11:36:47 | INFO | calculation of the new starting point of the simulation.
2023-04-26 11:36:47 | INFO |        1.316 |        0           0              0.000 
2023-04-26 11:36:47 | INFO | Algebraic mode change at t = 1.3159
2023-04-26 11:36:47 | INFO |        1.316 |        1           1              0.000 
2023-04-26 11:36:47 | INFO | calculation of the new starting point of the simulation.
2023-04-26 11:36:47 | INFO |        1.316 |        0           0              0.000 
2023-04-26 11:36:47 | INFO |        1.316 |        1           1              0.000 
2023-04-26 11:36:47 | INFO |        1.316 |        2           1              0.000 
2023-04-26 11:36:47 | INFO |        1.316 |        3           2              0.000 
2023-04-26 11:36:47 | INFO |        1.316 |        4           2              0.000 
2023-04-26 11:36:47 | INFO |        1.316 |        5           2              0.000 
2023-04-26 11:36:47 | INFO |        1.316 |        6           2              0.000 
2023-04-26 11:36:47 | INFO |        1.316 |        7           2              0.000 
2023-04-26 11:36:47 | INFO |        1.316 |        8           2              0.000 
2023-04-26 11:36:47 | INFO |        1.316 |        9           2              0.000 
2023-04-26 11:36:47 | INFO |        1.316 |       10           2              0.000 
2023-04-26 11:36:47 | INFO |        1.317 |       11           2              0.001 
2023-04-26 11:36:47 | INFO |        1.318 |       12           2              0.001 
2023-04-26 11:36:47 | INFO |        1.320 |       13           2              0.002 
2023-04-26 11:36:47 | INFO |        1.324 |       14           2              0.004 
2023-04-26 11:36:47 | INFO |        1.332 |       15           2              0.008 
2023-04-26 11:36:47 | INFO |        1.349 |       16           2              0.016 
2023-04-26 11:36:47 | INFO |        1.365 |       17           2              0.016 
2023-04-26 11:36:47 | INFO |        1.381 |       18           2              0.016 
2023-04-26 11:36:47 | INFO |        1.398 |       19           2              0.016 
2023-04-26 11:36:47 | INFO |        1.431 |       20           2              0.033 
2023-04-26 11:36:47 | INFO |        1.460 |       21           2              0.029 
2023-04-26 11:36:47 | INFO |        1.490 |       22           2              0.029 
2023-04-26 11:36:47 | INFO |        1.519 |       23           2              0.029 
2023-04-26 11:36:47 | INFO |        1.549 |       24           2              0.029 
2023-04-26 11:36:47 | INFO |        1.578 |       25           2              0.029 
2023-04-26 11:36:47 | INFO |        1.608 |       26           2              0.029 
2023-04-26 11:36:47 | INFO |        1.637 |       27           2              0.029 
2023-04-26 11:36:47 | INFO |        1.667 |       28           2              0.029 
2023-04-26 11:36:47 | INFO |        1.696 |       29           2              0.029 
2023-04-26 11:36:47 | INFO |        1.725 |       30           2              0.029 
2023-04-26 11:36:47 | INFO |        1.755 |       31           2              0.029 
2023-04-26 11:36:47 | INFO |        1.784 |       32           2              0.029 
2023-04-26 11:36:47 | INFO |        1.814 |       33           2              0.029 
2023-04-26 11:36:47 | INFO |        1.843 |       34           2              0.029 
2023-04-26 11:36:47 | INFO |        1.873 |       35           2              0.029 
2023-04-26 11:36:47 | INFO |        1.902 |       36           2              0.029 
2023-04-26 11:36:47 | INFO |        1.932 |       37           2              0.029 
2023-04-26 11:36:47 | INFO |        1.961 |       38           2              0.029 
2023-04-26 11:36:47 | INFO |        1.991 |       39           2              0.029 
2023-04-26 11:36:47 | INFO |        2.020 |       40           2              0.029 
2023-04-26 11:36:47 | INFO |        2.050 |       41           2              0.029 
2023-04-26 11:36:47 | INFO |        2.079 |       42           2              0.029 
2023-04-26 11:36:47 | INFO |        2.109 |       43           2              0.029 
2023-04-26 11:36:47 | INFO |        2.138 |       44           2              0.029 
2023-04-26 11:36:47 | INFO |        2.168 |       45           2              0.029 
2023-04-26 11:36:47 | INFO |        2.197 |       46           2              0.029 
2023-04-26 11:36:47 | INFO |        2.227 |       47           2              0.029 
2023-04-26 11:36:47 | INFO |        2.256 |       48           2              0.029 
2023-04-26 11:36:47 | INFO |        2.286 |       49           2              0.029 
2023-04-26 11:36:47 | INFO |        2.315 |       50           2              0.029 
2023-04-26 11:36:47 | INFO |        2.345 |       51           2              0.029 
2023-04-26 11:36:47 | INFO |        2.374 |       52           2              0.029 
2023-04-26 11:36:47 | INFO |        2.404 |       53           2              0.029 
2023-04-26 11:36:47 | INFO |        2.433 |       54           2              0.029 
2023-04-26 11:36:47 | INFO |        2.463 |       55           2              0.029 
2023-04-26 11:36:47 | INFO |        2.522 |       56           2              0.059 
2023-04-26 11:36:47 | INFO |        2.575 |       57           2              0.053 
2023-04-26 11:36:47 | INFO |        2.628 |       58           2              0.053 
2023-04-26 11:36:47 | INFO |        2.681 |       59           2              0.053 
2023-04-26 11:36:47 | INFO |        2.729 |       60           2              0.048 
2023-04-26 11:36:47 | INFO |        2.777 |       61           2              0.048 
2023-04-26 11:36:47 | INFO |        2.820 |       62           2              0.043 
2023-04-26 11:36:47 | INFO |        2.863 |       63           2              0.043 
2023-04-26 11:36:47 | INFO |        2.906 |       64           2              0.043 
2023-04-26 11:36:47 | INFO |        2.949 |       65           2              0.043 
2023-04-26 11:36:47 | INFO |        2.992 |       66           2              0.043 
2023-04-26 11:36:47 | INFO |        3.035 |       67           2              0.043 
2023-04-26 11:36:47 | INFO |        3.078 |       68           2              0.043 
2023-04-26 11:36:47 | INFO |        3.121 |       69           2              0.043 
2023-04-26 11:36:47 | INFO |        3.164 |       70           2              0.043 
2023-04-26 11:36:47 | INFO |        3.207 |       71           2              0.043 
2023-04-26 11:36:47 | INFO |        3.250 |       72           2              0.043 
2023-04-26 11:36:47 | INFO |        3.293 |       73           2              0.043 
2023-04-26 11:36:47 | INFO |        3.336 |       74           2              0.043 
2023-04-26 11:36:47 | INFO |        3.379 |       75           2              0.043 
2023-04-26 11:36:47 | INFO |        3.422 |       76           2              0.043 
2023-04-26 11:36:47 | INFO |        3.465 |       77           2              0.043 
2023-04-26 11:36:47 | INFO |        3.508 |       78           2              0.043 
2023-04-26 11:36:47 | INFO |        3.551 |       79           2              0.043 
2023-04-26 11:36:47 | INFO |        3.594 |       80           2              0.043 
2023-04-26 11:36:47 | INFO |        3.637 |       81           2              0.043 
2023-04-26 11:36:47 | INFO |        3.680 |       82           2              0.043 
2023-04-26 11:36:47 | INFO |        3.723 |       83           2              0.043 
2023-04-26 11:36:47 | INFO |        3.766 |       84           2              0.043 
2023-04-26 11:36:47 | INFO |        3.809 |       85           2              0.043 
2023-04-26 11:36:47 | INFO |        3.852 |       86           2              0.043 
2023-04-26 11:36:47 | INFO |        3.895 |       87           2              0.043 
2023-04-26 11:36:47 | INFO |        3.938 |       88           2              0.043 
2023-04-26 11:36:47 | INFO |        3.981 |       89           2              0.043 
2023-04-26 11:36:47 | INFO |        4.024 |       90           2              0.043 
2023-04-26 11:36:47 | INFO |        4.067 |       91           2              0.043 
2023-04-26 11:36:47 | INFO |        4.110 |       92           2              0.043 
2023-04-26 11:36:47 | INFO |        4.153 |       93           2              0.043 
2023-04-26 11:36:47 | INFO |        4.196 |       94           2              0.043 
2023-04-26 11:36:47 | INFO |        4.239 |       95           2              0.043 
2023-04-26 11:36:47 | INFO |        4.281 |       96           2              0.043 
2023-04-26 11:36:47 | INFO |        4.324 |       97           2              0.043 
2023-04-26 11:36:47 | INFO |        4.367 |       98           2              0.043 
2023-04-26 11:36:47 | INFO |        4.410 |       99           2              0.043 
2023-04-26 11:36:47 | INFO |        4.453 |      100           2              0.043 
2023-04-26 11:36:47 | INFO |        4.496 |      101           2              0.043 
2023-04-26 11:36:47 | INFO |        4.539 |      102           2              0.043 
2023-04-26 11:36:47 | INFO |        4.582 |      103           2              0.043 
2023-04-26 11:36:47 | INFO |        4.668 |      104           2              0.086 
2023-04-26 11:36:47 | INFO |        4.754 |      105           2              0.086 
2023-04-26 11:36:47 | INFO |        4.840 |      106           2              0.086 
2023-04-26 11:36:47 | INFO |        4.926 |      107           2              0.086 
2023-04-26 11:36:47 | INFO |        5.000 |      108           2              0.074 
2023-04-26 11:36:47 | INFO | 
2023-04-26 11:36:47 | INFO | execution statistics :
2023-04-26 11:36:47 | INFO | 
2023-04-26 11:36:47 | INFO | number of time iterations                  = 249
2023-04-26 11:36:47 | INFO | number of residual evaluations             = 369
2023-04-26 11:36:47 | INFO | number of Jacobian evaluations             = 111
2023-04-26 11:36:47 | INFO | number of nonlinear iterations             = 353
2023-04-26 11:36:47 | INFO | number of error test failures              = 0
2023-04-26 11:36:47 | INFO | number of nonlinear convergence failures   = 2
2023-04-26 11:36:47 | INFO | number of root functions evaluations       = 530
2023-04-26 11:36:47 | INFO | number of discrete variables evaluations   = 16
2023-04-26 11:36:47 | INFO | number of mode evaluations                 = 14
2023-04-26 11:36:47 | INFO | end of job 'Kundur Example 13 - VRKundur and PssKundur case'
